word,pronunication,tf,df,years,year_first,year_recent
leanings,L IY1 N IH0 NG Z,396133,272194,247,1572,2008
leann,L IY0 AE1 N,487,323,91,1700,2008
leans,L IY1 N Z,723598,403900,340,1515,2008
leant,L IY1 AH0 N T,333582,145272,309,1505,2008
leanza,L IY0 AE1 N Z AH0,80,71,41,1805,2006
leap,L IY1 P,2941571,1311083,371,1515,2008
leaped,L EH1 P T,1758875,631942,343,1507,2008
leapfrog,L IY1 P F R AO2 G,65540,44944,188,1768,2008
leapfrogged,L IY1 P F R AO2 G D,16323,14663,93,1808,2008
leapfrogging,L IY1 P F R AO2 G IH0 NG,31333,21413,101,1872,2008
leaping,L IY1 P IH0 NG,1172483,636046,356,1563,2008
leaps,L IY1 P S,1025599,624113,334,1572,2008
leapt,L EH1 P T,869904,369846,341,1581,2008
lear,L IH1 R,152313,80476,316,1606,2008
leard,L ER1 D,1334,1210,215,1593,2008
learn,L ER1 N,35678407,3477937,398,1505,2008
learned,L ER1 N D,34955529,3371129,418,1505,2008
learner,L ER1 N ER0,2391872,307313,297,1581,2008
learners,L ER1 N ER0 Z,2758203,241342,282,1581,2008
learning,L ER1 N IH0 NG,43161671,2955922,409,1505,2008
learns,L ER1 N Z,2874926,1075377,341,1587,2008
learnt,L ER1 N T,3441277,853243,371,1515,2008
leary,L IH1 R IY0,5949,4821,171,1685,2008
leas,L IY1 Z,91767,64228,315,1607,2008
leasable,L IY1 S AH0 B AH0 L,8558,3515,133,1725,2008
lease,L IY1 S,6401195,825157,367,1524,2008
leaseback,L IY1 S B AE2 K,63951,10726,72,1600,2008
leasebacks,L IY1 S B AE2 K S,5994,2504,63,1928,2008
leased,L IY1 S T,1664507,477918,325,1572,2008
leasehold,L IY1 S HH OW2 L D,345851,75093,252,1589,2008
leaser,L IY1 S ER0,6699,5657,235,1607,2008
leases,L IY1 S IH0 Z,1660294,327472,332,1563,2008
leash,L IY1 SH,476990,214311,265,1620,2008
leashed,L IY1 SH T,37220,27532,197,1705,2008
leashes,L IY1 SH IH0 Z,48172,31126,209,1645,2008
leasing,L IY1 S IH0 NG,969971,265319,301,1581,2008
leask,L IY1 S K,95,82,51,1717,2006
leason,L IY1 S AH0 N,2804,2492,269,1671,2008
least,L IY1 S T,108886968,4242862,423,1505,2008
leasure,L EH1 ZH ER0,16624,10116,321,1572,2008
leath,L IY1 TH,5703,4699,249,1670,2008
leathem,L EH1 TH IH0 M,173,128,85,1726,2008
leather,L EH1 DH ER0,6442778,1454062,353,1524,2008
leatherback,L EH1 DH ER0 B AE2 K,16545,5175,106,1817,2008
leatherbacks,L EH1 DH ER0 B AE2 K S,4418,1163,67,1905,2008
leatherman,L EH1 DH ER0 M AH0 N,1608,822,53,1888,2008
leathers,L EH1 DH ER0 Z,129626,59293,277,1603,2008
leatherwood,L EH1 DH ER0 W UH2 D,2365,1394,148,1809,2008
leathery,L EH1 DH ER0 IY0,290633,150678,239,1732,2008
leaton,L IY1 T AH0 N,123,111,64,1768,2008
leave,L IY1 V,53194543,3880539,411,1505,2008
leavell,L IY1 V AH0 L,157,142,61,1809,2008
leaven,L EH1 V AH0 N,404041,216196,345,1590,2008
leavened,L EH1 V AH0 N D,140268,93299,320,1581,2008
leavening,L EH1 V AH0 N IH0 NG,96321,59372,223,1650,2008
leavens,L EH1 V AH0 N Z,15191,13015,248,1682,2008
leavenworth,L EH1 V AH0 N W ER2 TH,231,192,64,1858,2008
leaver,L IY1 V ER0,32290,17822,284,1667,2008
leaves,L IY1 V Z,28307038,3351550,401,1505,2008
leavey,L IY1 V IY0,72,64,39,1769,2008
leaving,L IY1 V IH0 NG,27276509,3625217,400,1507,2008
leavings,L IY1 V IH0 NG Z,80102,63189,279,1581,2008
leavins,L IY1 V IH0 N Z,453,377,119,1809,2008
leavitt,L EH1 V IH0 T,479,336,83,1831,2008
leavy,L IY1 V IY0,3745,3052,236,1645,2008
leazer,L IY1 Z ER0,65,59,45,1728,2008
lebanese,L EH1 B AH0 N IY2 Z,1193,371,50,1948,2008
lebanon,L EH1 B AH0 N AH0 N,2221,1127,135,1807,2008
lebar,L IH0 B AA1 R,1579,647,104,1705,2008
lebeau,L IH0 B OW1,323,129,47,1829,2008
lebeck,L IY1 B EH0 K,205,146,62,1736,2008
lebed,L EH1 B EH0 D,393,254,64,1803,2008
lebeda,L EY0 B EY1 D AH0,406,86,47,1878,2006
lebel,L EH1 B AH0 L,1256,1002,142,1710,2008
leben,L EH1 B AH0 N,75284,31973,214,1705,2008
leber,L IY1 B ER0,1664,1112,157,1758,2008
lebert,L EH1 B ER0 T,127,109,56,1821,2008
leblanc,L AH0 B L AE1 NG K,325,179,68,1859,2008
leble,L EH1 B AH0 L,106,92,55,1860,2008
leblond,L IH0 B L AA1 N D,340,102,37,1925,2008
lebo,L EY1 B OW0,648,382,95,1807,2008
lebon,L EH1 B AH0 N,266,230,83,1807,2008
lebow,L AH0 B OW1,78,69,38,1766,2008
lebowitz,L EH1 B AH0 W IH0 T S,72,52,28,1937,2007
lebreton,L EH1 B R IH0 T AA0 N,58,41,28,1934,2008
lebron,L EH1 B R AH0 N,207,161,54,1887,2008
lebrun,L EH1 B R AH0 N,369,215,70,1819,2008
leccese,L EH0 CH EY1 Z IY0,217,135,43,1910,2008
lech,L EH1 K,11418,8401,267,1644,2008
lecher,L EH1 CH ER0,36521,28597,228,1620,2008
lecherous,L EH1 CH ER0 AH0 S,102503,75853,243,1568,2008
lechner,L EH1 K N ER0,185,109,55,1869,2008
lechuga,L EH1 CH UW0 G AH0,2480,1291,119,1839,2008
lecithin,L EH1 S AH0 TH AH0 N,266599,44448,152,1785,2008
leck,L EH1 K,2524,1657,185,1638,2008
leckie,L EH1 K IY0,124,106,57,1819,2008
leclair,L EH1 K L ER0,91,55,33,1874,2008
leclerc,L AH0 K L ER1 K,324,244,66,1832,2008
leclercq,L EH1 K L ER0 K,234,124,50,1901,2008
lecli,L EH1 K L IY0,78,52,40,1721,2007
lecompte,L EH1 K AH0 M P T,90,46,32,1857,2008
lecomte,L IH0 K AA1 M T,173,138,62,1823,2008
leconte,L EH0 K OW1 N T IY0,162,116,58,1720,2008
lecount,L IH0 K UW1 N T,73,68,56,1762,2008
lecter,L EH1 K T ER0,771,670,158,1744,2008
lectern,L EH1 K T ER0 N,161184,80404,183,1563,2008
lector,L EH1 K T ER0,85384,39242,299,1507,2008
lecture,L EH1 K CH ER0,6098533,1470806,336,1563,2008
lectured,L EH1 K CH ER0 D,753062,428970,274,1520,2008
lecturer,L EH1 K CH ER0 ER0,1453685,571811,285,1563,2008
lecturers,L EH1 K CH ER0 ER0 Z,573865,250899,265,1644,2008
lectures,L EH1 K CH ER0 Z,5781641,1346084,326,1520,2008
lecturing,L EH1 K CH ER0 IH0 NG,706713,401267,260,1611,2008
lecy,L IY1 S IY0,73,67,51,1811,2008
led,L EH1 D,50940878,3806694,413,1505,2008
leda,L IY1 D AH0,6847,3066,183,1682,2008
leday,L IY1 D EY0,196,178,64,1881,2008
ledbetter,L EH1 D B ER0 T ER0,151,108,44,1922,2008
ledden,L EH1 D AH0 N,303,264,102,1774,2008
leddy,L EH1 D IY0,25149,7201,200,1771,2008
leder,L EH1 D ER0,5586,2744,174,1584,2008
lederer,L EH1 D ER0 ER0,381,298,62,1894,2008
lederman,L IY1 D ER0 M AH0 N,173,110,42,1953,2008
ledesma,L EH0 D EH1 S M AH0,72,53,29,1912,2008
ledet,L EH1 D IH0 T,1385,541,97,1791,2008
ledford,L EH1 D F ER0 D,82,59,39,1835,2008
ledge,L EH1 JH,1297895,507883,365,1579,2008
ledger,L EH1 JH ER0,1225613,256064,262,1572,2008
ledgers,L EH1 JH ER0 Z,264505,116712,236,1600,2008
ledges,L EH1 JH IH0 Z,433053,195456,336,1630,2008
ledin,L EH1 D IH0 N,227,213,85,1721,2008
ledo,L EY1 D OW0,2156,1572,230,1679,2008
ledoux,L IH0 D UW1,213,127,50,1894,2008
ledyard,L EH1 D Y ER0 D,122,107,53,1834,2008
lee,L IY1,689599,266124,371,1575,2008
leeb,L IY1 B,411,326,80,1800,2008
leece,L IY1 S,1135,778,118,1656,2008
leech,L IY1 CH,254334,109437,278,1593,2008
leeches,L IY1 CH IH0 Z,325398,126537,284,1568,2008
leed,L IY1 D,11135,8241,257,1568,2008
leeder,L IY1 D ER0,995,480,101,1790,2008
leedham,L IY1 D HH AH0 M,74,61,34,1901,2008
leeds,L IY1 D Z,5309,3578,232,1688,2008
leedy,L IY1 D IY0,383,224,106,1721,2008
leek,L IY1 K,121909,53502,343,1581,2008
leeks,L IY1 K S,168225,62440,300,1584,2008
leeman,L IY1 M AH0 N,146,117,61,1853,2008
leeming,L IY1 M IH0 NG,375,298,142,1676,2008
leemon,L IY1 M AH0 N,45,40,26,1840,2008
leen,L IY1 N,17417,11644,331,1631,2008
leena,L IY1 N AH0,376,241,74,1692,2008
leep,L IY1 P,5453,4794,259,1679,2008
leeper,L IY1 P ER0,509,457,137,1802,2008
leery,L IH1 R IY0,88167,71849,169,1631,2008
lees,L IY1 Z,135488,83402,336,1515,2008
leesburg,L IY1 Z B ER0 G,70,55,33,1823,2008
leese,L IY1 S,5977,3543,239,1572,2008
leeser,L IY1 S ER0,207,178,88,1824,2008
leeson,L IY1 S AH0 N,471,368,127,1574,2008
leet,L IY1 T,79375,28009,280,1568,2008
leete,L IY1 T,712,498,163,1727,2008
leeth,L IY1 TH,1163,1007,215,1655,2008
leeuwen,L UW1 AH0 N,434,284,64,1846,2008
leever,L IY1 V ER0,211,179,72,1799,2008
leeward,L IY1 W ER0 D,398280,113097,276,1575,2008
leeway,L IY1 W EY2,339669,225494,222,1607,2008
lefcourt,L EH1 F K AO2 R T,61,40,19,1969,2008
lefebvre,L AH0 F EY1 B ER0,521,381,72,1850,2008
lefever,L AH0 F EY1 V ER0,97,65,38,1903,2008
lefevre,L AH0 F EY1 V ER0,425,287,88,1843,2008
leff,L EH1 F,7874,4889,231,1631,2008
leffel,L EH1 F AH0 L,112,81,39,1763,2008
leffingwell,L EH1 F IH0 NG G W EH0 L,79,66,38,1866,2008
leffler,L EH1 F L ER0,79,61,39,1861,2008
lefkowitz,L EH1 F K AH0 W IH0 T S,173,108,39,1955,2007
lefler,L EH1 F L ER0,2735,1625,242,1581,2008
lefort,L EH1 F ER0 T,197,155,80,1727,2008
lefrere,L AH0 F R EH1 R,111,94,41,1836,2008
left,L EH1 F T,146432427,4261984,422,1505,2008
lefthand,L EH0 F T HH AE1 N D,123970,91055,259,1722,2008
lefthanded,L EH0 F T HH AE1 N D IH0 D,51696,34000,228,1670,2008
lefties,L EH1 F T IY0 Z,16491,8852,84,1631,2008
leftism,L EH1 F T IH2 Z AH0 M,33347,17529,87,1788,2008
leftist,L EH1 F T IH0 S T,798876,206009,138,1515,2008
leftists,L EH1 F T IH0 S T S,233697,85980,102,1697,2008
lefton,L EH1 F T AH0 N,222,188,79,1773,2008
leftover,L EH1 F T OW2 V ER0,328786,198618,138,1676,2008
leftovers,L EH1 F T OW2 V ER0 Z,245646,156261,120,1705,2008
leftward,L EH1 F T W ER0 D,159480,61664,190,1607,2008
leftwich,L EH1 F T W IH0 K,94,54,31,1868,2008
leftwing,L EH1 F T W IH2 NG,78216,48880,137,1607,2008
leftwinger,L EH1 F T W IH2 NG ER0,1619,1437,74,1899,2008
leftwingers,L EH1 F T W IH2 NG ER0 Z,5309,4330,90,1898,2008
lefty,L EH1 F T IY0,31164,14036,260,1696,2008
leg,L EH1 G,10809276,1772585,371,1563,2008
legacies,L EH1 G AH0 S IY0 Z,661682,279727,309,1515,2008
legacy,L EH1 G AH0 S IY0,3651626,1170468,326,1515,2008
legal,L IY1 G AH0 L,40043949,2525648,380,1507,2008
legalese,L EH1 G AH0 L IY2 S,28719,19749,68,1854,2008
legalism,L IY1 G AH0 L IH2 Z AH0 M,182029,79356,195,1762,2008
legalistic,L EH2 G AH0 L IH1 S T IH0 K,332549,186828,162,1643,2008
legalities,L IY0 G AE1 L IH0 T IY0 Z,48582,39696,192,1680,2008
legality,L IY0 G AE1 L AH0 T IY0,1153349,440569,322,1515,2008
legalization,L IY2 G AH0 L AH0 Z EY1 SH AH0 N,238992,88607,195,1791,2008
legalize,L IY1 G AH0 L AY2 Z,160948,109576,240,1520,2008
legalized,L IY1 G AH0 L AY2 Z D,433348,237281,235,1515,2008
legalizing,L IY1 G AH0 L AY2 Z IH0 NG,108128,74582,225,1761,2008
legally,L IY1 G AH0 L IY0,4506702,1255642,361,1515,2008
legals,L IY1 G AH0 L Z,6216,3050,121,1758,2008
legan,L EH1 G AH0 N,823,737,191,1694,2008
legare,L EH0 G AA1 R IY0,4025,2251,218,1680,2008
legate,L EH1 G AH0 T,450466,88209,307,1520,2008
legates,L EH1 G AH0 T S,205006,46661,307,1520,2008
legato,L AH0 G AA1 T OW2,133176,31257,261,1581,2008
lege,L IY1 JH,214678,104268,343,1507,2008
legend,L EH1 JH AH0 N D,5210836,1246797,323,1524,2008
legendary,L EH1 JH AH0 N D EH2 R IY0,1924179,797304,301,1564,2008
legendre,L EH1 G IH0 N D R EY0,567,365,73,1847,2008
legends,L EH1 JH AH0 N D Z,2502638,773132,312,1524,2008
legent,L EH1 JH AH0 N T,1288,1053,203,1715,2008
leger,L EH1 JH ER0,24789,14415,263,1592,2008
legerdemain,L EH2 JH ER0 D AH0 M EY1 N,76453,63548,282,1642,2008
legere,L EH1 G ER0,31450,20136,299,1525,2008
leget,L EH1 G IH0 T,2380,1862,244,1684,2008
legg,L EH1 G,11302,6017,226,1638,2008
legge,L EH1 G,66121,20083,267,1564,2008
legged,L EH1 G AH0 D,1209655,599936,305,1568,2008
leggett,L EH1 G IH0 T,316,188,66,1820,2008
legging,L EH1 G IH0 NG,21608,14671,204,1688,2008
leggings,L EH1 G IH0 NG Z,216542,112457,215,1582,2008
leggio,L EH1 JH IY0 OW0,593,308,105,1823,2008
leggy,L EH1 G IY0,50392,33895,197,1730,2008
leghorn,L EH1 G HH AO0 R N,14524,10108,206,1687,2008
leghorns,L EH1 G HH AO0 R N Z,3752,2894,146,1804,2008
legibility,L EH2 JH AH0 B IH1 L AH0 T IY0,161973,66679,226,1525,2008
legible,L EH1 JH AH0 B AH0 L,517928,307196,355,1524,2008
legion,L IY1 JH AH0 N,797197,392931,312,1515,2008
legionaries,L IY1 JH AH0 N EH2 R IY0 Z,110290,34953,248,1745,2008
legionnaire,L IY1 JH AH0 N EH2 R,19293,8096,108,1818,2008
legionnaires,L IY1 JH AH0 N EH2 R Z,46512,16957,121,1816,2008
legions,L IY1 JH AH0 N Z,1063637,345206,323,1575,2008
legislate,L EH1 JH IH0 S L EY2 T,659499,303209,251,1563,2008
legislated,L EH1 JH AH0 S L EY2 T AH0 D,295344,191680,225,1705,2008
legislates,L EH1 JH IH0 S L EY2 T S,45803,35786,216,1731,2008
legislating,L EH1 JH IH0 S L EY2 T IH0 NG,193490,127687,237,1687,2008
legislation,L EH2 JH AH0 S L EY1 SH AH0 N,17328835,1446105,294,1515,2008
legislative,L EH1 JH AH0 S L EY2 T IH0 V,9771903,1048565,333,1515,2008
legislatively,L EH1 JH IH0 S L EY2 T IH0 V L IY0,76320,47886,231,1600,2008
legislator,L EH1 JH AH0 S L EY2 T ER0,1008036,330306,305,1582,2008
legislators,L EH1 JH AH0 S L EY2 T ER0 Z,2172337,564799,292,1515,2008
legislature,L EH1 JH AH0 S L EY2 CH ER0,7758106,745120,304,1515,2008
legislatures,L EH1 JH IH0 S L EY2 CH ER0 Z,1884093,374729,262,1607,2008
legit,L EH1 JH IH0 T,55876,36925,321,1631,2008
legitimacy,L AH0 JH IH1 T AH0 M AH0 S IY0,3264565,696349,282,1515,2008
legitimate,L AH0 JH IH1 T AH0 M AH0 T,8461653,1891911,369,1515,2008
legitimately,L AH0 JH IH1 T AH0 M AH0 T L IY0,996566,573900,276,1515,2008
legitimize,L AH0 JH IH1 T AH0 M AY2 Z,316111,188313,191,1731,2008
legitimized,L IH0 JH IH1 T AH0 M AY2 Z D,252056,158087,195,1775,2008
legitimizes,L IH0 JH IH1 T AH0 M AY2 Z IH0 Z,67633,53553,156,1820,2008
legitimizing,L IH0 JH IH1 T AH0 M AY2 Z IH0 NG,172474,108813,178,1770,2008
legler,L EH1 G L ER0,44,40,26,1928,2008
legless,L EH1 G L AH0 S,63959,42010,184,1785,2008
legner,L EH1 G N ER0,64,48,33,1900,2007
lego,L EH1 G OW0,24594,12424,277,1581,2008
legrand,L EH1 G R AE0 N D,404,326,98,1766,2008
legree,L IH0 G R IY1,1450,1383,211,1737,2008
legroom,L AH0 G R UW1 M,9943,6122,79,1716,2008
legros,L EH1 G R OW0 Z,164,146,67,1804,2008
legs,L EH1 G Z,15674647,2089301,389,1507,2008
legume,L EH1 G Y UW2 M,282946,50436,216,1631,2008
legumes,L EH1 G Y UW2 M Z,543961,104104,254,1724,2008
legwork,L EH1 G W ER2 K,33789,27590,93,1866,2008
leh,L EH1,16066,7711,237,1640,2008
lehan,L IY1 HH AE0 N,607,416,115,1629,2008
lehane,L AH0 HH EY1 N,157,51,30,1904,2008
lehigh,L IY1 HH AY2,167,150,68,1848,2008
lehl,L EH1 L,203,120,52,1823,2008
lehman,L IY1 M AH0 N,1308,596,68,1904,2008
lehmann,L EY1 M AH0 N,1829,1047,92,1870,2008
lehn,L EH1 N,950,717,145,1612,2008
lehne,L EH1 N,490,410,79,1888,2008
lehnen,L EH1 N AH0 N,1593,1286,114,1800,2008
lehner,L EH1 N ER0,191,154,56,1885,2008
lehnert,L EH1 N ER0 T,91,43,25,1951,2008
lehr,L EH1 R,8571,2866,165,1693,2008
lehrer,L EH1 R ER0,1074,749,124,1815,2008
lehrman,L EH1 R M AH0 N,145,85,35,1942,2008
lehtinen,L EH1 T IH0 N AH0 N,115,81,35,1952,2007
lei,L EY1,277180,114388,349,1515,2008
leib,L IY1 B,3412,1821,164,1742,2008
leiber,L IY1 B ER0,364,286,90,1831,2008
leibler,L IY1 B L ER0,60,40,12,1985,2008
leibniz,L IY1 B N IH0 Z,637,340,75,1884,2008
leibowitz,L IY1 B OW0 IH0 T S,220,134,50,1937,2008
leicester,L EH1 S T ER0,2046,403,115,1792,2008
leicht,L AY1 K T,88052,24630,200,1708,2008
leichter,L AY1 K T ER0,16644,9317,168,1795,2008
leider,L AY1 D ER0,26034,12759,182,1718,2008
leidig,L AY1 D IH0 G,156,137,55,1840,2008
leidy,L IY1 D IY0,169,128,62,1882,2008
leier,L AY1 ER0,449,293,87,1760,2008
leif,L IY1 F,4715,2353,244,1685,2008
leifer,L AY1 F ER0,302,255,100,1662,2008
leigh,L IY1,8766,6835,262,1676,2008
leight,L EY1 T,1637,1211,193,1667,2008
leighton,L EY1 T AH0 N,1100,736,123,1807,2008
leila,L IY1 L AH0,1064,535,109,1747,2008
leilia,L IY1 L IY0 AH0,277,66,38,1878,2008
leiman,L AY1 M AH0 N,127,111,54,1745,2008
leimer,L AY1 M ER0,63,58,32,1860,2008
lein,L IY1 N,8928,5904,253,1670,2008
leinen,L AY1 N AH0 N,413,308,101,1807,2008
leiner,L AY1 N ER0,202,183,86,1804,2008
leininger,L AY1 N IH0 NG ER0,178,64,35,1905,2008
leino,L EY0 IY1 N OW0,99,89,53,1735,2008
leins,L IY1 N Z,693,584,173,1750,2008
leiper,L IY1 P ER0,171,77,39,1856,2008
leipzig,L AY1 P S IH0 G,1224,482,96,1799,2008
leis,L EY1 Z,45752,19409,331,1647,2008
leise,L IY1 S,12761,6940,193,1644,2008
leiser,L AY1 S ER0,3140,2017,166,1679,2008
leishman,L IY1 SH M AH0 N,704,319,80,1905,2008
leising,L AY1 S IH0 NG,73,71,42,1711,2004
leiss,L AY1 S,257,232,104,1797,2008
leist,L IY1 IH0 S T,3491,1994,257,1695,2008
leister,L IY1 S T ER0,5177,2241,198,1724,2008
leisure,L EH1 ZH ER0,6001480,1502380,384,1505,2008
leisurely,L IY1 Z ER0 L IY0,1168934,668041,341,1587,2008
leitch,L IY1 CH,165,124,53,1842,2008
leite,L IY1 T,4532,2622,169,1659,2008
leiter,L AY1 T ER0,2254,1564,223,1685,2008
leith,L IY1 TH,2423,1531,214,1682,2008
leitmotif,L AY1 T M OW0 T IY2 F,100075,64743,126,1856,2008
leitner,L AY1 T N ER0,139,119,50,1889,2008
leitz,L IY1 T S,113,92,54,1761,2008
leiva,L IY1 V AH0,121,91,46,1819,2007
leja,L EY1 Y AH0,932,466,118,1796,2008
lejeune,L EH1 Y OY0 N,1730,1156,145,1769,2008
lek,L EH1 K,41845,12548,233,1678,2008
lekachman,L EH1 K AA2 K M AH0 N,66,42,26,1932,2007
lekas,L IY1 K AH0 Z,690,348,77,1817,2008
lela,L IY1 L AH0,2463,1448,181,1731,2008
lelah,L EH1 L AH0,635,319,73,1812,2008
leland,L IY1 L AH0 N D,2036,1341,154,1725,2008
lelia,L IY1 L Y AH0,768,207,85,1800,2008
lem,L EH1 M,93376,77176,331,1505,2008
lema,L IY1 M AH0,7723,4153,191,1753,2008
lemaire,L AH0 M EH1 R,226,138,57,1787,2008
lemaitre,L IH0 M EY1 T ER0,118,105,54,1819,2008
leman,L IY1 M AH0 N,13154,8516,245,1663,2008
lemans,L EH1 M AH0 N Z,1579,1445,197,1655,2008
lemar,L IH0 M AA1 R,201,97,53,1798,2007
lemay,L EH1 M EY0,311,155,45,1792,2008
lemberg,L EH1 M B ER0 G,153,114,57,1761,2008
lemberger,L EH1 M B ER0 G ER0,133,54,27,1947,2008
lembo,L EH1 M B OW0,2605,1530,191,1731,2008
lemburg,L EH1 M B ER0 G,59,57,36,1732,2005
lemen,L IY1 M EH0 N,2943,2334,222,1683,2008
lemere,L EH1 M ER0,128,101,64,1750,2008
lemieux,L AH0 M Y UW1,134,94,41,1866,2007
leming,L IY1 M IH0 NG,805,674,179,1731,2008
lemire,L EY0 M IH1 R EY0,84,62,37,1863,2008
lemke,L EH1 M K IY0,203,136,48,1923,2008
lemm,L EH1 M,528,306,96,1734,2008
lemma,L EH1 M AH0,296455,45483,273,1638,2008
lemme,L EH1 M AH0,32824,19873,173,1761,2008
lemmen,L EH1 M EH0 N,146,113,57,1568,2008
lemmer,L EH1 M ER0,281,212,85,1766,2008
lemmie,L EH1 M IY0,75,60,29,1940,2008
lemming,L EH1 M IH0 NG,50462,20390,223,1675,2008
lemmings,L EH1 M IH0 NG Z,64237,28035,203,1667,2008
lemmon,L EH1 M AH0 N,904,587,121,1593,2008
lemmons,L EH1 M AH0 N Z,594,431,136,1724,2008
lemoine,L IH0 M OY1 N,204,163,63,1749,2008
lemon,L EH1 M AH0 N,2454302,512435,291,1588,2008
lemonade,L EH1 M AH0 N EY1 D,425001,218186,256,1689,2008
lemond,L EH1 M AH0 N D,172,113,57,1827,2008
lemonds,L EH1 M AH0 N D Z,58,50,26,1849,2008
lemons,L EH1 M AH0 N Z,426193,205675,287,1589,2008
lemont,L AH0 M AA1 N T,370,249,124,1738,2008
lemos,L IY1 M OW0 Z,398,287,76,1772,2008
lemp,L EH1 M P,1049,792,151,1722,2008
lemur,L IY1 M ER0,58684,18887,217,1673,2008
lemurs,L IY1 M ER0 Z,90430,21928,197,1651,2008
lemus,L IY1 M AH0 S,305,283,122,1767,2008
len,L EH1 N,131484,61181,331,1505,2008
lena,L IY1 N AH0,34484,16554,252,1703,2008
lenard,L EH1 N ER0 D,172,140,62,1849,2008
lend,L EH1 N D,4268319,1805537,397,1515,2008
lender,L EH1 N D ER0,1569479,236935,342,1572,2008
lenderman,L EH1 N D ER0 M AH0 N,589,81,26,1844,2008
lenders,L EH1 N D ER0 Z,1119452,246014,285,1572,2008
lending,L EH1 N D IH0 NG,3041872,841008,359,1515,2008
lendings,L EH1 N D IH0 NG Z,15328,8712,205,1572,2008
lendl,L EH1 N D AH0 L,108,68,37,1659,2008
lends,L EH1 N D Z,1497116,913685,345,1572,2008
lene,L IY1 N,26777,18116,278,1588,2008
leng,L EH1 NG,18625,10072,288,1581,2008
lengel,L EH1 NG G AH0 L,53,42,26,1821,2008
lenger,L EH1 NG ER0,13379,6161,242,1568,2008
length,L EH1 NG K TH,52286764,3691615,416,1505,2008
lengthen,L EH1 NG TH AH0 N,447681,321512,342,1563,2008
lengthened,L EH1 NG TH AH0 N D,925972,556651,321,1563,2008
lengthening,L EH1 NG TH AH0 N IH0 NG,763523,398022,312,1657,2008
lengthens,L EH1 NG TH AH0 N Z,144953,112235,303,1669,2008
lengths,L EH1 NG K TH S,4634084,1330510,342,1600,2008
lengthways,L EH1 NG TH W EY2 Z,55216,32758,291,1682,2008
lengthwise,L EH1 NG TH W AY2 Z,525597,213922,283,1607,2008
lengthy,L EH1 NG TH IY0,3254949,1384727,305,1505,2008
lengyel,L EH1 NG Y EH2 L,1025,515,61,1871,2008
leniency,L IY1 N Y AH0 N S IY0,325899,200662,229,1582,2008
lenient,L IY1 N IY0 AH0 N T,562468,360000,303,1515,2008
leniently,L IY1 N Y AH0 N T L IY0,88288,73480,216,1582,2008
lenig,L EH1 N IH0 G,52,44,31,1853,2008
lenin,L EH1 N AH0 N,3802,1696,112,1787,2008
leningrad,L EH1 N AH0 N G R AE2 D,528,266,59,1927,2008
leninism,L EH1 N IH0 N IH2 Z AH0 M,4984,1775,78,1860,2008
leninist,L EH1 N IH0 N IH0 S T,5012,1661,69,1926,2008
lenis,L IY1 N AH0 S,21603,6500,256,1666,2008
lenita,L EH0 N IY1 T AH0,80,70,45,1711,2008
lenius,L IY1 N IY0 IH0 S,947,845,206,1720,2008
lenk,L EH1 NG K,926,601,143,1744,2008
lenke,L EH1 NG K,462,346,88,1825,2008
lenker,L EH1 NG K ER0,88,63,33,1786,2008
lennard,L EH1 N ER0 D,372,238,58,1859,2008
lennie,L EH1 N IY0,1326,533,90,1847,2008
lenning,L EH1 N IH0 NG,216,177,72,1809,2008
lennon,L EH1 N AH0 N,1045,485,72,1768,2008
lennox,L EH1 N AH0 K S,1397,537,107,1794,2008
lenny,L EH1 N IY0,3211,1246,97,1736,2008
leno,L EH1 N OW0,14884,4572,221,1669,2008
lenon,L EH1 N AH0 N,414,280,103,1709,2008
lenora,L EH1 N ER0 AH0,126,70,33,1761,2008
lenore,L AH0 N AO1 R,640,343,91,1813,2008
lenos,L IY1 N OW0 Z,1010,600,123,1795,2008
lenox,L EH1 N AH0 K S,696,608,162,1725,2008
lens,L EH1 N Z,7191753,731842,306,1515,2008
lenses,L EH1 N Z AH0 Z,2546323,468632,310,1515,2008
lensing,L EH1 N S IH0 NG,39157,6551,101,1782,2008
lent,L EH1 N T,3054878,1346965,401,1505,2008
lentil,L EH1 N T AH0 L,106055,46031,252,1705,2008
lentils,L EH1 N T AH0 L Z,249568,95767,269,1590,2008
lentinan,L EH1 N T IH0 N AH0 N,4372,767,38,1813,2008
lentine,L EH0 N T IY1 N IY0,269,255,125,1660,2008
lentini,L EH0 N T IY1 N IY0,50,47,34,1742,2008
lento,L EH1 N T OW0,34125,17854,283,1631,2008
lenton,L EH1 N T AH0 N,264,217,94,1775,2008
lents,L EH1 N T S,13571,11174,295,1656,2008
lentz,L EH1 N T S,429,349,122,1777,2008
leny,L EH1 N IY0,887,596,181,1658,2008
lenz,L EH1 N Z,1502,1073,124,1762,2008
lenzen,L EH1 N Z AH0 N,245,139,55,1886,2008
lenzi,L EH1 N Z IY0,353,150,53,1773,2008
lenzo,L EH1 N Z OW0,55,45,26,1835,2008
leo,L IY1 OW0,51616,26919,285,1568,2008
leoda,L EH1 D AH0,634,404,101,1775,2008
leola,L EH1 L AH0,91,52,34,1835,2008
leoma,L IH0 OW1 M AH0,586,390,111,1823,2008
leominster,L IY1 OW0 M IH2 N S T ER0,59,42,30,1863,2008
leon,L IY1 AA0 N,23490,15001,254,1638,2008
leona,L IY1 OW0 N AH0,1743,980,129,1735,2008
leonard,L EH1 N ER0 D,3738,1950,138,1766,2008
leonardi,L EH0 N AA1 R D IY0,846,297,82,1810,2008
leonardo,L IY2 AH0 N AA1 R D OW0,1264,745,94,1811,2008
leone,L IY0 OW1 N,8680,5384,230,1564,2008
leonel,L IY1 OW0 N AH0 L,59,46,31,1913,2008
leones,L IY0 OW1 N Z,10583,6698,262,1584,2008
leong,L EH1 NG,776,490,58,1809,2008
leonhard,L IY1 AH0 N HH AA0 R T,303,220,67,1821,2008
leonhardt,L EH1 N HH AA0 R T,87,69,33,1953,2007
leoni,L EH0 OW1 N IY0,3034,2307,222,1584,2008
leonid,L IY1 AH0 N IH0 D,512,247,60,1841,2008
leonie,L EH1 N IY0,963,130,62,1774,2008
leonora,L IY2 AH0 N AO1 R AH0,2791,255,91,1737,2008
leonore,L IY1 AH0 N AO0 R,343,204,88,1832,2008
leontine,L EH0 N T IY1 N IY0,171,131,74,1801,2008
leopard,L EH1 P ER0 D,711246,247240,288,1563,2008
leopards,L EH1 P ER0 D Z,229217,111728,279,1568,2008
leopold,L IY1 AH0 P OW2 L D,1047,590,93,1792,2008
leopoldina,L EH0 P OW0 L D IY1 N AH0,238,113,44,1824,2008
leopoldine,L EH0 P OW0 L D IY1 N IY0,140,76,36,1870,2007
leopoldo,L IY2 AH0 P OW1 L D OW0,364,117,46,1883,2008
leora,L EH1 R AH0,70,49,31,1840,2008
leos,L IY1 OW0 Z,1621,1056,186,1683,2008
leota,L EH1 T AH0,60,59,38,1821,2008
leotard,L IY1 AH0 T AA2 R D,32716,19135,75,1894,2008
lep,L EH1 P,13190,7698,252,1598,2008
lepage,L EH1 P IH0 JH,189,113,60,1815,2008
lepak,L EH1 P AH0 K,287,128,24,1889,2008
lepard,L EH1 P ER0 D,203,190,92,1681,2008
lepe,L IY1 P,3201,1989,201,1568,2008
leper,L EH1 P ER0,366643,157792,288,1621,2008
lepera,L EH0 P EH1 R AH0,113,96,57,1797,2008
lepere,L EY0 P EH1 R EY0,285,248,97,1788,2008
lepers,L EH1 P ER0 Z,309398,135281,299,1670,2008
lepine,L EH0 P IY1 N IY0,363,200,86,1768,2008
lepore,L EH0 P AO1 R IY0,2348,1874,236,1681,2008
lepp,L EH1 P,381,237,82,1798,2008
leppard,L EH1 P ER0 D,176,107,51,1787,2008
lepper,L EH1 P ER0,725,532,128,1836,2008
leppo,L EH1 P OW0,194,156,81,1758,2008
lepre,L EH1 P ER0,4505,2733,197,1581,2008
leprosy,L EH1 P R AH0 S IY0,773143,227704,293,1527,2008
leptin,L EH1 P T IH0 N,120039,7158,31,1670,2008
leptonic,L EH0 P T AA1 N IH0 K,20887,2662,62,1922,2008
lequire,L EY0 K W IH1 R EY0,513,501,178,1756,2008
lerch,L ER1 K,156,141,63,1856,2008
lerche,L ER1 CH,150,136,63,1797,2008
lerma,L ER1 M AH0,530,321,99,1796,2008
lerman,L EH1 R M AH0 N,1913,1633,177,1787,2008
lerner,L ER1 N ER0,2304,1616,101,1787,2008
leroux,L ER0 UW1,247,173,54,1845,2008
leroy,L IY1 R OY2,2134,1217,192,1678,2008
lerro,L EH1 R OW0,116,103,57,1805,2008
lersch,L ER1 SH,56,45,35,1866,2008
lerum,L EH1 R AH0 M,289,259,136,1699,2008
les,L EH1 S,17044993,862864,378,1505,2008
lesa,L IY1 S AH0,16276,11762,249,1721,2008
lesage,L EH1 S IH0 JH,157,96,50,1838,2008
lesbian,L EH1 Z B IY0 AH0 N,2147078,168002,123,1763,2008
lesbianism,L EH1 Z B IY0 AH0 N IH0 Z M,213263,47554,100,1799,2008
lesbians,L EH1 Z B IY0 AH0 N Z,927240,99142,96,1786,2008
lesch,L EH1 SH,270,199,78,1805,2008
leser,L EH1 S ER0,2039,1298,154,1607,2008
lesh,L EH1 SH,3326,2517,206,1667,2008
lesher,L EH1 SH ER0,88,75,40,1894,2008
lesi,L EH1 S IY0,6238,5200,336,1632,2008
lesieur,L EH1 S IY0 ER0,42,41,26,1823,2007
lesion,L IY1 ZH AH0 N,4462724,199560,307,1655,2008
lesions,L IY1 ZH AH0 N Z,7846895,252806,295,1656,2008
leske,L EH1 S K,542,265,67,1802,2008
lesko,L EH1 S K OW0,172,111,49,1874,2008
lesley,L EH1 S L IY0,1307,1071,185,1717,2008
leslie,L EH1 S L IY0,2423,1449,121,1775,2008
lesner,L EH1 S N ER0,42,40,37,1837,2008
lesotho,L EH0 S OW1 TH OW0,233,154,39,1968,2008
lesperance,L EH0 S P ER0 AA1 N S,142,110,42,1814,2008
less,L EH1 S,164407300,4311761,404,1505,2008
lessee,L EH0 S IY1,1245987,114410,279,1572,2008
lessees,L EH0 S IY1 Z,238963,70734,257,1600,2008
lessen,L EH1 S AH0 N,1748961,925069,371,1563,2008
lessened,L EH1 S AH0 N D,1489123,823767,368,1515,2008
lessening,L EH1 S AH0 N IH0 NG,810554,513420,356,1515,2008
lessens,L EH1 S AH0 N Z,407470,275578,338,1590,2008
lesser,L EH1 S ER0,7336685,2181264,399,1507,2008
lessig,L EH1 S IH0 G,72,55,14,1836,2008
lessin,L EH1 S IH0 N,495,446,101,1710,2008
lessing,L EH1 S IH0 NG,1963,1392,179,1721,2008
lessner,L EH1 S N ER0,69,60,41,1887,2008
lessness,L EH1 S N AH0 S,40122,32944,249,1648,2008
lesson,L EH1 S AH0 N,9048809,2079477,361,1563,2008
lessons,L EH1 S AH0 N Z,8088242,1965570,337,1515,2008
