word,pronunication,tf,df,years,year_first,year_recent
lessor,L EH1 S ER0,822542,64674,291,1582,2008
lessors,L EH1 S ER0 Z,90462,23782,257,1600,2008
lest,L EH1 S T,5219854,1450306,405,1507,2008
lestat,L EH1 S T AE2 T,898,407,121,1631,2008
lester,L EH1 S T ER0,4058,2603,263,1644,2008
lesueur,L EH0 S UW1 ER0,988,356,64,1858,2008
lesure,L EH0 SH UH1 R,301,266,89,1675,2008
leszek,L EH1 S EH0 K,232,148,44,1939,2008
let,L EH1 T,74773702,3809066,421,1505,2008
"let's",L EH1 T S,14678,13133,108,1759,2008
leta,L EH1 T AH0,10098,4306,222,1729,2008
letcher,L EH1 CH ER0,1789,1450,222,1723,2008
letchworth,L EH1 CH W ER0 TH,103,60,43,1806,2008
letdown,L EH1 T D AW2 N,83703,60564,209,1642,2008
leth,L EH1 TH,5195,3624,302,1620,2008
letha,L EH1 TH AH0,399,332,82,1761,2008
lethal,L IY1 TH AH0 L,1686908,514582,224,1721,2008
lethality,L IY0 TH AE1 L AH0 T IY0,149001,43627,116,1829,2008
lethargic,L AH0 TH AA1 R JH IH0 K,274735,203573,283,1564,2008
lethargy,L EH1 TH ER0 JH IY0,630287,362998,311,1579,2008
lethia,L EH1 TH IY0 AH0,116,80,29,1895,2008
leticia,L AH0 T IH1 SH AH0,1069,656,136,1507,2008
letitia,L IH0 T IH1 SH IY0 AH0,1530,944,154,1757,2008
letizia,L EH0 T IY1 Z IY0 AH0,2971,1668,175,1757,2008
leto,L IY1 T OW0,6618,3937,238,1681,2008
lets,L EH1 T S,2818802,1087077,381,1505,2008
letson,L EH1 T S AH0 N,74,67,49,1801,2008
lett,L EH1 T,95689,43133,345,1572,2008
letter,L EH1 T ER0,58943742,3142538,408,1507,2008
lettered,L EH1 T ER0 D,415839,222457,291,1524,2008
letterhead,L EH1 T ER0 HH EH2 D,212886,90614,126,1811,2008
lettering,L EH1 T ER0 IH0 NG,651555,253501,244,1525,2008
letterman,L EH1 T ER0 M AH0 N,6674,4432,107,1804,2008
letterpress,L EH1 T ER0 P R EH2 S,122753,44258,216,1684,2008
letters,L EH1 T ER0 Z,34157493,2928393,410,1505,2008
lettice,L EH1 T IH0 S,3060,1365,235,1579,2008
lettie,L EH1 T IY0,459,154,79,1703,2008
lettiere,L EH1 T IY0 EH0 R,84,59,30,1831,2008
letting,L EH1 T IH0 NG,5616121,1946329,385,1563,2008
lettish,L EH1 T IH0 SH,102,49,31,1799,2005
letts,L EH1 T S,2471,1700,239,1644,2008
lettuce,L EH1 T AH0 S,974296,285695,272,1584,2008
letty,L EH1 T IY0,1101,420,105,1792,2008
letup,L EH1 T AH2 P,29202,24353,162,1681,2008
letz,L EH1 T S,1191,833,129,1788,2008
leu,L UW1,85016,42902,303,1507,2008
leukemia,L UW0 K IY1 M IY0 AH0,1504674,137350,146,1838,2008
leukocyte,L UW1 K AH0 S AY2 T,421971,50128,117,1888,2008
leumi,L UW1 M IY0,575,298,64,1830,2008
leung,L UW1 NG,3311,1326,79,1842,2008
leupold,L OY1 P OW0 L D,55,40,24,1824,2008
lev,L EH1 V,68788,47624,312,1644,2008
leva,L EH1 V AH0,49184,18599,257,1667,2008
leval,L AH0 V AA1 L,2825,2005,142,1775,2008
levamisole,L AH0 V AE1 M IH0 S OW2 L,29665,5794,46,1948,2008
levan,L EH1 V AH0 N,10026,2764,181,1708,2008
levana,L IH0 V AE1 N AH0,2464,781,124,1584,2008
levant,L AH0 V AE1 N T,42304,15969,276,1524,2008
levasseur,L EH1 V AH0 S ER0,156,101,59,1848,2008
levay,L EH1 V EY0,191,112,52,1805,2008
leve,L IY1 V,69666,42767,317,1515,2008
levee,L EH1 V IY0,421387,139277,282,1645,2008
levees,L EH1 V IY0 Z,263899,90905,270,1575,2008
leveille,L EH1 V AY0 L,63,49,34,1840,2008
level,L EH1 V AH0 L,103158911,3816081,376,1505,2008
leveled,L EH1 V AH0 L D,803381,477444,291,1582,2008
levelers,L EH1 V AH0 L ER0 Z,12807,8592,178,1767,2008
leveling,L EH1 V AH0 L IH0 NG,610937,280573,255,1590,2008
levell,L EY0 V EY1 L,6908,4203,237,1637,2008
levelled,L EH1 V AH0 L D,837565,481680,358,1515,2008
levels,L EH1 V AH0 L Z,44566627,2522975,330,1515,2008
leven,L IY1 V AH0 N,43272,21724,323,1568,2008
levenberg,L IY1 V AH0 N B ER0 G,51,46,17,1967,2008
levene,L EH1 V IY0 N,504,273,74,1816,2008
levens,L IY1 V AH0 N Z,1996,1251,145,1673,2008
levenson,L EH1 V IH0 N S AH0 N,344,236,61,1904,2008
leventhal,L EH1 V AH0 N TH AO2 L,239,167,46,1954,2008
leveque,L AH0 V IY1 K,151,115,49,1823,2008
lever,L EH1 V ER0,2520201,596504,329,1568,2008
leverage,L EH1 V ER0 IH0 JH,1574828,464259,211,1515,2008
leveraged,L IY1 V ER0 IH0 JH D,258702,74253,75,1600,2008
leveraging,L EH1 V R IH0 JH IH0 NG,129345,53492,68,1837,2008
leverett,L EH1 V ER0 EH0 T,177,138,66,1789,2008
levering,L EH1 V ER0 IH0 NG,23806,19010,160,1689,2008
levers,L EH1 V ER0 Z,685531,281264,287,1648,2008
levert,L EH1 V ER0 T,1880,1162,104,1738,2008
levesque,L IH0 V EH1 S K,663,439,126,1753,2008
levett,L EH1 V IH0 T,202,158,73,1811,2008
levey,L IH0 V EY1,852,738,136,1736,2008
levi,L IY1 V AY0,18528,11456,301,1581,2008
leviathan,L AH0 V AY1 AH0 TH AH0 N,87618,59904,260,1680,2008
levick,L EH1 V IH0 K,57,45,30,1901,2008
levie,L IY1 V IY0,6295,4158,241,1637,2008
levied,L EH1 V IY0 D,2306161,583329,364,1520,2008
levien,L EH1 V IY0 AH0 N,84,59,35,1827,2008
levies,L EH1 V IY0 Z,830126,291137,318,1515,2008
levin,L EH1 V IH0 N,9850,7332,237,1668,2008
levina,L EH0 V IY1 N AH0,59,50,30,1867,2008
levine,L AH0 V IY1 N,3244,1791,79,1815,2008
levins,L EH1 V IH0 N Z,1206,947,191,1678,2008
levinsky,L IH0 V IH1 N S K IY0,92,73,24,1935,2003
levinson,L EH1 V IH0 N S AH0 N,1002,578,63,1870,2008
levis,L EH1 V IH0 S,34697,19186,297,1687,2008
levison,L EH1 V IH0 S AH0 N,136,85,39,1904,2008
levit,L EH1 V IH0 T,846,562,185,1708,2008
levitan,L EH1 V IH0 T AH0 N,146,100,42,1942,2008
levitate,L EH1 V IH0 T EY2 T,30822,22865,249,1684,2008
levitated,L EH1 V IH0 T EY2 T IH0 D,32702,17097,135,1726,2008
levitating,L EH1 V AH0 T EY2 T IH0 NG,20332,14878,132,1847,2008
levitation,L EH2 V IH0 T EY1 SH AH0 N,94031,38091,188,1679,2008
leviticus,L AH0 V IH1 T AH0 K AH0 S,706,307,80,1754,2008
leviton,L IH0 V IH1 T AH0 N,58,50,28,1951,2008
levitsky,L IH0 V IH1 T S K IY0,65,46,23,1959,2008
levitt,L EH1 V IH0 T,546,336,59,1744,2008
levittown,L EH1 V IH0 T AW2 N,71,60,31,1954,2008
levity,L EH1 V IH0 T IY0,473061,272293,346,1592,2008
levy,L EH1 V IY0,1963273,483570,359,1515,2008
levying,L EH1 V IY0 IH0 NG,556587,247441,345,1575,2008
lew,L UW1,132987,91619,350,1524,2008
lewan,L UW1 AH0 N,519,217,87,1787,2008
lewd,L UW1 D,333135,190806,365,1563,2008
lewellyn,L UW2 EH1 L IH0 N,140,103,57,1902,2008
lewers,L UW1 ER0 Z,75,70,53,1752,2008
lewey,L UW1 IY0,60,50,29,1824,2008
lewi,L UW1 IY0,533,358,115,1711,2008
lewin,L UW1 IH0 N,2204,1212,106,1801,2008
lewing,L UW1 IH0 NG,280,250,107,1684,2008
lewinsky,L UW0 IH1 N S K IY0,135,77,16,1975,2008
lewinsohn,L UW1 IH0 N S AH0 N,98,56,32,1951,2008
lewis,L UW1 IH0 S,33039,16407,254,1637,2008
lewisburg,L UW1 IH0 S B ER0 G,76,63,35,1866,2008
lewiston,L UW1 AH0 S T AH0 N,204,151,67,1857,2008
lewman,L UW1 M AH0 N,163,57,38,1883,2007
lewton,L UW1 T AH0 N,158,140,74,1793,2008
lewy,L UW1 IY0,942,532,77,1830,2008
lex,L EH1 K S,572362,122063,345,1579,2008
lexical,L EH1 K S IH0 K AH0 L,1853443,119835,182,1708,2008
lexicographer,L EH2 K S IH0 K AA1 G R AH0 F ER0,92288,50620,248,1708,2008
lexicographers,L EH2 K S IH0 K AA1 G R AH0 F ER0 Z,65876,32987,254,1574,2008
lexicon,L EH1 K S IH0 K AA2 N,734946,227857,270,1644,2008
lexicons,L EH1 K S IH0 K AA2 N Z,80431,42286,252,1706,2008
lexie,L EH1 K S IY0,1023,303,50,1853,2008
lexington,L EH1 K S IH0 NG T AH0 N,1270,769,132,1803,2008
lexis,L EH1 K S IH0 S,62965,16041,195,1685,2008
lexmark,L EH1 K S M AA2 R K,148,79,12,1996,2008
lexus,L EH1 K S AH0 S,1209,782,125,1683,2008
ley,L EY1,415378,189603,349,1581,2008
leya,L EY1 AH0,1005,540,123,1809,2008
leyda,L EY1 D AH0,185,142,54,1839,2008
leyden,L AY1 D AH0 N,2877,1604,186,1750,2008
leyland,L EY1 L AH0 N D,373,241,70,1837,2008
leys,L EY1 Z,43891,16706,298,1581,2008
leyva,L EY1 V AH0,55,43,25,1925,2008
lhasa,L AA1 S AH0,812,308,60,1905,2008
li,L IY1,2213916,685309,392,1505,2008
lia,L IY1 AH0,55275,40960,332,1507,2008
liabilities,L AY2 AH0 B IH1 L AH0 T IY0 Z,3598265,461191,233,1524,2008
liability,L AY2 AH0 B IH1 L IH0 T IY0,10994844,936258,284,1515,2008
liable,L AY1 AH0 B AH0 L,10231456,1527333,379,1515,2008
liaison,L IY0 EY1 Z AA2 N,1490715,545782,256,1515,2008
liaisons,L IY0 EY1 S AA2 N Z,214344,131989,239,1524,2008
liam,L IY1 AH0 M,30126,24594,314,1630,2008
lian,L Y AA1 N,35272,21053,318,1644,2008
liana,L IY0 AA1 N AH0,59376,32388,258,1642,2008
liane,L IY0 AE1 N,5551,2629,199,1584,2008
liang,L Y AE1 NG,105322,20491,205,1710,2008
lianna,L IY0 AA1 N AH0,146,117,63,1808,2008
lianne,L IY0 AE1 N,202,129,65,1763,2008
liao,L IY0 AW1,21487,5928,180,1782,2008
liar,L AY1 ER0,1021165,546180,353,1520,2008
liars,L AY1 ER0 Z,357173,240501,317,1568,2008
liason,L AY1 AH0 S AH0 N,15127,12174,179,1773,2008
liasson,L AY1 AH0 S AH0 N,54,54,36,1683,2008
liau,L IY1 AW0,1905,1046,200,1684,2008
lib,L IH1 B,1737971,294797,375,1505,2008
libbed,L IH1 B D,14119,10922,114,1838,2008
libbey,L IH1 B IY0,510,110,55,1873,2007
libbing,L IH1 B IH0 NG,14915,10869,105,1713,2008
libby,L IH1 B IY0,2041,808,114,1759,2008
libel,L AY1 B AH0 L,1445728,333061,324,1524,2008
libeled,L AY1 B AH0 L D,27414,16131,190,1680,2008
libelous,L AY1 B AH0 L AH0 S,121046,47448,196,1713,2008
liberace,L IH2 B ER0 AA1 CH IY0,76,64,34,1854,2008
liberal,L IH1 B ER0 AH0 L,13785323,1868200,382,1515,2008
liberalism,L IH1 B ER0 AH0 L IH2 Z AH0 M,2333227,422339,214,1515,2008
liberality,L IH2 B ER0 AE1 L AH0 T IY0,1014257,419515,370,1524,2008
liberalization,L IH2 B AH0 R AH0 L IH0 Z EY1 SH AH0 N,1502970,200883,174,1515,2008
liberalizations,L IH0 B ER0 AH0 L IH0 Z EY1 SH AH0 N Z,14462,8013,101,1882,2008
liberalize,L IH1 B ER0 AH0 L AY2 Z,149270,84673,226,1515,2008
liberalized,L IH1 B ER0 AH0 L AY2 Z D,279184,132197,218,1515,2008
liberalizes,L IH1 B ER0 AH0 L AY2 Z IH0 Z,7130,6052,187,1795,2008
liberalizing,L IH1 B ER0 AH0 L AY2 Z IH0 NG,176827,101038,203,1607,2008
liberally,L IH1 B ER0 AH0 L IY0,1050019,638177,371,1563,2008
liberals,L IH1 B ER0 AH0 L Z,1955330,373453,252,1607,2008
"liberals'",L IH1 B ER0 AH0 L Z,40,40,18,1961,2007
liberate,L IH1 B ER0 EY2 T,1034012,562958,311,1563,2008
liberated,L IH1 B ER0 EY2 T IH0 D,2617774,928023,279,1515,2008
liberati,L IY0 B ER0 AA1 T IY0,3823,2917,240,1581,2008
liberating,L IH1 B ER0 EY2 T IH0 NG,964288,511861,255,1590,2008
liberation,L IH2 B ER0 EY1 SH AH0 N,5500446,1006531,301,1515,2008
liberato,L IY0 B ER0 AA1 T OW0,2209,1492,192,1715,2008
liberator,L IH1 B ER0 EY0 T AH0 R,189011,127551,242,1524,2008
liberatore,L IY0 B ER0 AA0 T AO1 R IY0,530,437,109,1818,2008
liberators,L IH1 B ER0 EY0 T AH0 R Z,135801,89411,221,1515,2008
liberia,L AY0 B IH1 R IY0 AH0,925,568,135,1758,2008
liberian,L AY0 B IH1 R IY0 AH0 N,428,299,80,1800,2008
liberman,L IH1 B ER0 M AH0 N,302,195,52,1928,2008
libert,L IH1 B ER0 T,3327,2816,243,1655,2008
libertarian,L IH2 B ER0 T EH1 R IY0 AH0 N,390538,115764,176,1643,2008
libertarians,L IH2 B ER0 T EH1 R IY0 AH0 N Z,120596,45673,152,1798,2008
liberte,L IH2 B ER0 T EY1,87822,40219,262,1631,2008
liberti,L IY0 B EH1 R T IY0,12745,6846,243,1717,2008
liberties,L IH1 B ER0 T IY0 Z,3313904,836278,380,1515,2008
libertine,L IH1 B ER0 T IY2 N,230497,123134,307,1563,2008
libertines,L IH1 B ER0 T IY2 N Z,70384,44076,297,1607,2008
liberto,L IY0 B EH1 R T OW0,3496,1382,185,1706,2008
liberty,L IH1 B ER0 T IY0,16646062,1811104,407,1507,2008
libido,L AH0 B IY1 D OW0,643252,146246,286,1507,2008
libor,L IY1 B ER0,1491,710,141,1708,2008
libra,L IY1 B R AH0,50971,27028,305,1579,2008
librarian,L AY0 B R EH1 R IY0 AH0 N,1696376,412173,282,1507,2008
librarians,L AY0 B R EH1 R IY0 AH0 N Z,1331379,224222,264,1515,2008
libraries,L AY1 B R EH2 R IY0 Z,6483493,1074349,335,1515,2008
library,L AY1 B R EH2 R IY0,17870550,2040850,361,1505,2008
libration,L AY0 B R EY1 SH AH0 N,39717,9850,253,1635,2008
librettist,L AH0 B R EH1 T AH0 S T,100079,27544,163,1716,2008
libretto,L AH0 B R EH1 T OW0,454256,74903,205,1671,2008
liby,L AY1 B IY0,363,186,88,1714,2008
libya,L IH1 B IY0 AH0,1422,638,86,1753,2008
libyan,L IH1 B IY0 AH0 N,410,236,68,1840,2008
licari,L IY0 K AA1 R IY0,104,61,46,1681,2008
licata,L IY0 K AA1 T AH0,103,98,65,1768,2008
lice,L AY1 S,685674,246323,352,1568,2008
licea,L IH1 S IY0 AH0,186,131,78,1772,2008
licence,L AY1 S AH0 N S,2760470,545239,375,1515,2008
licences,L AY1 S AH0 N S IH0 Z,883536,211668,302,1515,2008
license,L AY1 S AH0 N S,6191509,1219110,364,1507,2008
licensed,L AY1 S AH0 N S T,2614294,684408,346,1572,2008
licensee,L AY2 S AH0 N S IY1,742265,74042,188,1600,2008
licensees,L AY2 S AH0 N S IY1 Z,279963,63186,176,1600,2008
licenser,L AY1 S AH0 N S ER0,31734,12558,261,1637,2008
licenses,L AY1 S AH0 N S IH0 Z,1677369,442376,283,1520,2008
licensing,L AY1 S AH0 N S IH0 NG,2230444,454218,300,1515,2008
licensor,L AY1 S AH0 N S ER0,177511,17509,163,1742,2008
licensure,L AY1 S AH0 N CH ER0,230029,44356,193,1813,2008
licentious,L AY0 S EH1 N CH AH0 S,486219,252779,369,1563,2008
lich,L IH1 CH,31803,18576,281,1645,2008
lichen,L AY1 K AH0 N,484166,151793,260,1694,2008
lichens,L AY1 K AH0 N Z,374157,112704,236,1728,2008
licht,L IH1 K T,29511,15035,227,1691,2008
lichtblau,L IH1 CH T B L AW2,48,42,26,1893,2008
lichte,L IH1 CH T,3573,2413,144,1803,2008
lichten,L IH1 K T AH0 N,3364,2485,150,1750,2008
lichtenberg,L IH1 K T AH0 N B ER0 G,257,176,65,1867,2008
lichtenstein,L IH1 K T AH0 N S T IY2 N,739,442,84,1805,2008
lichter,L IH1 K T ER0,2116,1573,149,1816,2008
lichtman,L IH1 K T M AH0 N,108,75,32,1959,2007
lichty,L IH1 CH T IY0,52,43,25,1922,2003
licio,L IH1 S IY0 OW0,618,338,112,1747,2008
lick,L IH1 K,700568,413006,360,1572,2008
licked,L IH1 K T,714490,367424,326,1563,2008
licker,L IH1 K ER0,17472,10689,198,1744,2008
lickety,L IH1 K AH0 T IY0,10817,9231,132,1852,2008
licking,L IH1 K IH0 NG,545879,329188,326,1581,2008
licklider,L IH1 K L AY0 D ER0,88,61,25,1956,2006
licks,L IH1 K S,200703,130111,328,1603,2008
lico,L IY1 K OW0,2551,1943,229,1507,2008
licon,L IH1 K AH0 N,717,614,144,1733,2008
licorice,L IH1 K ER0 IH0 SH,141916,58103,202,1764,2008
lid,L IH1 D,2746924,838159,350,1575,2008
lida,L IY1 D AH0,15679,7410,197,1709,2008
liddell,L IH1 D AH0 L,629,480,94,1801,2008
liddle,L IH1 D AH0 L,11323,5144,186,1739,2008
liddy,L IH1 D IY0,411,234,72,1815,2008
lide,L AY1 D,9200,7235,320,1619,2008
liden,L AY1 D AH0 N,2278,1145,152,1760,2008
lido,L IY1 D OW0,12924,7030,239,1699,2008
lids,L IH1 D Z,997244,403516,334,1568,2008
lie,L AY1,21356950,3355722,416,1505,2008
lieb,L IY1 B,16413,9055,214,1658,2008
liebe,L IY1 B,31092,15379,199,1706,2008
liebel,L IY1 B AH0 L,129,109,62,1804,2008
lieber,L IY1 B ER0,41033,21528,200,1708,2008
lieberman,L IY1 B ER0 M AH0 N,981,650,55,1949,2008
liebermann,L IY1 B ER0 M AH0 N,182,132,68,1853,2008
liebert,L IY1 B ER0 T,128,107,48,1809,2008
liebig,L IY1 B IH0 G,470,357,119,1840,2008
liebl,L IY1 B AH0 L,75,72,38,1809,2008
liebling,L IY1 B AH0 L IH0 NG,998,571,86,1832,2008
liebman,L IY1 B M AH0 N,498,155,49,1900,2008
liebmann,L IY1 B M AH0 N,77,60,36,1872,2008
liebowitz,L IY1 B AH0 W IH0 T S,142,63,29,1959,2008
liechtenstein,L IH1 K T AH0 N S T AY2 N,94,80,27,1956,2008
lied,L AY1 D,1317759,601887,348,1520,2008
lieder,L IY1 D ER0,35506,13438,176,1712,2008
lief,L IY1 F,86308,67479,337,1579,2008
liefer,L IY1 F ER0,10665,6490,205,1684,2008
liege,L IY1 JH,212859,94799,325,1581,2008
liem,L IY1 M,1404,1054,209,1631,2008
lien,L IY1 N,1984224,187550,344,1568,2008
liens,L IY1 N Z,555194,87370,277,1600,2008
lierman,L IH1 R M AH0 N,187,177,88,1818,2008
lies,L AY1 Z,24016027,3397905,413,1505,2008
liese,L IY1 Z,1047,1002,203,1669,2008
lieser,L IY1 S ER0,109,97,62,1825,2008
liesin,L IY1 S IH0 N,476,457,140,1707,2008
lieson,L IY1 S AO0 N,164,160,78,1728,2008
lietz,L IY1 T S,116,106,70,1804,2008
lieu,L UW1,2053305,724592,377,1505,2008
lieutenant,L UW0 T EH1 N AH0 N T,4021640,694076,332,1524,2008
lieutenants,L UW0 T EH1 N AH0 N T S,724482,305750,302,1575,2008
life,L AY1 F,271688722,4191844,422,1505,2008
"life's",L AY1 F S,1903,1735,193,1745,2008
lifeblood,L AY1 F B L AH2 D,148603,123382,221,1669,2008
lifeboat,L AY1 F B OW2 T,232279,75157,191,1776,2008
lifeboats,L AY1 F B OW2 T S,132523,47999,183,1776,2008
lifeguard,L AY1 F G AA2 R D,89067,41529,235,1637,2008
lifeguards,L AY1 F G AA2 R D Z,45893,22062,237,1738,2008
lifeless,L AY1 F L AH0 S,1108829,650577,332,1563,2008
lifelike,L AY1 F L AY2 K,245106,158819,197,1590,2008
lifeline,L AY1 F L AY2 N,212060,138949,149,1698,2008
lifelines,L AY1 F L AY2 N Z,42894,26342,144,1808,2008
lifelong,L AY1 F L AO1 NG,1682495,751753,231,1520,2008
lifer,L AY1 F ER0,30086,19290,281,1631,2008
lifers,L AY1 F ER0 Z,40975,19045,217,1642,2008
lifes,L AY1 F S,125579,47457,250,1572,2008
lifesaver,L AY1 F S EY2 V ER0,37387,31235,114,1885,2008
lifesavers,L AY1 F S EY2 V ER0 Z,15306,8856,120,1858,2008
lifesaving,L AY1 F S EY2 V IH0 NG,134755,69831,155,1777,2008
lifespan,L AY1 F S P AE2 N,313608,135341,113,1607,2008
lifespans,L AY1 F S P AE2 N Z,25338,16143,69,1928,2008
lifestyle,L AY1 F S T AY2 L,2702192,650156,138,1515,2008
lifestyles,L AY1 F S T AY2 L Z,740086,300504,91,1777,2008
lifetime,L AY1 F T AY2 M,6560718,1923679,344,1505,2008
lifetimes,L AY1 F T AY2 M Z,517766,237516,208,1590,2008
liff,L IH1 F,4371,3422,251,1688,2008
liffe,L IH1 F,3612,2549,234,1635,2008
lifo,L IY1 F OW0,29605,12881,244,1648,2008
liford,L IH1 F ER0 D,62,58,42,1809,2007
lifshitz,L IH1 F SH IH0 T S,162,129,43,1950,2008
lift,L IH1 F T,7127644,1943389,389,1507,2008
lifted,L IH1 F T AH0 D,8600742,1960682,384,1515,2008
lifter,L IH1 F T ER0,123779,52874,305,1581,2008
lifters,L IH1 F T ER0 Z,82025,33713,263,1667,2008
liftin,L IH1 F T IH0 N,5086,4141,177,1770,2008
lifting,L IH1 F T IH0 NG,3504011,1349098,376,1563,2008
liftoff,L IH1 F T AO2 F,40805,16878,87,1670,2008
lifton,L IH1 F T AH0 N,637,378,89,1777,2008
lifts,L IH1 F T S,1430987,697647,354,1581,2008
ligament,L IH1 G AH0 M AH0 N T,2225317,111465,286,1648,2008
ligaments,L IH1 G AH0 M AH0 N T S,1135058,140636,301,1629,2008
ligand,L IH1 G AH0 N D,1178814,61182,95,1738,2008
ligands,L IH1 G AH0 N D Z,656746,54135,73,1878,2008
ligas,L AY1 G AH0 Z,2895,1528,158,1631,2008
ligation,L AY0 G EY1 SH AH0 N,471139,75550,295,1669,2008
ligget,L IH1 G IH0 T,1394,428,88,1816,2008
liggett,L IH1 G IH0 T,92,64,39,1847,2008
liggins,L IH1 G IH0 N Z,406,312,59,1825,2008
light,L AY1 T,102237666,4129383,418,1505,2008
lightbulb,L AY1 T B AH2 L B,71625,42267,80,1713,2008
lightbulbs,L AY1 T B AH2 L B Z,37005,24760,68,1890,2008
lighted,L AY1 T AH0 D,3514957,1131261,380,1563,2008
lighten,L AY1 T AH0 N,648288,475102,343,1579,2008
lightened,L AY1 T AH0 N D,483552,366804,305,1507,2008
lightening,L AY1 T AH0 N IH0 NG,301031,218111,303,1572,2008
lightens,L AY1 T AH0 N Z,99032,84554,300,1640,2008
lighter,L AY1 T ER0,3938469,1448077,370,1572,2008
lighters,L AY1 T ER0 Z,196152,97916,269,1629,2008
lightest,L AY1 T AH0 S T,511524,330776,335,1579,2008
lightfast,L AY1 T F AE2 S T,5870,1461,76,1924,2008
lightfastness,L AY1 T F AE2 S T N AH0 S,14070,1471,67,1931,2008
lightfoot,L AY1 T F UH2 T,3296,2343,155,1715,2008
lightheaded,L AY2 T HH EH1 D AH0 D,54476,44435,226,1592,2008
lightheadedness,L AY1 T HH EH2 D AH0 D N AH0 S,61386,28278,195,1776,2008
lighthearted,L AY1 T HH AA2 R T IH0 D,224203,167509,205,1581,2008
lighthouse,L AY1 T HH AW2 S,748349,236139,258,1575,2008
lighthouses,L AY1 T HH AW2 S IH0 Z,180437,87625,228,1719,2008
lighting,L AY1 T IH0 NG,5157666,1282977,349,1524,2008
lightly,L AY1 T L IY0,5197805,1758915,389,1563,2008
lightner,L AY1 T N ER0,115,93,49,1825,2008
lightness,L AY1 T N AH0 S,836029,466717,343,1574,2008
lightning,L AY1 T N IH0 NG,3984028,1272653,368,1563,2008
lightnings,L AY1 T N IH0 NG Z,166827,102915,323,1520,2008
lights,L AY1 T S,10016878,2072522,389,1524,2008
lightship,L AY1 T SH IH2 P,37998,13687,167,1784,2008
lightships,L AY1 T SH IH2 P S,16500,8129,163,1816,2008
lightstone,L AY1 T S T OW2 N,199,53,24,1849,2008
lightweight,L AY1 T W EY1 T,787943,300078,161,1811,2008
lighty,L AY1 T IY0,1157,977,201,1698,2008
ligman,L IH1 G M AH0 N,105,98,51,1824,2008
lignin,L IH1 G N IH0 N,394454,39724,196,1801,2008
lignite,L IH1 G N AY2 T,285755,63802,209,1515,2008
ligon,L IH1 G AH0 N,277,193,68,1751,2008
liguori,L IY0 G AO1 R IY0,113,91,47,1846,2008
likable,L AY1 K AH0 B AH0 L,165709,112436,167,1707,2008
like,L AY1 K,332167852,4406052,425,1505,2008
likeable,L AY1 K AH0 B AH0 L,149320,108740,200,1563,2008
liked,L AY1 K T,12049634,2015280,391,1524,2008
likelier,L AY1 K L IY0 ER0,59544,42392,317,1581,2008
likeliest,L AY1 K L IY0 AH0 S T,96593,73228,343,1579,2008
likelihood,L AY1 K L IY0 HH UH2 D,5404530,1367224,367,1505,2008
likely,L AY1 K L IY0,60079309,3728920,406,1515,2008
liken,L AY1 K AH0 N,161728,134690,322,1568,2008
likened,L AY1 K AH0 N D,916191,575902,331,1572,2008
likeness,L AY1 K N AH0 S,2439700,839425,360,1520,2008
likenesses,L AY1 K N AH0 S IH0 Z,310832,183719,277,1568,2008
likening,L AY1 K AH0 N IH0 NG,90068,76160,263,1642,2008
likens,L AY1 K AH0 N Z,159342,121530,282,1659,2008
likes,L AY1 K S,4532161,1577753,360,1505,2008
likewise,L AY1 K W AY2 Z,10248938,1852287,413,1505,2008
liking,L AY1 K IH0 NG,2035034,996787,380,1520,2008
likins,L IH1 K IH0 N Z,229,134,65,1804,2008
likud,L IH1 K AH0 D,215,123,40,1808,2008
lil,L IH1 L,95107,49531,307,1649,2008
lila,L IY1 L AH0,28404,9902,208,1725,2008
lilac,L AY1 L AE2 K,490289,208127,246,1721,2008
lilacs,L AY1 L AE2 K S,153681,88323,225,1736,2008
lilah,L IH1 L AH0,426,310,94,1704,2008
lilco,L IH1 L K OW0,106,85,56,1812,2008
lile,L AY1 L,27474,16476,293,1581,2008
liles,L AY1 L Z,3268,2420,224,1708,2008
liley,L IH1 L IY0,233,203,83,1791,2008
lili,L IH1 L IY0,11798,8414,238,1593,2008
lilia,L IY1 L IY0 AH0,5713,4409,253,1683,2008
lilian,L IH1 L IY0 AH0 N,526,259,96,1730,2008
liliana,L IH2 L IY0 AE1 N AH0,1020,302,78,1852,2008
liliane,L IH0 L IY0 AE1 N,596,98,33,1910,2008
lilias,L AY1 L IY0 AH0 Z,168,159,90,1794,2008
lilien,L IH1 L IY0 AH0 N,134,109,62,1735,2008
lilienthal,L IH1 L IY0 N TH AH0 L,208,160,61,1904,2008
lilies,L IH1 L IY0 Z,906049,402421,303,1587,2008
lilith,L IH1 L IH0 TH,1416,681,122,1819,2008
lilja,L IY1 L Y AH0,100,76,41,1894,2008
lill,L IH1 L,16072,12511,277,1581,2008
lilla,L IH1 L AH0,4474,2164,182,1685,2008
lillard,L IH1 L ER0 D,134,129,57,1702,2008
lille,L IH1 L,7888,3805,211,1701,2008
liller,L IH1 L ER0,658,548,125,1787,2008
lilley,L IH1 L IY0,264,214,86,1797,2008
lilli,L IH1 L IY0,1721,1361,182,1761,2008
lillian,L IH1 L IY0 AH0 N,3104,763,84,1898,2008
lillich,L IH1 L IH0 K,103,55,30,1869,2007
lillie,L IH1 L IY0,1857,1265,185,1587,2008
lilliputian,L IH2 L AH0 P Y UW1 SH AH0 N,9022,7740,204,1758,2008
lillis,L IH1 L IH0 S,280,246,89,1810,2008
lillo,L IH1 L OW0,262,228,100,1775,2008
lilly,L IH1 L IY0,13701,9311,290,1595,2008
lilt,L IH1 L T,141497,110002,308,1598,2008
lily,L IH1 L IY0,1014547,424541,323,1515,2008
lim,L IH1 M,135700,76702,329,1515,2008
lima,L AY1 M AH0,163476,74048,290,1505,2008
liman,L AY1 M AH0 N,5436,2262,208,1707,2008
limas,L AY1 M AH0 Z,11238,4895,163,1707,2008
limb,L IH1 M,4577819,934307,342,1520,2008
limbaugh,L IH1 M B AO2,302,190,25,1965,2008
limbed,L IH1 M D,147985,112083,277,1564,2008
limber,L IH1 M B ER0,138308,86710,301,1588,2008
limbers,L IH1 M B ER0 Z,31409,15023,221,1720,2008
limbless,L IH1 M L AH0 S,25238,16770,192,1685,2008
limbo,L IH1 M B OW0,354294,254057,270,1572,2008
limbs,L IH1 M Z,5065290,1286727,358,1563,2008
limburg,L IH1 M B ER0 G,292,199,78,1806,2008
lime,L AY1 M,5162580,855313,362,1507,2008
limehouse,L AY1 M HH AW2 S,286,243,86,1812,2008
limelight,L AY1 M L AY2 T,305701,223193,167,1689,2008
limerick,L IH1 M ER0 IH0 K,41824,21924,201,1706,2008
limericks,L IH1 M ER0 IH0 K S,34576,20365,123,1809,2008
limes,L AY1 M Z,320753,165001,329,1581,2008
limestone,L AY1 M S T OW2 N,4092537,461354,261,1665,2008
limestones,L AY1 M S T OW2 N Z,756630,68149,240,1727,2008
limine,L IH0 M AY1 N,51525,24125,286,1678,2008
liming,L AY1 M IH0 NG,119538,30571,281,1672,2008
limit,L IH1 M AH0 T,21230504,2971375,385,1505,2008
limitation,L IH2 M IH0 T EY1 SH AH0 N,6299430,1471115,366,1507,2008
limitations,L IH2 M IH0 T EY1 SH AH0 N Z,11369240,2180209,358,1515,2008
limited,L IH1 M AH0 T AH0 D,44983912,3590621,396,1505,2008
limiting,L IH1 M AH0 T IH0 NG,5825042,1578127,351,1507,2008
limitless,L IH1 M AH0 T L AH0 S,780947,503666,214,1665,2008
limits,L IH1 M AH0 T S,21145178,3009600,387,1505,2008
limmer,L IH1 M ER0,3393,2129,203,1636,2008
limnology,L IH0 M N AA1 L AH0 JH IY0,28530,9218,121,1826,2008
limo,L IH1 M OW0,200782,64063,273,1656,2008
limoges,L IH0 M OW1 JH IH0 Z,395,285,80,1808,2008
limon,L IH1 M AH0 N,17222,8088,242,1588,2008
limonite,L AY1 M AH0 N AY2 T,100840,20638,162,1842,2008
limos,L IH1 M OW0 Z,23477,16294,135,1801,2008
limousine,L IH1 M AH0 Z IY2 N,388873,153227,126,1838,2008
limousines,L IH1 M AH0 Z IY2 N Z,96030,66229,111,1783,2008
limp,L IH1 M P,1154898,564098,274,1524,2008
limped,L IH1 M P T,307887,199389,256,1582,2008
limpets,L IH1 M P AH0 T S,63888,26494,247,1742,2008
limping,L IH1 M P IH0 NG,325383,227579,306,1581,2008
limps,L IH1 M P S,49924,42355,263,1625,2008
lin,L IH1 N,465237,154230,348,1524,2008
lina,L IY1 N AH0,21328,15383,262,1631,2008
linage,L AY1 N IH0 JH,21973,11953,287,1568,2008
linam,L IH1 N AH0 M,180,172,80,1726,2008
linares,L IH1 N ER0 Z,102,87,42,1768,2008
linc,L IH1 NG K,5348,4066,228,1644,2008
lincare,L IH1 N K EH2 R,63,59,45,1819,2007
lince,L IH1 N S,5426,4443,340,1612,2008
linch,L IH1 N CH,11780,8663,221,1717,2008
linchpin,L IH1 N CH P IH2 N,86140,69204,200,1777,2008
linck,L IH1 NG K,819,739,156,1638,2008
lincks,L IH1 NG K S,272,201,85,1638,2008
lincoln,L IH1 NG K AH0 N,7785,4073,199,1748,2008
"lincoln's",L IH1 NG K AH0 N Z,141,137,55,1778,2008
lincolns,L IH1 NG K AH0 N Z,141,121,60,1820,2008
lincolnshire,L IH1 NG K AH0 N SH IH2 R,297,190,77,1796,2008
lind,L IH1 N D,30878,23473,311,1644,2008
linda,L IH1 N D AH0,24569,9967,221,1733,2008
lindahl,L IH1 N D AA2 L,303,194,56,1898,2008
lindane,L IH1 N D EY2 N,66169,13439,112,1805,2008
lindau,L IH1 N D AW0,180,139,48,1809,2008
lindauer,L IH1 N D AW0 ER0,84,52,27,1898,2008
lindbeck,L AY1 N D B EH0 K,94,73,28,1967,2008
lindberg,L AY1 N D B ER0 G,379,305,59,1896,2008
lindbergh,L IH1 N D B ER0 G,328,206,61,1923,2008
lindblad,L IH1 N D B L AH0 D,58,47,34,1957,2007
lindblom,L IH1 N D B L AH0 M,397,271,55,1920,2008
linde,L IH1 N D,7969,2301,196,1603,2008
lindell,L IH1 N D AH0 L,104,65,37,1909,2006
lindeman,L IH1 N D M AH0 N,173,144,56,1890,2008
lindemann,L IH1 N D AH0 M AH0 N,392,253,66,1899,2008
linden,L IH1 N D AH0 N,120425,59692,262,1673,2008
lindenbaum,L AY1 N D AH0 N B AW0 M,109,85,43,1847,2008
lindenberg,L IH1 N D AH0 N B ER0 G,97,60,28,1838,2008
