word,pronunication,tf,df,years,year_first,year_recent
linder,L IH1 N D ER0,3532,2843,253,1650,2008
linderman,L AY1 N D ER0 M AH0 N,81,62,36,1901,2008
lindfors,L IH1 N D F ER0 Z,79,50,25,1968,2008
lindgren,L IH1 N D G R EH0 N,422,275,72,1906,2008
lindh,L IH1 N D,49,46,26,1824,2008
lindholm,L IH1 N D HH OW2 L M,153,89,42,1947,2008
lindley,L IH1 N D L IY0,644,500,121,1806,2008
lindman,L IH1 N D M AH0 N,117,77,38,1891,2007
lindner,L IH1 N D N ER0,826,235,62,1889,2008
lindo,L IH1 N D OW0,6385,3317,157,1524,2008
lindon,L IH1 N D AH0 N,209,132,63,1704,2008
lindow,L IH1 N D OW0,74,64,36,1816,2008
lindquist,L IH1 N D K W IH2 S T,490,232,62,1847,2008
lindroth,L IH1 N D R AO2 TH,70,50,26,1944,2003
lindsay,L IH1 N D Z IY0,2041,1166,120,1721,2008
lindsey,L IH1 N D Z IY0,1292,1004,164,1768,2008
lindsley,L IH1 N D S L IY0,324,174,49,1822,2008
lindstrom,L IH1 N D S T R AH0 M,262,204,57,1834,2007
lindy,L IH1 N D IY0,5257,2802,86,1728,2008
line,L AY1 N,110737592,4124828,408,1505,2008
"line's",L AY1 N Z,70,70,42,1819,2008
lineage,L IH1 N IY0 AH0 JH,2058059,543848,311,1524,2008
lineages,L IH1 N IY0 IH0 JH IH0 Z,567983,99061,243,1590,2008
lineal,L IH1 N IY0 AH0 L,477774,210976,333,1575,2008
linear,L IH1 N IY0 ER0,13721672,1118425,285,1505,2008
linearly,L IH1 N IY0 ER0 L IY0,1083913,264180,203,1763,2008
lineback,L AY1 N B AE2 K,970,343,61,1892,2008
linebacker,L AY1 N B AE2 K ER0,93441,25863,64,1942,2008
linebackers,L AY1 N B AE2 K ER0 Z,27949,7290,64,1942,2008
lined,L AY1 N D,5077309,1560661,360,1524,2008
linehan,L IH1 N IH0 HH AE0 N,110,55,26,1899,2008
lineitem,L AY1 N EY0 T AH0 M,2835,1802,53,1946,2008
lineman,L AY1 N M AH0 N,83277,30994,162,1694,2008
linemen,L AY1 N M AH0 N,74722,23413,162,1767,2008
linen,L IH1 N AH0 N,3462747,989147,345,1505,2008
linens,L IH1 N AH0 N Z,365724,160847,274,1669,2008
liner,L AY1 N ER0,1024045,324068,268,1607,2008
linerboard,L AY1 N ER0 B AO2 R D,7103,1545,67,1893,2008
liners,L AY1 N ER0 Z,573277,229092,228,1659,2008
lines,L AY1 N Z,56771451,3787465,403,1505,2008
"lines'",L AY1 N Z,126,124,47,1834,2008
linette,L IH0 N EH1 T,82,65,41,1775,2008
lineup,L AY1 N AH2 P,310408,101799,127,1760,2008
lineups,L AY1 N AH2 P S,35675,15920,96,1901,2008
lineweaver,L AY1 N W IY2 V ER0,78,71,39,1912,2008
linford,L IH1 N F ER0 D,75,63,30,1761,2008
ling,L IH1 NG,457134,209686,371,1515,2008
lingard,L IH1 NG G ER0 D,226,159,84,1827,2008
linger,L IH1 NG G ER0,1113542,700067,342,1588,2008
lingered,L IH1 NG G ER0 D,1403312,708386,293,1563,2008
lingerie,L AA1 N ZH ER0 EY2,163245,85575,182,1733,2008
lingering,L IH1 NG G ER0 IH0 NG,1590466,900806,337,1563,2008
lingers,L IH1 NG G ER0 Z,455837,341633,300,1637,2008
lingg,L IH1 NG G,83,59,40,1852,2008
lingle,L IH1 NG G AH0 L,1117,948,258,1619,2008
lingo,L IH1 NG G OW0,155776,112471,244,1713,2008
lings,L IH1 NG Z,35003,29846,340,1607,2008
lingua,L IH1 NG G W AH0,399357,159359,336,1507,2008
linguine,L IH0 NG G W IY1 N IY0,29271,9980,59,1581,2008
linguist,L IH1 NG G W IH0 S T,500107,215320,277,1643,2008
linguistic,L IH0 NG G W IH1 S T IH0 K,7565975,782422,231,1515,2008
linguistically,L IH0 NG G W IH1 S T IH0 K L IY0,463202,193775,164,1524,2008
linguistics,L IH0 NG G W IH1 S T IH0 K S,1407798,222594,191,1673,2008
linguists,L IH1 NG G W IH0 S T S,634882,153985,256,1624,2008
lingus,L IH1 NG G AH0 S,413,360,113,1732,2008
linh,L IH1 N,3008,1010,128,1687,2008
lini,L IY1 N IY0,18853,10149,270,1658,2008
lining,L AY1 N IH0 NG,2934247,874375,329,1574,2008
linings,L AY1 N IH0 NG Z,316632,131452,268,1603,2008
link,L IH1 NG K,13695750,2404360,364,1515,2008
linkage,L IH1 NG K AH0 JH,2300092,529583,162,1600,2008
linkages,L IH1 NG K IH0 JH IH0 Z,1540824,378518,143,1713,2008
linke,L IH1 NG K,13816,6553,198,1581,2008
linked,L IH1 NG K T,12866418,2226652,357,1515,2008
linker,L IH1 NG K ER0,174238,29753,210,1711,2008
linking,L IH1 NG K IH0 NG,3405507,1170148,329,1515,2008
linkletter,L IH1 NG K L EH2 T ER0,106,64,34,1954,2008
links,L IH1 NG K S,9176562,1787762,346,1515,2008
linkup,L IH1 NG K AH2 P,18195,11381,94,1810,2008
linkups,L IH1 NG K AH2 P S,3779,3046,52,1814,2008
linley,L IH1 N L IY0,126,99,58,1805,2008
linn,L IH1 N,42937,31970,273,1505,2008
linnas,L IH1 N AH0 S,144,85,36,1903,2007
linne,L IH1 N,1497,958,179,1588,2008
linnea,L IH1 N IY0 AH0,217,165,74,1629,2008
linnell,L IH1 N AH0 L,124,89,49,1881,2008
linnet,L IH1 N IH0 T,50922,32293,268,1677,2008
linney,L IH1 N IY0,269,173,87,1809,2008
lino,L IY1 N OW0,130943,68027,289,1524,2008
linoleum,L AH0 N OW1 L IY0 AH0 M,292287,146689,147,1752,2008
linotype,L IH1 N OW0 T AY2 P,50086,26684,126,1719,2008
linquist,L IH1 N K W IH0 S T,327,297,89,1762,2008
lins,L IH1 N Z,12908,10492,299,1644,2008
linse,L IH1 N S,775,407,133,1770,2008
linseed,L IH1 N S IY2 D,428183,117576,273,1683,2008
linsey,L IH1 N Z IY0,32310,20778,243,1589,2008
linsky,L IH1 N S K IY0,321,283,77,1827,2008
linsley,L IH1 N S L IY0,146,112,46,1856,2008
linson,L IH1 N S AH0 N,1655,1258,201,1662,2008
lint,L IH1 N T,407037,172434,327,1507,2008
lintas,L IH1 N T AH0 S,1115,340,58,1812,2008
lintel,L IH1 N T AH0 L,273623,96514,248,1707,2008
linters,L IH1 N T ER0 Z,31202,8723,131,1834,2008
lintner,L IH1 N T N ER0,104,77,43,1814,2005
linton,L IH1 N T AH0 N,1904,1454,175,1722,2008
linus,L AY1 N AH0 S,2774,2180,269,1631,2008
linux,L IH1 N AH0 K S,29121,3458,24,1904,2008
linville,L IY1 N V IH0 L,92,77,46,1845,2008
linwood,L IH1 N W UH2 D,261,227,89,1773,2008
linz,L IH1 N Z,962,737,101,1821,2008
linzer,L IH1 N Z ER0,832,480,48,1883,2008
liomine,L IY1 AH0 M AY0 N,125,117,77,1726,2008
lion,L AY1 AH0 N,4426213,1255591,382,1507,2008
"lion's",L AY1 AH0 N Z,3895,3025,188,1713,2008
lionel,L AY1 AH0 N AH0 L,1164,704,103,1817,2008
lionheart,L AY1 AH0 N HH AA2 R T,623,525,105,1818,2008
lionize,L AY1 AH0 N AY2 Z,8380,7747,182,1800,2008
lionized,L AY1 AH0 N AY2 Z D,51483,44279,188,1624,2008
lions,L AY1 AH0 N Z,1847384,664969,356,1507,2008
"lions'",L AY1 AH0 N Z,260,222,101,1801,2008
liotta,L IY0 OW1 T AH0,77,66,48,1829,2008
liou,L IY0 UW1,2214,1734,218,1709,2008
lip,L IH1 P,4734075,1251301,358,1505,2008
lipa,L IY1 P AH0,3695,2716,206,1733,2008
lipari,L IY0 P AA1 R IY0,93,66,41,1811,2008
lipe,L AY1 P,2358,2034,233,1564,2008
lipid,L AY1 P AH0 D,2269198,130504,193,1742,2008
lipide,L IH0 P IY1 D,10525,1517,89,1644,2008
lipinski,L IH0 P IH1 N S K IY0,96,69,33,1890,2008
lipkin,L IH1 P K IH0 N,78,58,36,1909,2008
lipman,L IH1 P M AH0 N,308,240,62,1724,2008
lipoprotein,L IH2 P AH0 P R OW1 T IY0 N,530967,56034,93,1909,2008
lipoproteins,L IH2 P OW0 P R OW1 T IY0 N Z,329536,42149,93,1910,2008
liposome,L IH1 P AH0 S OW2 M,87009,10890,58,1808,2008
liposomes,L IH1 P AH0 S OW2 M Z,236054,18241,78,1914,2008
liposuction,L IH1 P OW0 S AH2 K SH AH0 N,56593,12152,31,1960,2008
lipp,L IH1 P,777,658,146,1711,2008
lippa,L IH1 P AH0,813,573,157,1679,2008
lippard,L IH1 P ER0 D,225,106,43,1852,2008
lippe,L IH1 P,3192,2475,212,1568,2008
lipped,L IH1 P T,299523,202567,255,1686,2008
lippens,L IH1 P AH0 N Z,138,115,54,1807,2008
lipper,L IH1 P ER0,1254,855,166,1763,2008
lippert,L IH1 P ER0 T,136,88,42,1899,2008
lippi,L IH1 P IY0,922,768,187,1702,2008
lippincott,L IH1 P IH0 N K AH0 T,854,713,122,1835,2008
lippitt,L IH1 P IH0 T,468,260,51,1876,2008
lippman,L IH1 P M AH0 N,324,156,50,1917,2008
lippmann,L IH1 P M AH0 N,562,416,84,1853,2008
lippo,L IH1 P OW0,610,479,135,1719,2008
lippold,L IH1 P OW2 L D,65,52,28,1950,2007
lipps,L IH1 P S,1694,1324,189,1603,2008
lippy,L IH1 P IY0,3498,2940,167,1786,2008
lips,L IH1 P S,14151348,1844528,381,1507,2008
"lips'",L IH1 P S,60,59,28,1775,2008
lipschitz,L IH1 P SH IH0 T S,378,144,43,1944,2008
lipscomb,L IH1 P S K AH0 M,149,95,41,1824,2008
lipsett,L IH1 P S IH0 T,83,60,30,1951,2008
lipsey,L IH1 P S IY0,235,128,45,1894,2008
lipsitz,L IH1 P S IH0 T S,68,53,28,1965,2008
lipski,L IH1 P S K IY2,126,53,31,1795,2008
lipsky,L IH1 P S K AY2,114,94,40,1928,2008
lipson,L IH1 P S AH0 N,310,249,84,1777,2008
lipstick,L IH1 P S T IH2 K,482956,218869,104,1706,2008
lipsticks,L IH1 P S T IH2 K S,32972,21257,89,1823,2008
lipton,L IH1 P T AH0 N,860,394,66,1819,2008
liquefaction,L IH2 K W AH0 F AE1 K SH AH0 N,324579,76712,260,1645,2008
liquefied,L IH1 K W AH0 F AY2 D,287460,99412,259,1600,2008
liquefy,L IH1 K W AH0 F AY2,96780,50375,238,1657,2008
liqueur,L IH0 K ER1,204841,82441,245,1685,2008
liqueurs,L IH0 K ER1 Z,113277,66149,242,1665,2008
liquid,L IH1 K W AH0 D,17471504,1563312,363,1515,2008
liquidate,L IH1 K W IH0 D EY2 T,396087,201664,270,1600,2008
liquidated,L IH1 K W IH0 D EY2 T IH0 D,709439,249327,275,1600,2008
liquidates,L IH1 K W IH0 D EY2 T S,29310,14880,198,1600,2008
liquidating,L IH1 K W IH0 D EY2 T IH0 NG,289216,118848,251,1524,2008
liquidation,L IH2 K W IH0 D EY1 SH AH0 N,1497238,310829,259,1600,2008
liquidations,L IH2 K W IH0 D EY1 SH AH0 N Z,66172,25913,209,1600,2008
liquidator,L IH1 K W IH0 D EY2 T ER0,224204,21523,170,1687,2008
liquidators,L IH1 K W IH0 D EY2 T ER0 Z,81098,13835,158,1830,2008
liquide,L IH0 K W AY1 D,38319,12792,226,1507,2008
liquidities,L IH0 K W IH1 D AH0 T IY0 Z,3847,1739,83,1804,2008
liquidity,L IH0 K W IH1 D AH0 T IY0,1352215,151238,253,1515,2008
liquids,L IH1 K W AH0 D Z,2517256,462321,303,1590,2008
liquor,L IH1 K ER0,4368070,964354,362,1524,2008
liquori,L IY0 K AO1 R IY0,724,524,155,1704,2008
liquors,L IH1 K ER0 Z,961308,300062,331,1587,2008
lira,L IH1 R AH0,172694,71451,295,1588,2008
lire,L IH1 R AH0,621117,184417,351,1524,2008
lirette,L ER0 EH1 T,45,43,26,1878,2008
liro,L IH1 R OW0,1575,1101,197,1701,2008
lis,L IH1 S,673462,364885,353,1505,2008
lisa,L IY1 S AH0,21237,9772,279,1653,2008
lisabeth,L IH1 S AH0 B EH0 TH,422,330,92,1746,2008
lisak,L IH1 S AH0 K,83,43,26,1784,2004
lisbeth,L IH1 S B IH0 TH,271,99,37,1894,2008
lisbon,L IH1 Z B AH0 N,750,495,118,1753,2008
lisco,L IH1 S K OW0,168,142,74,1810,2008
lise,L AY1 Z,155820,13837,351,1581,2008
lisec,L IH1 Z AH0 K,309,296,122,1801,2008
lisette,L IH0 S EH1 T,577,147,59,1792,2008
lish,L IH1 SH,98739,78421,322,1515,2008
lishman,L IH1 SH M AH0 N,2787,2715,230,1725,2008
lisi,L IY1 S IY0,3647,2850,198,1709,2008
lisk,L IH1 S K,2046,1608,208,1726,2008
liska,L IH1 S K AH0,407,220,69,1811,2008
liske,L IH1 S K,111,90,51,1787,2008
lisle,L AY1 AH0 L,16804,11864,235,1683,2008
lisman,L IH1 Z M AH0 N,46,41,33,1765,2008
lisp,L IH1 S P,118952,86529,301,1635,2008
liss,L IH1 S,6088,4248,233,1704,2008
lissa,L IH1 S AH0,1467,788,132,1757,2008
lissner,L IH1 S N ER0,95,71,36,1897,2007
lissy,L IH1 S IY0,62,60,36,1822,2008
list,L IH1 S T,40111173,3478779,409,1505,2008
listed,L IH1 S T AH0 D,13837880,2211622,369,1515,2008
listen,L IH1 S AH0 N,11866244,2368449,374,1505,2008
listened,L IH1 S AH0 N D,7586607,1766919,339,1564,2008
listener,L IH1 S AH0 N ER0,2325775,672650,244,1698,2008
listeners,L IH1 S AH0 N ER0 Z,2232310,687243,247,1515,2008
listening,L IH1 S AH0 N IH0 NG,9816444,2048439,342,1520,2008
listens,L IH1 S AH0 N Z,920379,559462,314,1579,2008
lister,L IH1 S T ER0,26558,15511,290,1621,2008
listeria,L IH0 S T IH1 R IY0 AH0,10447,5173,194,1802,2008
listerine,L IH1 S T ER0 IY2 N,2746,1744,125,1882,2008
listing,L IH1 S T IH0 NG,3862625,1062490,338,1515,2008
listings,L IH1 S T IH0 NG Z,867822,283402,211,1600,2008
listless,L IH1 S T L AH0 S,372705,271152,304,1564,2008
listlessly,L IH1 S T L AH0 S L IY0,169183,127424,222,1750,2008
liston,L IH1 S T AH0 N,1465,1205,177,1734,2008
lists,L IH1 S T S,9897950,2034880,376,1515,2008
liszt,L IH1 S T,1105,533,113,1854,2008
lit,L IH1 T,5410051,1526441,376,1515,2008
lita,L IY1 T AH0,4839,3411,241,1644,2008
litan,L AY1 T AH0 N,1733,1582,230,1678,2008
litanies,L IH1 T AH0 N IY0 Z,84250,56157,262,1715,2008
litany,L IH1 T AH0 N IY0,367924,248335,277,1607,2008
litchfield,L IH1 CH F IY0 L D,298,210,85,1699,2008
lite,L AY1 T,339451,197737,358,1507,2008
litem,L AY1 T EH0 M,117212,27460,279,1581,2008
liter,L IY1 T ER0,1457068,235922,333,1505,2008
literacy,L IH1 T ER0 AH0 S IY0,3982114,511928,234,1515,2008
literal,L IH1 T ER0 AH0 L,3814455,1085382,364,1505,2008
literally,L IH1 T ER0 AH0 L IY0,7766540,2183872,373,1505,2008
literary,L IH1 T ER0 EH2 R IY0,21371028,1752779,349,1515,2008
literate,L IH1 T ER0 AH0 T,1314391,486946,281,1515,2008
literati,L IH2 T ER0 AA1 T IY0,337052,130645,288,1563,2008
literature,L IH1 T ER0 AH0 CH ER0,37575778,2954744,364,1505,2008
literaturnaya,L IH0 T EH2 R AH0 T ER0 N AY1 AH0,467,255,58,1911,2008
liters,L IY1 T ER0 Z,716535,152412,296,1631,2008
lites,L AY1 T S,19671,14356,307,1515,2008
lithe,L AY1 DH,299828,207975,298,1568,2008
lithgow,L IH1 TH G AW0,372,346,149,1678,2008
lithic,L IH1 TH IH0 K,231769,28265,211,1785,2008
lithium,L IH1 TH IY0 AH0 M,1211431,141287,197,1731,2008
lithograph,L IH1 TH AH0 G R AE2 F,210995,78451,201,1524,2008
lithographic,L IH2 TH AH0 G R AE1 F IH0 K,184996,63589,204,1524,2008
lithographs,L IH1 TH AH0 G R AE2 F S,188506,75334,196,1524,2008
lithography,L AH0 TH AA1 G R AH0 F IY0,291477,64544,210,1714,2008
lithotripter,L IH1 TH AH0 T R IH2 P T ER0,4591,1151,32,1859,2008
lithuania,L IH2 TH AH0 W EY1 N IY0 AH0,665,229,57,1802,2008
lithuanian,L IH2 TH AH0 W EY1 N IY0 AH0 N,554,222,59,1798,2008
lithuanians,L IH2 TH AH0 W EY1 N IY0 AH0 N Z,61,45,26,1800,2008
litigant,L IH1 T IH0 G AH0 N T,241026,74240,261,1582,2008
litigants,L IH1 T IH0 G AH0 N T S,413762,121615,251,1649,2008
litigate,L IH1 T IH0 G EY2 T,119212,47540,261,1679,2008
litigated,L IH1 T IH0 G EY2 T IH0 D,180806,65298,275,1600,2008
litigates,L IH1 T IH0 G EY2 T S,4669,3577,161,1782,2008
litigating,L IH1 T IH0 G EY2 T IH0 NG,76492,36746,247,1730,2008
litigation,L IH2 T AH0 G EY1 SH AH0 N,3437706,511669,271,1520,2008
litigations,L IH2 T AH0 G EY1 SH AH0 N Z,62793,40833,255,1659,2008
litigator,L IH1 T AH0 G EY2 T ER0,29180,14007,148,1805,2008
litigators,L IH1 T AH0 G EY2 T ER0 Z,27212,11192,132,1685,2008
litigious,L IH0 T IH1 JH AH0 S,123022,88390,329,1581,2008
litle,L AY1 T AH0 L,91696,28723,332,1563,2008
litman,L IH1 T M AH0 N,140,127,51,1829,2008
litmus,L IH1 T M AH0 S,326315,106437,237,1662,2008
lits,L IH1 T S,22144,13659,267,1680,2008
litt,L IH1 T,67353,23493,292,1524,2008
littell,L IH1 T AH0 L,4758,2337,214,1725,2008
litten,L IH1 T AH0 N,5110,3786,189,1702,2008
litter,L IH1 T ER0,1898758,572832,341,1505,2008
litteral,L IH1 T ER0 AH0 L,4185,2834,269,1651,2008
littered,L IH1 T ER0 D,578065,381315,268,1590,2008
littering,L IH1 T ER0 IH0 NG,93683,71539,248,1658,2008
litters,L IH1 T ER0 Z,289292,107663,279,1590,2008
little,L IH1 T AH0 L,206526963,4338962,424,1505,2008
littleboy,L IH1 T AH0 L B OY2,1099,1079,111,1799,2008
littlechild,L IH1 T AH0 L CH AY2 L D,155,106,50,1806,2008
littlefield,L IH1 T AH0 L F IY2 L D,575,305,66,1823,2008
littlejohn,L IH1 T AH0 L JH AA2 N,238,147,57,1837,2008
littler,L IH1 T AH0 L ER0,21660,18297,263,1563,2008
littles,L IH1 T AH0 L Z,8566,6346,281,1651,2008
littlest,L IH1 T AH0 L AH0 S T,55543,43068,194,1681,2008
littleton,L IH1 T AH0 L T AH0 N,261,179,79,1750,2008
littlewood,L IH1 T AH0 L W UH2 D,240,126,49,1787,2008
littman,L IH1 T M AH0 N,101,72,37,1856,2008
littmann,L IH1 T M AH0 N,52,47,28,1837,2008
litton,L IH1 T AH0 N,207,176,86,1757,2008
littoral,L IH1 T ER0 AH0 L,495725,118089,215,1717,2008
litts,L IH1 T S,421,300,129,1679,2008
litty,L IH1 T IY0,871,586,147,1777,2008
liturgical,L AH0 T ER1 JH IH0 K AH0 L,1236081,199760,241,1541,2008
liturgy,L IH1 T ER0 JH IY0,1349048,256617,307,1541,2008
litvak,L IH1 T V AH0 K,258,151,43,1931,2008
litwack,L IH1 T W AO0 K,88,52,25,1965,2008
litwak,L IH1 T W AH0 K,209,129,41,1942,2007
litwin,L IH1 T W IH0 N,73,58,31,1899,2007
litz,L IH1 T S,2518,1620,202,1717,2008
liu,L Y UW1,45272,18292,268,1579,2008
liv,L IH1 V,257419,109512,337,1620,2008
livable,L IH1 V AH0 B AH0 L,133583,93840,187,1723,2008
livan,L IY0 V AA1 N,2116,1884,198,1658,2008
live,L AY1 V,56420401,3739510,405,1507,2008
lived,L AY1 V D,36974863,3318580,404,1507,2008
livelier,L AY1 V L IY0 ER0,197046,159267,318,1620,2008
liveliest,L AY1 V L IY2 AH0 S T,232321,176519,316,1587,2008
livelihood,L AY1 V L IY0 HH UH2 D,1896685,826005,343,1515,2008
livelihoods,L AY1 V L IY0 HH UH2 D Z,267872,108750,248,1515,2008
liveliness,L AY1 V L IY0 N AH0 S,291465,201640,310,1564,2008
lively,L AY1 V L IY0,4887763,1592073,385,1524,2008
liven,L AY1 V AH0 N,75125,66291,276,1648,2008
livened,L AY1 V AH0 N D,25379,23287,231,1675,2008
liver,L IH1 V ER0,11098789,788048,353,1520,2008
liveried,L IH1 V R IY0 D,72587,56400,232,1645,2008
livermore,L IH0 V ER0 M AO1 R,487,366,97,1820,2008
liverpool,L IH1 V ER0 P UW2 L,2543,1309,184,1803,2008
livers,L IH1 V ER0 Z,366676,147141,325,1579,2008
liverwort,L IH1 V ER0 W ER0 T,24639,9714,242,1717,2008
liverworts,L IH1 V ER0 W ER0 T S,55710,15032,212,1747,2008
livery,L IH1 V ER0 IY0,715748,313253,335,1574,2008
lives,L IH1 V Z,39451964,3481798,403,1505,2008
"lives'",L AY1 V Z,141,140,58,1813,2008
livesay,L IH1 V IH0 S EY0,84,58,36,1801,2008
livesey,L IH1 V IH0 S IY0,92,76,41,1846,2008
livestock,L AY1 V S T AA2 K,3339176,542715,229,1515,2008
livia,L IH1 V IY0 AH0,23667,9169,199,1684,2008
livid,L IH1 V IH0 D,424499,241530,321,1635,2008
lividity,L IH0 V IH1 D IH0 T IY0,26893,9471,224,1748,2008
"livin'",L IH1 V IH0 N,376,312,89,1888,2008
living,L IH1 V IH0 NG,66053493,3783742,405,1505,2008
livingroom,L IH1 V IH0 NG R UW2 M,51646,32292,161,1838,2008
livingrooms,L IH1 V IH0 NG R UW2 M Z,4002,3490,153,1829,2008
livings,L IH1 V IH0 NG Z,256798,114082,349,1520,2008
livingston,L IH1 V IH0 NG S T AH0 N,877,475,112,1833,2008
livingstone,L IH1 V IH0 NG S T OW2 N,846,548,105,1791,2008
livonia,L IH0 V OW1 N Y AH0,67,49,33,1753,2007
livor,L IH0 V AO1 R,6204,3415,244,1640,2008
liz,L IH1 Z,7986,4684,257,1590,2008
liza,L IY1 Z AH0,8335,1944,177,1730,2008
lizabeth,L IH1 Z AH0 B EH0 TH,3687,2596,232,1675,2008
lizard,L IH1 Z ER0 D,712044,246060,266,1590,2008
"lizard's",L IH1 Z ER0 D Z,251,174,68,1775,2008
lizards,L IH1 Z ER0 D Z,720022,232392,272,1507,2008
lizhi,L IH1 Z IY0,711,364,33,1830,2008
lizzie,L IH1 Z IY0,5609,3232,153,1724,2008
lizzy,L IH1 Z IY0,813,562,84,1813,2008
ljubljana,L Y UW1 B L Y AA0 N AH0,166,79,35,1958,2008
llama,L AA1 M AH0,177963,57433,236,1524,2008
llamas,L AA1 M AH0 Z,113166,37923,222,1590,2008
llana,L AE1 N AH0,12536,3452,168,1795,2008
llanas,L AE1 N AH0 Z,688,495,117,1631,2008
llanes,L EY1 N Z,115,101,58,1818,2008
llano,L AA1 N OW0,22538,9645,209,1652,2008
llanos,L AA1 N OW0 Z,49229,12635,205,1703,2008
llewellyn,L UW2 EH1 L IH0 N,571,370,73,1861,2008
llewelyn,L UW1 IH0 L IH0 N,434,114,47,1908,2008
llorente,L AO0 R EH1 N T EY0,48,41,26,1857,2008
llosa,L OW1 S AH0,606,461,154,1803,2008
llovio,L OW1 V IY0 OW0,183,126,56,1870,2008
lloyd,L OY1 D,8146,4442,156,1713,2008
lloyds,L OY1 D Z,180,136,59,1838,2008
ln,L EY1 N,6435877,336469,350,1515,2008
lo,L OW1,4307460,946965,400,1505,2008
load,L OW1 D,17882225,1966274,380,1507,2008
loaded,L OW1 D AH0 D,7000766,1775745,373,1524,2008
loader,L OW1 D ER0,302322,79028,248,1696,2008
loaders,L OW1 D ER0 Z,154953,66867,217,1664,2008
loading,L OW1 D IH0 NG,5806771,963493,347,1507,2008
loadings,L OW1 D IH0 NG Z,525188,95140,237,1682,2008
loads,L OW1 D Z,4718394,942422,347,1524,2008
loaf,L OW1 F,1211415,532338,308,1563,2008
loafer,L OW1 F ER0,80751,57983,198,1581,2008
loafers,L OW1 F ER0 Z,189265,129181,185,1670,2008
loafs,L OW1 F S,10154,9249,187,1732,2008
loam,L OW1 M,985898,173324,286,1644,2008
loamy,L OW1 M IY0,191241,61831,278,1676,2008
loan,L OW1 N,11048740,1304315,339,1515,2008
loaned,L OW1 N D,766807,383035,242,1520,2008
loaning,L OW1 N IH0 NG,125106,79946,226,1637,2008
loanloss,L OW1 N L AO2 S,295,251,36,1961,2008
loans,L OW1 N Z,9815925,956876,302,1515,2008
loar,L AO1 R,2230,1678,203,1708,2008
loath,L OW1 TH,473731,326485,375,1507,2008
loathe,L OW1 DH,288682,217090,276,1563,2008
loathed,L OW1 DH D,346380,233996,341,1581,2008
loathing,L OW1 TH IH0 NG,502612,324187,341,1572,2008
loathsome,L OW1 DH S AH0 M,485121,313654,355,1563,2008
loaves,L OW1 V Z,689699,315043,321,1590,2008
lob,L AA1 B,127029,58271,292,1590,2008
lobato,L OW0 B AA1 T OW0,863,436,162,1752,2008
lobb,L AA1 B,517,456,110,1707,2008
lobban,L AA1 B AH0 N,67,40,25,1797,2008
lobbed,L AA1 B D,49953,39402,179,1706,2008
lobbied,L AA1 B IY0 D,293842,165405,162,1590,2008
lobbies,L AA1 B IY0 Z,338493,185769,231,1515,2008
lobbing,L AA1 B IH0 NG,26738,21930,188,1724,2008
lobby,L AA1 B IY0,2491264,710444,272,1515,2008
lobbying,L AA1 B IY0 IH0 NG,1150640,328775,180,1712,2008
lobbyist,L AA1 B IY0 AH0 S T,226155,79523,153,1777,2008
lobbyists,L AA1 B IY0 IH0 S T S,419520,122647,154,1712,2008
lobe,L OW1 B,2858990,269663,308,1598,2008
lobed,L OW1 B D,320672,64151,231,1574,2008
lobel,L OW1 B AH0 L,712,444,108,1781,2008
lober,L OW1 B ER0,831,600,204,1667,2008
lobes,L OW1 B Z,1686353,248509,275,1572,2008
loblolly,L AA1 B L AA2 L IY0,82776,17369,208,1769,2008
lobo,L OW1 B OW0,20865,9015,215,1707,2008
lobos,L OW1 B OW0 S,9349,4736,203,1584,2008
lobotomy,L OW1 B OW2 T OW2 M IY0,74226,27136,78,1590,2008
lobs,L AA1 B Z,22867,12341,214,1598,2008
lobster,L AA1 B S T ER0,800851,240786,265,1600,2008
lobsterman,L AA1 B S T ER0 M AH0 N,8651,3653,115,1869,2008
lobstermen,L AA1 B S T ER0 M IH0 N,11650,4222,116,1866,2008
lobsters,L AA1 B S T ER0 Z,327708,125094,273,1649,2008
lobules,L AA1 B Y UW2 L Z,217980,35534,229,1679,2008
loca,L OW1 K AH0,101729,60716,326,1507,2008
local,L OW1 K AH0 L,84330240,3506934,369,1515,2008
locale,L OW0 K AE1 L,680822,326602,227,1620,2008
locales,L OW0 K AE1 L Z,425555,231535,221,1705,2008
localities,L OW0 K AE1 L IH0 T IY0 Z,3110293,779159,242,1515,2008
locality,L OW0 K AE1 L AH0 T IY0,3948307,989936,283,1524,2008
localization,L OW2 K AH0 L AH0 Z EY1 SH AH0 N,1780829,257309,186,1800,2008
localize,L OW1 K AH0 L AY2 Z,318921,147844,196,1713,2008
localized,L OW1 K AH0 L AY2 Z D,2981446,626517,212,1637,2008
locally,L OW1 K AH0 L IY0,4439167,1215809,324,1515,2008
locals,L OW1 K AH0 L Z,1169519,334164,202,1683,2008
locate,L OW1 K EY2 T,4357921,1441734,270,1507,2008
located,L OW1 K EY2 T AH0 D,21750596,2506162,282,1505,2008
locatelli,L OW0 K AA0 T EH1 L IY0,241,132,49,1755,2008
locates,L OW1 K EY2 T S,523449,298612,214,1637,2008
locating,L OW1 K EY2 T IH0 NG,1705286,793512,234,1584,2008
location,L OW0 K EY1 SH AH0 N,21150564,2357262,301,1505,2008
locations,L OW0 K EY1 SH AH0 N Z,7129728,1359821,252,1505,2008
locator,L OW1 K EY2 T ER0,150531,43285,211,1719,2008
locators,L OW1 K EY2 T ER0 Z,52937,18019,171,1731,2008
loch,L AA1 K,227417,51926,309,1638,2008
locher,L AA1 K ER0,503,404,113,1761,2008
lochhead,L AA1 K HH EH2 D,102,70,40,1853,2008
lochner,L AA1 K N ER0,216,134,50,1927,2008
loci,L OW1 K IY0,1165797,218060,331,1507,2008
lock,L AA1 K,5032800,1423454,369,1572,2008
locka,L AA1 K AH0,1893,805,116,1709,2008
lockard,L AA1 K ER0 D,72,58,29,1947,2008
lockdown,L AA1 K D AW2 N,20518,9559,48,1891,2008
locke,L AA1 K,9697,6347,246,1568,2008
locked,L AA1 K T,6211013,1820527,362,1515,2008
locken,L AA1 K AH0 N,1518,1248,145,1775,2008
locker,L AA1 K ER0,806228,266492,238,1588,2008
lockers,L AA1 K ER0 Z,241614,122255,237,1515,2008
lockert,L AA1 K ER0 T,297,277,76,1855,2008
locket,L AA1 K IH0 T,174408,65653,257,1575,2008
lockets,L AA1 K IH0 T S,20310,14918,234,1707,2008
lockett,L AA1 K IH0 T,139,112,52,1805,2008
lockey,L AA1 K IY0,430,276,59,1839,2008
lockhart,L AA1 K HH AA2 R T,1255,936,138,1711,2008
lockheed,L AA1 K HH IY2 D,284,208,51,1935,2008
lockie,L AA1 K IY0,77,52,30,1889,2008
locking,L AA1 K IH0 NG,1188466,494557,323,1600,2008
lockley,L AA1 K L IY0,92,74,37,1887,2007
lockman,L AA1 K M AH0 N,1064,596,153,1759,2008
lockney,L AA1 K N EY0,54,47,24,1970,2007
lockout,L AA1 K AW2 T,182756,48689,150,1761,2008
lockouts,L AA1 K AW2 T S,97253,41971,149,1766,2008
lockport,L AA1 K P AO2 R T,140,105,57,1852,2007
lockridge,L AA1 K R IH2 JH,79,53,32,1909,2008
locks,L AA1 K S,2250144,873225,360,1524,2008
locksmith,L AA1 K S M IH2 TH,96902,51473,240,1637,2008
lockstep,L AA1 K S T EH2 P,45685,34077,144,1804,2008
lockup,L AA1 K AH2 P,72992,33830,193,1660,2008
lockwood,L AA1 K W UH2 D,1955,824,121,1754,2008
lockyer,L AA1 K Y ER0,416,193,80,1790,2008
loco,L OW1 K OW0,428253,163124,355,1505,2008
locomotion,L OW2 K AH0 M OW1 SH AH0 N,823786,246264,237,1524,2008
locomotive,L OW2 K AH0 M OW1 T IH0 V,1508020,369888,263,1644,2008
locomotives,L OW2 K AH0 M OW1 T IH0 V Z,914333,217082,200,1515,2008
locomotor,L OW2 K AH0 M OW1 T ER0,282022,55850,153,1785,2008
loctite,L AA1 K T AY2 T,132,57,26,1957,2008
locus,L OW1 K AH0 S,2798430,588936,337,1507,2008
locust,L OW1 K AH0 S T,418975,148164,276,1515,2008
locusts,L OW1 K AH0 S T S,477058,216367,294,1590,2008
locy,L OW1 S IY0,254,190,89,1792,2008
lodato,L OW0 D AA1 T OW0,2069,1458,185,1564,2008
lode,L OW1 D,321898,77433,274,1564,2008
loden,L OW1 D AH0 N,8386,5684,212,1595,2008
loder,L OW1 D ER0,407,343,106,1765,2008
lodes,L OW1 D Z,149933,28455,256,1590,2008
lodestar,L OW1 D S T AA2 R,38904,22408,177,1777,2008
lodestone,L OW1 D S T OW2 N,59487,29776,178,1568,2008
lodge,L AA1 JH,2681452,722084,371,1524,2008
lodged,L AA1 JH D,2239260,944950,389,1515,2008
lodgepole,L AA1 JH P OW2 L,92055,17885,117,1849,2008
lodges,L AA1 JH AH0 Z,896941,278643,329,1575,2008
lodging,L AA1 JH IH0 NG,2069990,758566,384,1524,2008
lodgings,L AA1 JH IH0 NG Z,1218837,447858,345,1563,2008
lodi,L OW1 D AY0,4880,2987,223,1718,2008
lodwick,L AA1 D W IH0 K,52,42,29,1853,2008
loe,L OW1,44956,25403,294,1524,2008
loeb,L OW1 B,900,667,95,1823,2008
loeber,L OW1 B ER0,108,80,41,1875,2008
loeffler,L OW1 F L ER0,241,162,66,1888,2008
loehr,L AO1 R,63,55,28,1925,2008
loera,L AO1 R AH0,45,43,33,1825,2007
loeser,L OW1 Z ER0,141,90,46,1807,2007
loess,L OW1 AH0 S,354232,40368,189,1631,2008
loesser,L EH1 S ER0,72,41,24,1910,2008
loew,L AA1 UW0,313,193,72,1861,2008
loewe,L AA1 UW0,297,234,67,1890,2008
loewen,L AA1 UW0 AH0 N,246,47,26,1911,2008
loewenstein,L OW1 AH0 N S T AY0 N,215,149,39,1918,2008
loewi,L OW1 W IY0,345,171,59,1881,2008
loewy,L OW1 IY0,147,108,45,1907,2008
lofgren,L AA1 F G R EH0 N,122,67,31,1948,2007
lofland,L AA1 F L AH0 N D,66,53,27,1965,2008
loft,L AO1 F T,853471,321058,373,1563,2008
loftier,L AO1 F T IY0 ER0,299726,200347,311,1590,2008
loftis,L AA1 F T IH0 S,174,143,75,1815,2008
lofts,L AO1 F T S,100880,63555,280,1646,2008
loftus,L AO1 F T AH0 S,302,204,76,1753,2008
