word,pronunication,tf,df,years,year_first,year_recent
l,EH1 L,33395567,2479007,406,1505,2008
"l's",EH1 L Z,56,47,32,1832,2008
l.,EH1 L,2259307,482020,360,1515,2008
l.s,EH1 L Z,3214,2293,192,1684,2008
la,L AA1,62014112,2219046,399,1505,2008
laabs,L AA1 B Z,148,48,38,1910,2006
laack,L AA1 K,137,91,56,1763,2008
laake,L AA1 K,217,192,92,1720,2008
laakso,L AA1 K S OW0,64,51,28,1921,2008
laas,L AA1 Z,2113,1719,201,1711,2008
lab,L AE1 B,2182857,466515,305,1642,2008
laba,L AA1 B AH0,4672,2349,173,1716,2008
labadie,L AE1 B AH0 D IY0,44,40,33,1863,2008
laban,L EY1 B AH0 N,6056,2625,170,1767,2008
laband,L AA0 B AE1 N D,63,58,32,1893,2008
labant,L AH0 B AE1 N T,390,335,124,1729,2008
labar,L AH0 B AA1 R,859,722,180,1696,2008
labarre,L AA0 B AA1 R EY0,58,57,29,1777,2007
labat,L AA1 B AA0 T,807,574,147,1711,2008
labate,L AA1 B EY0 T,60,47,33,1847,2006
labay,L AE1 B EY0,410,82,39,1932,2008
labbe,L AE1 B,418,312,101,1756,2008
labe,L EY1 B,8178,6398,275,1574,2008
label,L EY1 B AH0 L,6388356,1388139,290,1515,2008
labeled,L EY1 B AH0 L D,4854308,1058430,225,1582,2008
labeling,L EY1 B AH0 L IH0 NG,1599666,396186,176,1680,2008
labell,L AH0 B EH1 L,3667,1277,152,1588,2008
labella,L AH0 B EH1 L AH0,9547,2051,206,1711,2008
labelle,L AH0 B EH1 L,309,238,81,1831,2008
labelled,L EY1 B AH0 L D,1998647,630158,251,1574,2008
labels,L EY1 B AH0 L Z,3522174,944243,284,1524,2008
laber,L EY1 B ER0,2042,1268,188,1736,2008
laberge,L AA1 B ER0 G,73,49,28,1911,2008
labine,L AA0 B IY1 N IY0,54,45,33,1791,2008
labo,L AA1 B OW0,12415,9146,277,1507,2008
labor,L EY1 B ER0,41755234,1934705,378,1507,2008
laboratoires,L AH0 B AO1 R AH0 T W AA2 Z,9112,3747,124,1785,2008
laboratories,L AE1 B R AH0 T AO2 R IY0 Z,2614778,667295,252,1688,2008
laboratory,L AE1 B R AH0 T AO2 R IY0,11971002,1368133,276,1600,2008
laborde,L AH0 B AO1 R D,233,185,69,1827,2008
labore,L AH0 B AO1 R,31164,18862,308,1507,2008
labored,L EY1 B ER0 D,1378942,608648,298,1563,2008
laborer,L EY1 B ER0 ER0,1268213,423260,275,1520,2008
laborers,L EY1 B ER0 ER0 Z,3138422,653473,277,1563,2008
laboring,L EY1 B ER0 IH0 NG,1063063,448897,306,1563,2008
laborious,L AH0 B AO1 R IY0 AH0 S,1562757,809749,378,1507,2008
laboriously,L AH0 B AO1 R IY0 AH0 S L IY0,514745,384960,314,1524,2008
labors,L EY1 B ER0 Z,2257908,616420,340,1507,2008
labour,L EY1 B AW2 R,25864903,1383889,405,1515,2008
labov,L AH0 B AH1 V,618,340,87,1761,2008
labove,L AH0 B AH1 V,655,474,109,1717,2008
labow,L AE1 B OW0,129,118,82,1727,2008
laboy,L AH0 B OY1,61,55,39,1918,2007
labrador,L AE1 B R AH0 D AO2 R,16421,9334,195,1764,2008
labrie,L AE1 B ER0 IY0,66,47,33,1855,2007
labs,L AE1 B Z,443250,157799,181,1686,2008
labus,L AE1 B IH0 S,567,484,112,1775,2008
labyrinth,L AE1 B ER0 IH2 N TH,1019360,423901,317,1579,2008
labyrinthine,L AE2 B ER0 IH1 N TH IY2 N,240221,129381,204,1706,2008
lac,L AE1 K,392940,109717,331,1505,2008
lacana,L AA0 K AE1 N AH0,131,107,42,1765,2008
lacasse,L AA0 K AA1 S IY0,69,45,30,1857,2008
lacayo,L AA0 K EY1 OW0,790,527,104,1826,2008
laccoliths,L AE1 K AH0 L IH0 TH S,13102,3499,122,1864,2008
lace,L EY1 S,2358125,750944,371,1524,2008
laced,L EY1 S T,779601,468343,338,1515,2008
lacer,L EY1 S ER0,3334,2187,198,1707,2008
lacerate,L AE1 S ER0 EY2 T,43917,34337,269,1682,2008
laceration,L AE2 S ER0 EY1 SH AH0 N,338803,79841,266,1658,2008
lacerations,L AE2 S ER0 EY1 SH AH0 N Z,247385,76914,249,1709,2008
lacerte,L AA0 CH EH1 R T IY0,135,119,55,1794,2008
laces,L EY1 S AH0 Z,356145,212035,335,1563,2008
lacey,L EY1 S IY0,7316,5832,146,1727,2008
lach,L AE1 CH,10422,5281,245,1672,2008
lachapelle,L AE1 SH AH0 P AH0 L,136,97,52,1705,2008
lache,L AE1 CH,9603,7125,227,1752,2008
lachenbruch,L AE1 K AH0 N B R UW2 K,52,42,20,1967,2007
lacher,L AE1 K ER0,1571,1386,173,1699,2008
lachlan,L AE1 K L AH0 N,350,170,87,1792,2008
lachman,L AE1 K M AH0 N,285,139,47,1892,2008
lacina,L AA0 CH IY1 N AH0,272,160,77,1766,2008
lack,L AE1 K,35642958,3520760,378,1505,2008
lackadaisical,L AE2 K AH0 D EY1 Z IH0 K AH0 L,65157,57525,193,1743,2008
lackawanna,L AE2 K AH0 W AA1 N AH0,138,103,54,1877,2007
lacked,L AE1 K T,4401146,1556427,328,1507,2008
lackey,L AE1 K IY0,132662,79733,253,1588,2008
lackeys,L AE1 K IY0 Z,146955,86963,253,1579,2008
lackie,L AE1 K IY0,1446,912,87,1699,2008
lacking,L AE1 K IH0 NG,6881072,2146132,345,1505,2008
lackluster,L AE1 K L AH2 S T ER0,91323,70236,128,1815,2008
lackman,L AE1 K M AH0 N,439,337,70,1800,2008
lacko,L AE1 K OW0,141,98,55,1800,2008
lacks,L AE1 K S,3449180,1390264,327,1515,2008
lacock,L AE1 K AH0 K,66,51,37,1819,2007
lacombe,L AA0 K OW1 M B IY0,174,134,52,1886,2008
laconic,L AA0 K AA1 N IH0 K,269173,198153,271,1524,2008
lacoste,L AA0 K AO1 S T,217,137,57,1864,2008
lacour,L AH0 K UH1 R,210,175,75,1782,2008
lacouture,L AE1 K UW0 CH ER0,77,56,21,1961,2007
lacquer,L AE1 K ER0,514147,135480,233,1607,2008
lacquered,L AE1 K ER0 D,209896,109494,247,1720,2008
lacroix,L AH0 K R OY1,398,226,80,1819,2008
lacross,L AH0 K R AO1 S,172,155,73,1809,2008
lacrosse,L AH0 K R AO1 S,107448,33270,142,1843,2008
lactase,L AE1 K T EY2 S,88103,18933,121,1819,2008
lactate,L AE1 K T EY0 T,655757,83102,204,1785,2008
lactating,L AE1 K T EY0 T IH0 NG,211306,52095,146,1817,2008
lactation,L AE0 K T EY1 SH AH0 N,666970,94593,216,1676,2008
lacteals,L AE1 K T IY2 L Z,54081,15002,267,1682,2008
lacter,L AE1 K T ER0,236,232,121,1670,2008
lactic,L AE1 K T IH0 K,902594,116941,225,1723,2008
lactobacillus,L AE2 K T OW0 B AH0 S IH1 L AH0 S,15520,6389,89,1901,2008
lactone,L AE1 K T OW0 N,91136,19068,145,1812,2008
lactose,L AE1 K T OW0 S,633995,75946,156,1785,2008
lacy,L EY1 S IY0,179346,116368,258,1660,2008
lad,L AE1 D,3047907,753617,367,1563,2008
lada,L AA1 D AH0,4978,3000,198,1737,2008
ladakh,L AA1 D AH0 K,372,249,54,1869,2008
ladas,L AA1 D AH0 Z,730,585,151,1791,2008
ladbroke,L AE1 D B R OW2 K,82,57,29,1908,2008
ladd,L AE1 D,2242,1515,185,1717,2008
ladder,L AE1 D ER0,3465531,1188046,323,1563,2008
ladders,L AE1 D ER0 Z,669565,329810,308,1563,2008
lade,L EY1 D,49870,30897,335,1563,2008
laden,L EY1 D AH0 N,2562735,1149608,384,1507,2008
ladenburg,L EY1 D AH0 N B ER0 G,50,41,22,1894,2008
lader,L EY1 D ER0,3435,1978,206,1745,2008
ladies,L EY1 D IY0 Z,9552068,1509987,342,1524,2008
"ladies'",L EY1 D IY2 Z,4532,3708,190,1807,2008
lading,L EY1 D IH0 NG,790967,113849,350,1563,2008
ladino,L AH0 D IY1 N OW0,51284,8633,153,1792,2008
ladish,L AA0 D IH1 SH,72,53,33,1836,2008
ladle,L EY1 D AH0 L,301337,124019,277,1588,2008
ladled,L EY1 D AH0 L D,60628,48996,221,1713,2008
ladles,L EY1 D AH0 L Z,99158,57273,266,1684,2008
ladley,L AE1 D L IY0,168,145,55,1840,2008
ladling,L EY1 D L IH0 NG,27408,23903,202,1710,2008
ladner,L AE1 D N ER0,192,154,52,1791,2008
ladow,L AE1 D OW0,147,138,78,1826,2008
lads,L AE1 D Z,1125632,390806,302,1575,2008
lady,L EY1 D IY0,18681426,1873234,348,1524,2008
"lady's",L EY1 D IY0 Z,26527,15914,217,1755,2008
ladybird,L EY1 D IY0 B ER2 D,38509,14740,195,1795,2008
ladybug,L EY1 D IY0 B AH2 G,27227,13060,123,1806,2008
ladybugs,L EY1 D IY0 B AH2 G Z,22454,10952,130,1844,2008
ladylike,L EY1 D IY0 L AY2 K,130581,94097,215,1579,2008
laevo,L EY1 V OW0,15178,5192,200,1765,2008
lafarge,L AA0 F AA1 R JH,73,61,33,1901,2008
lafayette,L AA2 F IY0 EH1 T,1636,1043,157,1829,2008
lafer,L EY1 F ER0,657,628,163,1718,2008
laff,L AE1 F,7642,4393,240,1673,2008
laffer,L AE1 F ER0,295,219,61,1740,2008
lafferty,L AE1 F ER0 T IY0,183,110,47,1884,2008
laffey,L AE1 F IY0,66,50,34,1825,2008
laffin,L AE1 F IH0 N,3241,1913,161,1832,2008
laffitte,L AH0 F IH1 T,55,42,25,1844,2008
lafite,L AA0 F AY1 T,91,75,41,1829,2008
lafitte,L AH0 F IH1 T,132,104,63,1826,2008
laflamme,L AE1 F L IH0 M,199,153,52,1796,2008
lafleur,L AH0 F L ER1,390,296,92,1810,2008
laflin,L AE1 F L IH0 N,64,59,46,1843,2008
lafollette,L AE1 F AH0 L EH0 T,144,49,29,1841,2008
lafon,L AE1 F AH0 N,134,100,51,1638,2008
lafond,L AH0 F AA1 N D,60,46,29,1804,2008
lafontaine,L AE1 F AH0 N T EY2 N,343,231,79,1821,2008
laforce,L AH0 F AO1 R S,56,52,38,1655,2007
lafoy,L AH0 F OY1,344,249,86,1658,2008
lafrance,L AH0 F R AE1 N S,53,45,24,1909,2008
lafuente,L AA0 F W EH1 N T EY0,148,123,49,1829,2008
lag,L AE1 G,2423047,752537,318,1507,2008
lagan,L AE1 G AH0 N,7913,4718,207,1767,2008
lagana,L AA0 G AE1 N AH0,840,561,94,1823,2008
lagarde,L AA0 G AA1 R D IY0,159,121,56,1825,2008
lagasse,L AA0 G AA1 S IY0,57,42,24,1884,2008
lage,L EY1 JH,47136,36353,312,1632,2008
lager,L AA1 G ER0,136274,60463,215,1680,2008
laggard,L AE1 G ER0 D,92181,72752,216,1612,2008
laggards,L AE1 G ER0 D Z,68348,48529,188,1757,2008
lagged,L AE1 G D,815326,395259,248,1575,2008
lagging,L AE1 G IH0 NG,589536,309305,283,1515,2008
lagle,L EY1 G AH0 L,165,133,61,1744,2008
lago,L AA1 G OW0,124468,28858,269,1620,2008
lagoon,L AH0 G UW1 N,896608,179421,235,1524,2008
lagoons,L AH0 G UW1 N Z,420690,136188,229,1515,2008
lagos,L EY1 G AO0 S,6197,3606,158,1783,2008
lagow,L AE1 G OW0,118,73,44,1836,2008
lagrange,L AE1 G R EY2 N JH,1532,1008,114,1818,2008
lags,L AE1 G Z,673124,284168,263,1645,2008
laguardia,L AH0 G W AA1 R D IY0 AH0,146,105,45,1737,2008
lague,L AA1 G,1128,892,176,1683,2008
laguna,L AH0 G UW1 N AH0,19499,7855,206,1757,2008
lagunas,L AH0 G UW1 N AH0 Z,7769,3606,207,1777,2008
laham,L AE1 HH AH0 M,362,251,82,1743,2008
lahaye,L AE1 HH EY0,49,46,24,1859,2007
lahey,L EY1 HH IY0,179,134,46,1807,2008
lahm,L AE1 M,2211,1644,162,1787,2008
lahman,L AA1 M AH0 N,59,53,38,1790,2008
lahn,L AE1 N,3877,2353,145,1631,2008
lahore,L AA0 HH AO1 R,1019,683,119,1668,2008
lahr,L AA1 R,1383,924,124,1802,2008
lahti,L AA1 T IY0,615,368,73,1877,2008
lahue,L AE1 HH Y UW0,124,64,36,1878,2008
lai,L AY1,318461,72248,305,1579,2008
laib,L EY1 B,333,289,109,1683,2008
laible,L EY1 B AH0 L,269,236,70,1810,2008
laiche,L EY1 CH,577,370,107,1804,2008
laid,L EY1 D,28364363,3278120,415,1505,2008
laidlaw,L EY1 D L AO2,244,181,69,1837,2008
laidler,L EY1 D L ER0,214,133,48,1917,2008
laidley,L EY1 D L IY0,132,73,44,1825,2008
lail,L EY1 L,4737,3934,294,1685,2008
lain,L EY1 N,1145378,666148,365,1563,2008
laine,L EY1 N,23458,13422,253,1581,2008
laing,L AA1 IH0 NG,2454,1495,174,1749,2008
laino,L EY1 N OW0,222,190,98,1803,2008
lair,L EH1 R,342819,220283,316,1505,2008
laird,L EH1 R D,228394,44232,274,1563,2008
lais,L EY1 Z,22738,9030,274,1592,2008
laissez,L EY1 Z EY2,825680,291672,223,1723,2008
lait,L EY1,115062,57870,318,1642,2008
laitinen,L AY1 T IH0 N AH0 N,80,54,31,1914,2008
laity,L EY1 AH0 T IY0,1148084,268649,313,1520,2008
lajeune,L AH0 JH AH1 N,502,420,108,1769,2008
lajeunesse,L AH0 JH AH1 N EH0 S,1619,1167,138,1801,2008
lajoie,L AE1 JH W AA0,626,505,108,1821,2008
lak,L AE1 K,67542,22651,255,1700,2008
lakatos,L AE1 K AH0 T OW0 Z,217,143,40,1944,2008
lake,L EY1 K,11369909,1445668,374,1515,2008
lakefront,L EY1 K F R AH2 N T,52119,23404,112,1845,2008
lakeland,L EY1 K L AH0 N D,7045,4307,148,1783,2008
lakeman,L EY1 K M AH0 N,229,153,58,1855,2008
laker,L EY1 K ER0,5189,2932,221,1729,2008
lakers,L EY1 K ER0 Z,6664,2774,187,1715,2008
lakes,L EY1 K S,4980379,901291,344,1507,2008
lakeshore,L EY1 K SH AO2 R,81618,35375,155,1823,2008
lakeside,L EY1 K S AY2 D,119400,67037,170,1783,2008
lakeview,L EY1 K V Y UW2,907,670,60,1921,2008
lakewood,L EY1 K W UH2 D,191,160,63,1894,2008
lakey,L EY1 K IY0,521,392,133,1750,2008
lakin,L AE1 K IH0 N,2423,1342,163,1744,2008
lakins,L AE1 K IH0 N Z,50,42,26,1828,2008
lakota,L AH0 K OW1 T AH0,380,268,59,1892,2008
lal,L AE1 L,63149,37284,286,1664,2008
lala,L AA1 L AH0,13561,7014,211,1729,2008
lalande,L AA0 L AA1 N D IY0,211,146,66,1821,2008
lalas,L AA1 L AH0 S,527,400,96,1806,2008
laliberte,L AA0 L IY0 B EH1 R T IY0,81,72,46,1810,2008
lalit,L AH0 L IY1 T,618,425,76,1790,2008
lalita,L AH0 L IY1 T AH0,2772,1192,104,1799,2008
lall,L AO1 L,12868,9421,302,1619,2008
lalla,L AE1 L AH0,2094,924,155,1743,2008
lalley,L AE1 L IY0,343,212,68,1802,2008
lalli,L AE1 L IY0,305,214,90,1714,2008
lallie,L AO1 L IY0,111,85,39,1770,2008
lallo,L AE1 L OW0,141,118,64,1759,2008
lally,L AE1 L IY0,3808,2797,202,1673,2008
lalonde,L AA0 L OW1 N D IY0,75,56,29,1867,2008
lalone,L AA0 L OW1 N IY0,130,124,78,1735,2008
lalor,L AE0 L AO1 R,321,297,134,1702,2008
lam,L AE1 M,375428,211836,378,1507,2008
lama,L AA1 M AH0,243951,62837,300,1611,2008
lamaist,L AA1 M AY0 IH0 S T,4619,1577,106,1871,2008
laman,L EY1 M AH0 N,3379,1517,138,1740,2008
lamar,L AH0 M AA1 R,1201,785,133,1743,2008
lamarche,L AA0 M AA1 R K IY0,100,55,35,1814,2008
lamarr,L AH0 M AA1 R,55,49,29,1918,2008
lamas,L AA1 M AH0 Z,152960,25723,262,1644,2008
lamay,L AE1 M EY0,292,185,67,1793,2008
lamb,L AE1 M,2185863,709528,340,1563,2008
"lamb's",L AE1 M Z,9062,6343,205,1725,2008
lambaste,L AE2 M B AE1 S T,9507,8825,122,1620,2008
lambasted,L AE2 M B AE1 S T IH0 D,54375,43714,128,1678,2008
lambastes,L AE2 M B AE1 S T S,3807,3499,84,1901,2008
lambasting,L AE0 M B EY1 S T IH0 NG,20987,19138,132,1743,2008
lambda,L AE1 M D AH0,265310,49966,200,1525,2008
lambe,L AE1 M,6871,4070,221,1568,2008
lambeau,L AE0 M B OW1,2636,1371,158,1773,2008
lamberg,L AE1 M B ER0 G,65,55,37,1818,2008
lambert,L AE1 M B ER0 T,9964,4592,150,1789,2008
lamberti,L AA0 M B EH1 R T IY0,2436,679,121,1843,2008
lamberto,L AA0 M B EH1 R T OW2,120,42,28,1818,2008
lamberton,L AE1 M B ER0 T AH0 N,78,59,41,1802,2008
lambeth,L AE1 M B IH0 TH,542,384,121,1563,2008
lambie,L AE1 M B IY0,1948,1199,149,1796,2008
lambing,L AE1 M IH0 NG,85178,25106,234,1744,2008
lamborn,L AH0 M B AO1 R N,82,52,29,1803,2008
lambrecht,L AE1 M B R IH0 K T,82,72,34,1910,2008
lambro,L AE1 M B R OW0,73,51,36,1820,2008
lambros,L AE1 M B R OW0 Z,86,54,25,1795,2008
lambs,L AE1 M Z,1063914,363002,328,1563,2008
"lambs'",L AE1 M Z,523,481,146,1813,2008
lamby,L AE1 M B IY0,731,556,97,1683,2008
lame,L EY1 M,1286094,675466,398,1524,2008
lamellar,L AH0 M EH1 L ER0,322467,50790,226,1750,2008
lamely,L EY1 M L IY0,138991,109571,310,1564,2008
lament,L AH0 M EH1 N T,1393338,661498,385,1563,2008
lamentable,L AH0 M EH1 N T AH0 B AH0 L,656182,406968,378,1563,2008
lamented,L AH0 M EH1 N T IH0 D,1360211,683406,374,1524,2008
lamenting,L AH0 M EH1 N T IH0 NG,475154,335594,355,1564,2008
laments,L AH0 M EH1 N T S,553937,317365,341,1572,2008
lamer,L EY1 M ER0,8008,7047,250,1637,2008
lamere,L AA0 M EH1 R EY0,106,86,55,1723,2008
lamers,L EY1 M ER0 Z,294,201,36,1883,2008
lameta,L AH0 M EH1 T AH0,85,63,31,1830,2008
lamey,L EY1 M IY0,109,90,44,1698,2007
lamia,L EY1 M IY0 AH0,9874,5332,214,1747,2008
lamie,L EY1 M IY0,1507,609,88,1780,2008
lamina,L AE1 M AH0 N AH0,922877,97170,284,1630,2008
laminar,L AE1 M IH0 N ER0,605712,84441,216,1747,2008
laminate,L AE1 M AH0 N AH0 T,290297,42459,189,1745,2008
laminated,L AE1 M AH0 N EY2 T AH0 D,631672,171472,256,1667,2008
laminates,L AE1 M AH0 N AH0 T S,181155,23283,120,1722,2008
laminating,L AE1 M AH0 N EY2 T IH0 NG,60811,20112,211,1667,2008
lamine,L AH0 M IY1 N,10820,6041,215,1678,2008
laminer,L AE1 M AH0 N ER0,334,250,75,1819,2008
lamison,L AE1 M IH0 S AH0 N,301,171,47,1892,2008
lamkin,L AE1 M K IH0 N,62,51,32,1764,2008
lamm,L AE1 M,1738,1122,158,1762,2008
lamme,L AE1 M,511,382,106,1722,2008
lammers,L AE1 M ER0 Z,249,177,56,1858,2008
lammi,L AE1 M IY0,134,110,51,1799,2008
lammon,L AE1 M AH0 N,123,96,59,1668,2008
lammond,L AE1 M AH0 N D,491,335,69,1797,2008
lamon,L AA0 M AO1 N,417,328,106,1717,2008
lamond,L AH0 M AA1 N D,348,111,62,1797,2008
lamont,L AH0 M AA1 N T,855,494,114,1740,2008
lamontagne,L AA2 M AA0 N T EY1 N,48,43,29,1864,2008
lamore,L AA1 M AO0 R,219,183,85,1772,2008
lamorte,L AA0 M AO1 R T IY0,60,48,34,1797,2008
lamos,L AA1 M OW0 S,617,399,113,1736,2008
lamothe,L AE1 M AH0 DH,50,42,24,1863,2008
lamotte,L AH0 M AO1 T,176,120,59,1821,2008
lamoureux,L AE1 M UH0 R OW0,41,40,24,1848,2008
lamp,L AE1 M P,6193564,1319013,333,1568,2008
lampe,L AE1 M P,18167,10115,232,1568,2008
lampert,L AE1 M P ER2 T,211,125,46,1853,2008
lampf,L AE1 M P F,82,75,51,1804,2008
lampi,L AE1 M P IY0,1525,1070,161,1755,2008
lamping,L AE1 M P IH0 NG,3821,2643,202,1713,2008
lampl,L AE1 M P AH0 L,289,232,90,1792,2008
lamplighter,L AE1 M P L AY2 T ER0,20483,13784,215,1768,2008
lamplighters,L AE1 M P L AY2 T ER0 Z,7106,5371,204,1763,2008
lampman,L AE1 M P M AH0 N,1003,539,124,1850,2008
lampo,L AE1 M P OW0,2527,1469,159,1755,2008
lampoon,L AE0 M P UW1 N,71571,49525,281,1680,2008
lampooned,L AE0 M P UW1 N D,60797,49691,262,1607,2008
lamport,L AE1 M P AO2 R T,73,54,21,1955,2008
lamppost,L AE1 M P P OW2 S T,58312,41373,191,1790,2008
lampposts,L AE1 M P P OW2 S T S,35677,29076,182,1790,2008
lamprey,L AE1 M P R IY0,111069,25537,244,1588,2008
lampreys,L AE1 M P R IY0 Z,75127,22899,257,1745,2008
lampron,L AE1 M P R AH0 N,130,98,36,1828,2008
lampros,L AE1 M P R OW0 Z,2213,568,77,1823,2008
lamps,L AE1 M P S,3408448,939166,330,1524,2008
lampson,L AE1 M P S AH0 N,181,143,61,1806,2008
lampton,L AE1 M P T AH0 N,749,476,100,1763,2008
lamson,L AE1 M S AH0 N,288,191,80,1864,2008
lamy,L EY1 M IY0,972,879,183,1631,2008
lan,L AE1 N,318977,163967,348,1507,2008
lana,L AE1 N AH0,33896,17316,285,1524,2008
lanagan,L AE1 N AH0 G AE0 N,167,115,54,1824,2008
lanai,L AH0 N AY1,26456,6502,142,1784,2008
lancashire,L AE1 NG K AH0 SH AY2 R,436,285,108,1811,2008
lancaster,L AE1 N K AE2 S T ER0,2167,1103,166,1784,2008
lance,L AE1 N S,1180052,456075,352,1507,2008
lancelet,L AE1 N S L AH0 T,10198,3634,163,1799,2008
lancelot,L AE1 N S AH0 L AA2 T,1629,583,137,1810,2008
lanceolate,L AE1 N S IY0 AH0 L EY2 T,251338,29228,233,1752,2008
lancer,L AE1 N S ER0,39131,22845,218,1721,2008
lancers,L AE1 N S ER0 Z,113224,46944,215,1524,2008
lancet,L AE1 N S AH0 T,197900,79077,273,1658,2008
lancets,L AE1 N S AH0 T S,62061,22422,260,1590,2008
lancia,L AA1 N CH AH0,3386,1815,191,1730,2008
lancing,L AE1 N S IH0 NG,50751,35528,284,1629,2008
lancon,L AE1 NG K AH0 N,84,72,38,1843,2008
lancz,L AE1 N CH,176,167,60,1848,2008
land,L AE1 N D,98979864,3446295,419,1507,2008
"land's",L AE1 N D Z,525,485,148,1750,2008
landa,L AE1 N D AH0,6871,4651,237,1653,2008
landau,L AE1 N D AW2,51607,26352,241,1563,2008
landauer,L AE1 N D AW2 ER0,226,156,56,1880,2008
landay,L AE1 N D EY2,140,79,30,1858,2008
landbank,L AE1 N D B AE2 NG K,598,433,116,1755,2008
lande,L AE1 N D,55676,22251,278,1524,2008
landed,L AE1 N D AH0 D,7418776,1622574,388,1507,2008
landen,L AE1 N D AH0 N,15979,6377,193,1711,2008
lander,L AE1 N D ER0,86627,26984,318,1629,2008
landers,L AE1 N D ER0 Z,42002,20405,337,1630,2008
landes,L AE1 N D Z,39346,14829,268,1524,2008
landesman,L AE1 N D IH0 S M AH0 N,75,65,33,1805,2007
landfall,L AE1 N D F AO2 L,133852,61002,194,1584,2008
landfill,L AE1 N D F IH2 L,440654,71960,88,1677,2008
landfilling,L AE1 N D F IH0 L IH0 NG,23105,6211,53,1950,2008
landfills,L AE1 N D F IH2 L Z,196049,41583,72,1819,2008
landform,L AE1 N D F AO2 R M,92134,19883,98,1882,2008
landforms,L AE1 N D F AO2 R M Z,208641,36623,104,1897,2008
landgraf,L AE1 N JH R AH0 F,449,236,98,1798,2008
landgrave,L AE1 N D G R EY2 V,54029,11775,276,1563,2008
landholder,L AE1 N D HH OW2 L D ER0,127077,65489,258,1637,2008
landholders,L AE1 N D HH OW2 L D ER0 Z,349731,138919,265,1635,2008
landholding,L AE1 N D HH OW2 L D IH0 NG,200133,75946,183,1607,2008
landholdings,L AE1 N D HH OW2 L D IH0 NG Z,178877,75393,140,1780,2008
landi,L AE1 N D IY0,4115,3290,262,1674,2008
landin,L AE1 N D IH0 N,5911,4751,200,1728,2008
landing,L AE1 N D IH0 NG,6583017,1332976,379,1507,2008
landings,L AE1 N D IH0 NG Z,769522,228393,299,1507,2008
landini,L AA0 N D IY1 N IY0,129,94,52,1795,2007
landino,L AA0 N D IY1 N OW0,82,75,48,1805,2008
landis,L AE1 N D IH0 S,15289,3280,238,1676,2008
landlady,L AE1 N D L EY2 D IY0,644973,231926,278,1563,2008
landler,L AE1 N D L ER0,2565,1009,99,1800,2008
landless,L AE1 N D L AH0 S,716057,197886,223,1572,2008
landlock,L AE1 N D L AA2 K,887,487,119,1638,2008
landlocked,L AE1 N D L AA2 K T,182224,97439,234,1515,2008
landlord,L AE1 N D L AO2 R D,3809114,678650,304,1564,2008
"landlord's",L AE1 N D L AO2 R D Z,66,66,40,1833,2008
landlords,L AE1 N D L AO2 R D Z,2145100,449931,292,1515,2008
landman,L AE1 N D M AH0 N,5534,3119,242,1752,2008
landmark,L AE1 N D M AA2 R K,1445402,688794,265,1581,2008
landmarks,L AE1 N D M AA2 R K S,1044464,516209,262,1637,2008
landmass,L AE1 N D M AE2 S,91261,44171,127,1778,2008
landmasses,L AE1 N D M AE2 S IH0 Z,36849,15589,139,1782,2008
landmine,L AE1 N D M AY2 N,29565,10548,82,1796,2008
landmines,L AE1 N D M AY2 N Z,54689,17472,75,1890,2008
lando,L AE1 N D OW0,3604,2373,217,1696,2008
landolt,L AE1 N D OW2 L T,143,100,50,1887,2008
landon,L AE1 N D AH0 N,1286,1027,165,1719,2008
landor,L AE1 N D ER0,836,650,139,1801,2008
landover,L AE1 N D OW2 V ER0,78,57,34,1731,2007
landow,L AE1 N D OW0,488,362,68,1823,2008
landowner,L AE1 N D OW2 N ER0,1024512,327856,237,1572,2008
landowners,L AE1 N D OW2 N ER0 Z,2030040,467606,245,1524,2008
landress,L AE1 N D R IH0 S,46,41,23,1724,2008
landreth,L AE1 N D R IH0 TH,65,44,27,1841,2008
landrover,L AE1 N D R OW1 V ER0,7296,2631,57,1854,2008
landrum,L AE1 N D R AH0 M,150,73,38,1895,2008
landry,L AE1 N D R IY0,473,346,116,1723,2008
lands,L AE1 N D Z,20289173,1993498,400,1507,2008
"lands'",L AE1 N D Z,46,46,34,1823,2008
landsat,L AE1 N D S AE1 T,3048,1580,69,1727,2008
landsberg,L AE1 N D Z B ER0 G,348,220,58,1870,2008
landsberger,L AE1 N D Z B ER0 G ER0,160,118,32,1957,2008
landscape,L AE1 N D S K EY2 P,9756894,1558860,290,1515,2008
landscaped,L AE1 N D S K EY2 P T,217679,103212,144,1759,2008
landscaper,L AE1 N D S K EY2 P ER0,15519,10203,111,1813,2008
landscapers,L AE1 N D S K EY2 P ER0 Z,11669,8269,97,1850,2008
landscapes,L AE1 N D S K EY2 P S,2029350,526434,275,1590,2008
landscaping,L AE1 N D S K EY2 P IH0 NG,338145,139949,138,1759,2008
landsend,L AE1 N D Z EH1 N D,161,150,48,1796,2008
landslide,L AE1 N D S L AY2 D,432086,168185,172,1684,2008
landslides,L AE1 N D S L AY2 D Z,221500,68759,156,1847,2008
landsman,L AE1 N D Z M AH0 N,52453,34744,224,1712,2008
landstrom,L AE1 N D S T R AH0 M,49,40,23,1951,2008
landt,L AE1 N T,4014,2595,263,1698,2008
landward,L AE1 N D W ER0 D,215686,87376,243,1575,2008
landwehr,L AE1 N D W IH0 R,9260,2703,193,1801,2008
landy,L AE1 N D IY0,1396,1145,243,1656,2008
lane,L EY1 N,2610679,735415,355,1563,2008
lanes,L EY1 N Z,1404925,552881,308,1581,2008
lanese,L AA0 N EY1 Z IY0,300,255,127,1729,2008
lanete,L AH0 N IY1 T,117,70,44,1833,2008
laney,L EY1 N IY0,691,588,134,1708,2008
lanford,L AE1 N F ER0 D,132,100,54,1839,2008
lang,L AE1 NG,373094,98620,277,1524,2008
langan,L AE1 NG G AH0 N,1527,611,105,1788,2008
langbein,L AE1 NG B AY0 N,110,46,23,1953,2008
langdale,L AE1 NG D EY2 L,182,94,56,1813,2008
langdon,L AE1 NG D AH0 N,865,572,98,1807,2008
lange,L AE1 NG,119305,42632,249,1689,2008
langel,L EY1 NG G AH0 L,109,76,42,1869,2008
langen,L AE1 NG AH0 N,37660,16216,191,1658,2008
langer,L AE1 NG ER0,33336,19603,240,1703,2008
langers,L AE1 NG ER0 Z,367,319,114,1810,2008
langevin,L EY1 NG G IH0 V IH0 N,283,219,54,1877,2008
langford,L AE1 NG F ER0 D,481,354,93,1740,2008
langham,L AE1 NG HH AE0 M,215,146,65,1779,2008
langhans,L AE1 NG HH AH0 N Z,62,45,33,1933,2008
langhorne,L AE1 NG HH AO0 R N,133,112,61,1800,2008
langlais,L AH0 NG G L EY1,54,46,28,1896,2008
langland,L AE1 NG L AH0 N D,311,295,76,1811,2008
langley,L AE1 NG L IY0,3026,1874,123,1818,2008
langlois,L AH0 NG L W AA1,282,199,67,1870,2008
langman,L AE1 NG M AH0 N,369,189,48,1828,2008
langner,L AE1 NG N ER0,136,91,34,1930,2008
lango,L AA1 NG G OW0,2070,956,155,1776,2008
langridge,L AE1 NG G R IH0 JH,1645,1161,195,1788,2008
langsam,L AE1 NG S AH0 M,28486,12723,174,1750,2008
langsdorf,L AE1 NG Z D AO0 R F,138,73,38,1833,2003
langstaff,L AE1 NG S T AE0 F,196,42,23,1814,2008
langston,L AE1 NG S T AH0 N,1010,617,76,1797,2008
langton,L AE1 NG T AH0 N,596,362,123,1563,2008
language,L AE1 NG G W AH0 JH,79317416,3353197,411,1507,2008
languages,L AE1 NG G W AH0 JH AH0 Z,14615522,1793855,373,1515,2008
languid,L AE1 NG G W AH0 D,600779,350837,340,1575,2008
languish,L AE1 NG G W IH0 SH,256620,202003,364,1520,2008
languished,L AE1 NG G W IH0 SH T,326455,249886,334,1563,2008
languishes,L AE1 NG G W IH0 SH IH0 Z,69325,60427,318,1620,2008
languishing,L AE1 NG G W IH0 SH IH0 NG,321245,238570,366,1505,2008
langworthy,L AE1 NG W ER0 DH IY0,96,71,36,1900,2008
lanham,L AE1 N AH0 M,680,343,52,1855,2008
lani,L AA1 N IY0,9682,4880,256,1683,2008
lanier,L AH0 N IH1 R,859,408,118,1815,2008
lanigan,L AE1 N IH0 G AH0 N,201,84,48,1833,2008
laning,L EY1 N IH0 NG,2769,1002,130,1780,2008
lanius,L EY1 N IY0 IH0 S,967,655,171,1752,2008
lank,L AE1 NG K,176766,128243,318,1645,2008
lanka,L AE1 NG K AH0,4552,2527,129,1809,2008
lankan,L AE1 NG K AH0 N,243,166,34,1908,2008
lankford,L AE1 NG K F ER0 D,236,200,44,1939,2008
lanky,L AE1 NG K IY0,217435,153111,209,1682,2008
lanman,L AE1 N M AH0 N,553,142,54,1787,2008
lann,L AE1 N,3345,2040,205,1752,2008
lanna,L AE1 N AH0,1843,1026,139,1717,2008
lannan,L AE1 N AH0 N,465,142,56,1835,2008
lannen,L AE1 N AH0 N,296,121,48,1835,2008
lanners,L AE1 N ER0 Z,850,561,119,1778,2008
lanni,L AE1 N IY0,4896,2178,90,1804,2008
lanning,L AE1 N IH0 NG,3373,2784,115,1810,2008
lanno,L AE1 N OW0,945,472,124,1754,2008
lannon,L AE1 N AH0 N,249,210,69,1823,2008
lanny,L AE1 N IY0,311,201,71,1757,2008
lano,L AA1 N OW0,4853,3722,236,1515,2008
lanolin,L AE1 N AH0 L AH0 N,70031,24789,126,1869,2008
lansbury,L AE1 N Z B ER2 IY0,121,84,39,1933,2008
lansdale,L AE1 N Z D EY2 L,200,79,40,1899,2008
lansdown,L AE1 N Z D AW0 N,85,71,47,1789,2008
lansdowne,L AE1 N S D AW2 N,424,318,112,1796,2008
lanser,L AE1 N S ER0,89,66,33,1797,2008
lansing,L AE1 N S IH0 NG,918,537,101,1828,2008
lansky,L AE1 N S K IY0,379,213,59,1867,2008
lant,L AE1 N T,33748,23466,305,1619,2008
lantana,L AE0 N T AE1 N AH0,21617,9972,195,1760,2008
lanter,L AE1 N T ER0,1306,943,162,1728,2008
lantern,L AE1 N T ER0 N,1605507,533388,290,1581,2008
lanterns,L AE1 N T ER0 N Z,632592,313260,262,1581,2008
lanthanum,L AE1 N TH AH0 N AH0 M,95029,23543,165,1817,2008
lanting,L AE1 N T IH0 NG,678,568,139,1721,2008
lantis,L AA1 N T IH0 S,408,330,125,1721,2008
lantos,L AE1 N T OW0 S,173,115,59,1781,2008
lantry,L AE1 N T R IY0,1842,1756,258,1696,2008
lantz,L AE1 N T S,234,205,71,1771,2008
lanum,L AE1 N AH0 M,728,603,161,1750,2008
lanyard,L AE1 N Y ER0 D,49473,23794,202,1637,2008
lanyi,L AA1 N Y IY0,138,109,44,1896,2008
lanyon,L AE1 N Y AH0 N,158,126,57,1881,2008
lanz,L AE1 N Z,1173,695,150,1700,2008
