word,pronunication,tf,df,years,year_first,year_recent
stayner,S T EY1 N ER0,72,58,35,1823,2008
stayover,S T EY1 OW2 V ER0,1724,942,56,1898,2008
stayovers,S T EY1 OW2 V ER0 Z,714,436,46,1916,2008
stays,S T EY1 Z,2347776,1175488,348,1524,2008
stds,EH1 S T IY1 D IY1 Z,3472,1167,97,1722,2008
stead,S T EH1 D,1220726,694392,396,1507,2008
steadfast,S T EH1 D F AE2 S T,896154,524797,322,1515,2008
steadfastly,S T EH1 D F AE2 S T L IY0,520677,371558,294,1563,2008
steadfastness,S T EH1 D F AE2 S T N AH0 S,243405,168844,248,1563,2008
steadied,S T EH1 D IY0 D,274263,188317,232,1679,2008
steadier,S T EH1 D IY0 ER0,142475,122431,282,1667,2008
steadily,S T EH1 D AH0 L IY0,6623873,2039302,350,1505,2008
steadiness,S T EH1 D IY0 N IH0 S,470959,283637,327,1563,2008
steadman,S T EH1 D M AH0 N,131,102,50,1852,2008
steady,S T EH1 D IY0,11534299,2548151,363,1515,2008
steagall,S T IY1 G AH0 L,151,63,33,1938,2008
steak,S T EY1 K,963839,346391,284,1630,2008
steakhouse,S T EY1 K HH AW2 S,17025,9573,58,1944,2008
steakhouses,S T EY1 K HH AW2 S IH0 Z,3633,2263,52,1932,2008
steaks,S T EY1 K S,445213,168335,264,1644,2008
steal,S T IY1 L,3044209,1251047,377,1507,2008
stealer,S T IY1 L ER0,48359,35916,266,1592,2008
stealing,S T IY1 L IH0 NG,2473279,1057777,374,1520,2008
steals,S T IY1 L Z,521432,335557,337,1520,2008
stealth,S T EH1 L TH,352829,225671,347,1563,2008
stealthier,S T EH1 L TH IY0 ER0,2104,1904,151,1800,2008
stealthiest,S T EH1 L TH IY0 AH0 S T,1192,1132,151,1839,2008
stealthy,S T EH1 L TH IY0,247299,175106,234,1649,2008
steam,S T IY1 M,11925213,1477384,326,1524,2008
steamboat,S T IY1 M B OW2 T,783953,221022,219,1563,2008
steamboats,S T IY1 M B OW2 T S,348233,130543,211,1669,2008
steamed,S T IY1 M D,779241,315837,231,1719,2008
steamer,S T IY1 M ER0,2670974,483541,220,1524,2008
steamers,S T IY1 M ER0 Z,1240790,283536,213,1575,2008
steamier,S T IY1 M IY0 ER0,1985,1930,103,1808,2008
steamiest,S T IY1 M IY0 AH0 S T,1234,1204,65,1843,2008
steamily,S T IY1 M AH0 L IY0,1265,1226,96,1858,2008
steaming,S T IY1 M IH0 NG,1028295,496071,286,1664,2008
steamroller,S T IY1 M R OW2 L ER0,37248,30389,130,1845,2008
steamrollered,S T IY1 M R OW2 L ER0 D,5591,5300,86,1915,2008
steams,S T IY1 M Z,62235,48130,309,1581,2008
steamship,S T IY1 M SH IH2 P,645870,231514,197,1719,2008
steamy,S T IY1 M IY0,194156,140294,224,1667,2008
stear,S T IH1 R,2469,2086,224,1668,2008
stearic,S T IY1 R IH0 K,145161,34352,186,1785,2008
stearn,S T ER1 N,914,831,192,1770,2008
stearne,S T ER1 N,841,711,156,1581,2008
stearns,S T ER1 N Z,719,434,87,1877,2008
stears,S T IY1 R Z,557,466,124,1681,2008
stebbins,S T EH1 B IH0 N Z,394,246,67,1846,2008
steber,S T IY1 B ER0,87,43,32,1937,2007
stec,S T EH1 K,597,537,160,1675,2008
stech,S T EH1 K,393,252,79,1598,2008
stecher,S T EH1 K ER0,136,119,67,1839,2008
steck,S T EH1 K,1148,824,168,1649,2008
steckel,S T EH1 K AH0 L,96,66,38,1860,2008
stecker,S T EH1 K ER0,576,74,32,1776,2008
stedman,S T EH1 D M AH0 N,561,348,100,1787,2008
steeb,S T IY1 B,138,108,67,1772,2008
steed,S T IY1 D,565391,239352,332,1568,2008
steedman,S T IY1 D M AH0 N,99,71,36,1870,2008
steeds,S T IY1 D Z,321116,162596,297,1644,2008
steeg,S T IY1 G,948,465,107,1749,2008
steel,S T IY1 L,19269839,1983978,348,1515,2008
steelcase,S T IY1 L K EY2 S,88,72,29,1912,2008
steele,S T IY1 L,9803,5895,234,1568,2008
steeler,S T IY1 L ER0,164,130,59,1791,2008
steelers,S T IY1 L ER0 Z,191,137,45,1779,2008
steelhead,S T IY1 L HH EH2 D,104876,13510,121,1863,2008
steelmaker,S T IY1 L M EY2 K ER0,10842,5686,121,1821,2008
steelmakers,S T IY1 L M EY2 K ER0 Z,27509,9369,135,1792,2008
steelmaking,S T IY1 L M EY2 K IH0 NG,85198,21559,148,1795,2008
steelman,S T IY1 L M AH0 N,956,694,83,1863,2008
steels,S T IY1 L Z,1234054,83890,271,1515,2008
steelworker,S T IY1 L W ER2 K ER0,23792,14903,112,1838,2008
steelworkers,S T IY1 L W ER2 K ER0 Z,74931,28947,117,1848,2008
steelworks,S T IY1 L W ER2 K S,66689,26251,158,1794,2008
steely,S T IY1 L IY0,211509,152751,299,1629,2008
steen,S T IY1 N,6122,4013,205,1734,2008
steep,S T IY1 P,5435541,1406300,371,1507,2008
steeped,S T IY1 P T,754042,499111,324,1592,2008
steepened,S T IY1 P AH0 N D,24106,15592,143,1843,2008
steeper,S T IY1 P ER0,582265,282260,276,1681,2008
steepest,S T IY1 P AH0 S T,206386,121011,307,1598,2008
steeple,S T IY1 P AH0 L,470301,231175,316,1563,2008
steeplechase,S T IY1 P AH0 L CH EY2 S,47304,25130,175,1770,2008
steeples,S T IY1 P AH0 L Z,151009,103528,286,1568,2008
steeply,S T IY1 P L IY0,723976,348903,234,1590,2008
steepness,S T IY1 P N AH0 S,215098,117452,288,1668,2008
steer,S T IH1 R,1442579,784056,356,1575,2008
steere,S T IH1 R,2676,1755,202,1588,2008
steered,S T IH1 R D,897180,499197,341,1507,2008
steering,S T IH1 R IH0 NG,2249061,705945,331,1575,2008
steers,S T IH1 R Z,429612,189164,325,1582,2008
stees,S T IY1 Z,460,372,140,1725,2008
steever,S T IY1 V ER0,81,65,39,1816,2008
steeves,S T IY1 V Z,454,276,137,1650,2008
stefan,S T EH1 F AA0 N,1481,944,87,1828,2008
stefani,S T EH1 F AH0 N IY0,208,126,48,1857,2008
stefanie,S T EH1 F AH0 N IY0,74,47,22,1963,2008
stefano,S T EH1 F AH0 N OW0,673,424,95,1673,2008
steffen,S T EH1 F AH0 N,235,177,44,1935,2008
steffens,S T EH1 F AH0 N Z,242,183,64,1838,2007
steffi,S T EH1 F IY0,76,46,31,1702,2007
stefl,S T EH1 F AH0 L,77,73,56,1698,2008
stegar,S T IY1 G ER0,82,42,22,1951,2007
stege,S T IY1 JH,1531,1130,198,1678,2008
steger,S T IY1 G ER0,104,73,37,1875,2008
stegner,S T EH1 G N ER0,277,96,40,1879,2008
stegosaurus,S T EH2 G AH0 S AO1 R AH0 S,5953,3385,94,1881,2008
stehle,S T EH1 HH AH0 L,346,314,89,1804,2008
stehr,S T EH1 R,188,117,51,1850,2008
steichen,S T AY1 K AH0 N,171,99,48,1908,2008
steig,S T IY1 G,1144,879,137,1788,2008
steiger,S T AY1 G ER0,500,299,71,1848,2008
steil,S T IY1 L,4328,2446,177,1731,2008
stein,S T AY1 N,79304,55671,287,1657,2008
steinbach,S T AY1 N B AA2 K,200,117,46,1813,2008
steinbeck,S T AY1 N B EH2 K,484,285,65,1753,2008
steinberg,S T AY1 N B ER0 G,501,198,55,1837,2008
steinberger,S T AY1 N B ER0 G ER0,97,62,31,1908,2008
steinbock,S T AY1 N B AA2 K,1021,552,143,1822,2008
steinem,S T AY1 N AH0 M,211,134,38,1914,2008
steiner,S T AY1 N ER0,3386,1869,121,1848,2008
steinert,S T AY1 N ER0 T,117,76,42,1895,2008
steines,S T AY1 N Z,72,51,31,1803,2008
steingut,S T AY1 N G AH2 T,84,44,32,1861,2007
steinhardt,S T AY1 N HH AA2 R T,227,46,30,1906,2008
steinhart,S T AY1 N HH AA2 R T,167,108,49,1875,2008
steinhaus,S T AY1 N HH AW2 S,102,68,34,1821,2006
steinke,S T AY1 NG K,61,43,23,1956,2008
steinman,S T AY1 N M AH0 N,110,85,42,1871,2007
steinmann,S T AY1 N M AH0 N,181,118,48,1899,2008
steinmetz,S T AY1 N M EH0 T S,251,161,72,1823,2008
steinway,S T AY1 N W EY2,159,112,62,1864,2008
stell,S T EH1 L,8173,4145,217,1637,2008
stella,S T EH1 L AH0,33860,13720,265,1541,2008
stellar,S T EH1 L ER0,981579,190072,243,1590,2008
stellato,S T EH0 L AA1 T OW0,2343,1329,199,1712,2008
stelle,S T EH1 L,35855,15988,239,1706,2008
stellenbosch,S T EH1 L AH0 N B AO2 SH,131,100,49,1835,2008
steller,S T EH1 L ER0,1867,1476,155,1783,2008
stelling,S T EH1 L IH0 NG,3597,1477,161,1720,2008
stello,S T EH1 L OW0,377,311,124,1796,2008
stem,S T EH1 M,8275024,1601838,369,1515,2008
stemen,S T EH1 M AH0 N,107,101,52,1819,2008
stemlike,S T EH1 M L AY2 K,4647,3220,145,1809,2008
stemm,S T EH1 M,447,397,122,1645,2008
stemmed,S T EH1 M D,1102694,582925,279,1590,2008
stemmer,S T EH1 M ER0,6383,2287,148,1808,2008
stemming,S T EH1 M IH0 NG,901329,510467,286,1515,2008
stempel,S T EH1 M P AH0 L,830,567,96,1845,2008
stemper,S T EH1 M P ER0,132,121,73,1581,2007
stemple,S T EH1 M P AH0 L,327,101,53,1813,2008
stempler,S T EH1 M P L ER0,73,58,33,1912,2008
stemposts,S T EH1 M P OW2 S T S,249,196,60,1869,2008
stems,S T EH1 M Z,4547215,1183150,333,1515,2008
sten,S T EH1 N,32443,18010,279,1631,2008
stena,S T IY1 N AH0,1186,801,117,1710,2008
stenberg,S T EH1 N B ER0 G,257,213,94,1790,2008
stench,S T EH1 N CH,672364,372563,341,1563,2008
stencil,S T EH1 N S IH0 L,308952,61809,198,1574,2008
stenciled,S T EH1 N S IH0 L D,85694,50827,148,1838,2008
stenciling,S T EH1 N S IH0 L IH0 NG,35980,13076,144,1807,2008
stender,S T EH1 N D ER0,1721,1093,251,1603,2008
stendhal,S T EH1 N D AA0 L,468,311,67,1910,2008
stendig,S T EH1 N D IH0 G,113,104,49,1850,2008
stene,S T IY1 N,1739,1197,220,1648,2008
stengel,S T EH1 NG G AH0 L,523,244,81,1842,2008
stenger,S T EH1 N JH ER0,415,136,62,1807,2008
stenhouse,S T EH1 N HH AW2 S,91,64,32,1875,2008
stennis,S T EH1 N IH0 S,56,41,24,1805,2008
steno,S T EH1 N OW0,24736,14692,167,1725,2008
stenographer,S T EH0 N AH1 G R AH0 F ER0,290057,126701,206,1712,2008
stenographic,S T EH2 N AH0 G R AE1 F IH0 K,115722,61042,215,1588,2008
stenson,S T EH1 N S AH0 N,114,98,55,1761,2008
stent,S T EH1 N T,398368,30273,273,1675,2008
stentor,S T EH1 N T ER0,4918,3000,200,1765,2008
stentors,S T EH1 N T ER0 Z,1528,543,126,1833,2008
steny,S T EH1 N IY0,476,307,65,1718,2008
stenz,S T EH1 N Z,116,67,42,1824,2007
stenzel,S T EH1 N Z AH0 L,60,44,21,1962,2008
step,S T EH1 P,40243262,3800397,401,1505,2008
stepan,S T EH1 P AH0 N,1051,195,54,1872,2008
stepchild,S T EH1 P CH AY2 L D,77859,44509,168,1785,2008
stepchildren,S T EH1 P CH IH1 L D R AH0 N,111118,44935,178,1587,2008
stepdaughter,S T EH1 P D AO2 T ER0,121741,64981,208,1637,2008
stepdaughters,S T EH1 P D AO2 T ER0 Z,13917,9176,161,1789,2008
stepfather,S T EH1 P F AA2 DH ER0,523354,178491,227,1584,2008
steph,S T EH1 F,1107,372,114,1683,2008
stephan,S T EH1 F AH0 N,853,639,101,1768,2008
stephana,S T EH0 F AA1 N AH0,97,40,25,1899,2008
stephane,S T EH0 F AA1 N,3339,954,131,1790,2008
stephani,S T EH1 F AH0 N IY0,1787,605,112,1772,2008
stephania,S T IH0 F AE1 N IY0 AH0,314,142,38,1860,2008
stephanie,S T EH1 F AH0 N IY0,592,360,45,1878,2008
stephen,S T IY1 V AH0 N,5923,2655,191,1707,2008
stephens,S T IY1 V AH0 N Z,1216,618,115,1800,2008
stephenson,S T IY1 V AH0 N S AH0 N,1214,518,106,1835,2008
stepladder,S T EH1 P L AE2 D ER0,52875,36294,181,1773,2008
stepladders,S T EH1 P L AE2 D ER0 Z,8484,6560,140,1767,2008
stepmother,S T EH1 P M AH2 DH ER0,595514,208069,278,1568,2008
stepney,S T EH1 P N IY0,472,362,100,1753,2008
stepp,S T EH1 P,1834,1418,196,1676,2008
steppe,S T EH1 P,625053,98391,240,1568,2008
stepped,S T EH1 P T,8166459,1662474,342,1515,2008
steppenwolf,S T EH1 P AH0 N W UH2 L F,313,197,55,1947,2008
stepper,S T EH1 P ER0,73452,19201,187,1770,2008
steppers,S T EH1 P ER0 Z,15685,8621,176,1707,2008
steppes,S T EH1 P S,405181,141788,239,1568,2008
"steppin'",S T EH1 P IH0 N,114,106,55,1865,2008
stepping,S T EH1 P IH0 NG,2303848,1180083,346,1515,2008
steppingstone,S T EH1 P IH0 NG S T OW2 N,32621,28187,196,1792,2008
steps,S T EH1 P S,28159500,3485455,397,1505,2008
stepsister,S T EH1 P S IH2 S T ER0,44804,23665,153,1829,2008
stepsisters,S T EH1 P S IH2 S T ER0 Z,25349,13793,142,1846,2008
stepson,S T EH1 P S AH2 N,158371,90747,220,1648,2008
steptoe,S T EH1 P T OW2,246,144,57,1871,2008
sterba,S T EH1 R B AH0,91,79,36,1932,2008
stereo,S T EH1 R IY0 OW2,917477,260497,195,1515,2008
stereographic,S T EH2 R IY0 AH0 G R AE1 F IH0 K,56724,14331,220,1762,2008
stereomicroscope,S T EH2 R IY0 OW0 M AY1 K R AH0 S K OW0 P,14973,6479,67,1923,2008
stereos,S T EH1 R IY0 OW2 Z,58276,40443,170,1673,2008
stereotype,S T EH1 R IY0 AH0 T AY2 P,1168393,403952,222,1590,2008
stereotyped,S T EH1 R IY0 AH0 T AY2 P T,933085,450812,217,1564,2008
stereotypes,S T EH1 R IY0 AH0 T AY2 P S,1951197,432656,201,1607,2008
stereotypical,S T EH2 R IY0 OW0 T IH1 P IH0 K AH0 L,449307,209104,125,1705,2008
stereotyping,S T EH1 R IY0 AH0 T AY2 P IH0 NG,469208,170903,200,1644,2008
sterile,S T EH1 R AH0 L,2994763,761984,304,1524,2008
sterility,S T ER0 IH1 L IH0 T IY0,842050,310901,292,1653,2008
sterilization,S T EH2 R AH0 L AH0 Z EY1 SH AH0 N,996394,164100,140,1808,2008
sterilizations,S T EH2 R AH0 L AH0 Z EY1 SH AH0 N Z,31106,11865,118,1889,2008
sterilize,S T EH1 R AH0 L AY2 Z,178951,82111,159,1749,2008
sterilized,S T EH1 R AH0 L AY2 Z D,690305,182815,182,1783,2008
sterilizer,S T EH1 R AH0 L AY2 Z ER0,83160,19073,132,1808,2008
sterilizers,S T EH1 R AH0 L AY2 Z ER0 Z,26657,10170,126,1829,2008
sterilizes,S T EH1 R AH0 L AY2 Z IH0 Z,14725,12383,149,1774,2008
sterilizing,S T EH1 R AH0 L AY2 Z IH0 NG,178699,74307,177,1749,2008
sterk,S T ER1 K,12165,4103,138,1797,2008
sterle,S T ER1 AH0 L,103,69,46,1812,2008
sterling,S T ER1 L IH0 NG,2297257,561326,351,1515,2008
sterman,S T ER1 M AH0 N,138,117,63,1831,2008
stern,S T ER1 N,4160306,1262191,363,1563,2008
sternbach,S T ER1 N B AA0 K,73,43,23,1959,2008
sternberg,S T ER1 N B ER0 G,368,174,50,1879,2008
sterne,S T ER1 N,11482,6529,246,1581,2008
sterner,S T ER1 N ER0,244343,193695,267,1649,2008
sternest,S T ER1 N AH0 S T,100201,86399,251,1582,2008
sternly,S T ER1 N L IY0,906079,498789,311,1524,2008
sternness,S T ER1 N N AH0 S,176457,134462,276,1582,2008
sternpost,S T ER1 N P OW2 S T,22473,7419,211,1773,2008
sternposts,S T ER1 N P OW2 S T S,2020,1198,169,1751,2008
sterns,S T ER1 N Z,45825,33401,281,1644,2008
steroid,S T ER0 OY1 D,1200818,116001,124,1725,2008
steroids,S T EH1 R OY0 D Z,1193449,139314,96,1820,2008
sterr,S T EH1 R,597,532,153,1683,2008
sterry,S T EH1 R IY0,227,192,81,1792,2008
stet,S T EH1 T,18428,12350,275,1658,2008
stethoscope,S T EH1 TH AH0 S K OW2 P,286770,106787,196,1713,2008
stethoscopes,S T EH1 TH AH0 S K OW2 P S,17917,13439,174,1828,2008
stetson,S T EH1 T S AH0 N,5661,3841,113,1819,2008
stetter,S T EH1 T ER0,487,405,115,1724,2008
stetz,S T EH1 T S,74,58,34,1870,2008
stetzer,S T EH1 T Z ER0,88,69,13,1975,2006
steuart,S T OY1 AA0 R T,264,177,83,1751,2008
steuben,S T Y UW1 B IH0 N,232,153,77,1832,2008
steuer,S T OY1 ER0,712,422,113,1820,2008
steve,S T IY1 V,12909,3866,140,1706,2008
stevedore,S T IY1 V AH0 D AO2 R,66177,29110,172,1743,2008
stevedoring,S T IY1 V AH0 D AO2 R IH0 NG,35004,11550,127,1854,2008
steven,S T IY1 V AH0 N,5724,3924,182,1768,2008
stevens,S T IY1 V AH0 N Z,5566,2636,158,1764,2008
stevenson,S T IY1 V AH0 N S AH0 N,4329,2007,142,1835,2008
stever,S T IY1 V ER0,115,105,64,1687,2008
steves,S T IY1 V Z,140,125,58,1742,2008
stevie,S T IY1 V IY0,759,285,55,1846,2008
stew,S T UW1,820431,353679,351,1568,2008
steward,S T UW1 ER0 D,1538890,461074,331,1563,2008
stewardess,S T UW1 ER0 D AH0 S,146726,69044,187,1774,2008
stewardesses,S T UW1 ER0 D AH0 S IH0 Z,54059,29305,184,1797,2008
stewards,S T UW1 ER0 D Z,645925,246138,310,1590,2008
stewardship,S T UW1 ER0 D SH IH2 P,528828,222581,282,1650,2008
stewart,S T UW1 ER0 T,9395,4630,226,1683,2008
stewed,S T UW1 D,282954,156668,324,1590,2008
stewing,S T UW1 IH0 NG,94651,67758,315,1618,2008
stews,S T UW1 Z,170812,88393,320,1563,2008
steyer,S T EY1 ER0,94,67,39,1784,2008
stice,S T AY1 S,3199,2814,328,1581,2008
stich,S T IH1 CH,12690,8235,324,1635,2008
sticha,S T IH1 CH AH0,128,93,44,1711,2008
sticht,S T IH1 K T,1760,1421,150,1702,2008
stichter,S T IH1 K T ER0,376,236,64,1814,2008
stick,S T IH1 K,9149223,2236743,385,1507,2008
sticka,S T IH1 K AH0,374,274,97,1709,2008
stickball,S T IH1 K B AO2 L,17609,10152,75,1826,2008
stickel,S T IH1 K AH0 L,66,56,32,1787,2008
sticker,S T IH1 K ER0,264560,141003,231,1600,2008
stickers,S T IH1 K ER0 Z,282765,146167,203,1771,2008
stickier,S T IH1 K IY0 ER0,16182,14601,144,1754,2008
stickiest,S T IH1 K IY0 AH0 S T,6140,5889,141,1842,2008
sticking,S T IH1 K IH0 NG,1835520,956318,361,1515,2008
stickle,S T IH1 K AH0 L,10317,8381,295,1653,2008
stickler,S T IH1 K AH0 L ER0,92449,81328,299,1644,2008
stickles,S T IH1 K AH0 L Z,2427,1814,210,1730,2008
stickney,S T IH1 K N IY0,150,103,63,1834,2008
sticks,S T IH1 K S,3476924,1273672,368,1520,2008
sticktight,S T IH1 K T AY2 T,1785,936,104,1891,2008
sticktights,S T IH1 K T AY2 T S,906,680,112,1891,2008
sticky,S T IH1 K IY0,1369275,621502,265,1667,2008
stiebel,S T IY1 B AH0 L,153,60,27,1848,2008
stief,S T IY1 F,167,98,48,1791,2008
stiefel,S T IY1 F AH0 L,206,127,57,1835,2008
stieg,S T IY1 G,10071,5100,156,1750,2008
stieglitz,S T IY1 G L IH0 T S,345,153,62,1881,2008
stiehl,S T IY1 L,96,67,39,1804,2008
stier,S T AY1 ER0,916,718,151,1647,2008
stiers,S T AY1 ER0 Z,56,52,35,1721,2007
stieve,S T IY1 V,237,210,94,1814,2008
stiff,S T IH1 F,4487813,1543747,368,1507,2008
stiffed,S T IH1 F T,10330,8586,167,1707,2008
stiffen,S T IH1 F AH0 N,286031,216630,292,1515,2008
stiffened,S T IH1 F AH0 N D,798022,412253,284,1582,2008
stiffener,S T IH1 F AH0 N ER0,68001,11941,178,1801,2008
stiffening,S T IH1 F AH0 N IH0 NG,338278,205100,260,1607,2008
stiffens,S T IH1 F AH0 N Z,64398,54212,266,1667,2008
stiffer,S T IH1 F ER0,221231,148493,283,1667,2008
stiffest,S T IH1 F AH0 S T,38594,34487,262,1681,2008
stiffly,S T IH1 F L IY0,682909,362327,336,1563,2008
stiffness,S T IH1 F N AH0 S,1895235,394667,326,1581,2008
stiffs,S T IH1 F S,29357,19661,223,1682,2008
stifle,S T AY1 F AH0 L,600195,428439,353,1563,2008
stifled,S T AY1 F AH0 L D,770153,518977,356,1563,2008
stifles,S T AY1 F AH0 L Z,101283,87599,315,1563,2008
stifling,S T AY1 F L IH0 NG,659376,465410,329,1563,2008
stifter,S T IH1 F T ER0,581,491,136,1738,2008
stig,S T IH1 G,4019,3310,230,1715,2008
stiger,S T AY1 G ER0,2600,946,103,1823,2008
stigler,S T IH1 G L ER0,222,115,43,1906,2008
stiglitz,S T IH1 G L IH0 T S,86,62,26,1874,2008
stigma,S T IH1 G M AH0,1329928,497450,286,1520,2008
stigmata,S T IH0 G M AA1 T AH0,212051,88157,247,1631,2008
stigmatism,S T IH1 G M AH0 T IH2 Z AH0 M,2241,1630,112,1874,2008
stigmatize,S T IH1 G M AH0 T AY2 Z,101931,81035,312,1607,2008
stigmatized,S T IH1 G M AH0 T AY2 Z D,391572,211371,325,1644,2008
stigmatizing,S T IH1 G M AH0 T AY2 Z IH0 NG,99218,61435,278,1698,2008
stika,S T IH1 K AH0,328,218,66,1854,2008
stil,S T IH1 L,56359,36338,333,1515,2008
stile,S T AY1 L,328870,121754,382,1579,2008
stiles,S T AY1 L Z,85527,32100,347,1581,2008
stiletto,S T AH0 L EH1 T OW0,91899,60222,240,1749,2008
stilettos,S T AH0 L EH1 T OW0 Z,22635,16281,215,1721,2008
still,S T IH1 L,190009544,4369735,423,1505,2008
stillborn,S T IH1 L B AO1 R N,187808,121420,234,1689,2008
stille,S T IH1 L,24934,14146,229,1718,2008
stilled,S T IH1 L D,350837,241521,300,1564,2008
stiller,S T IH1 L ER0,27138,22078,254,1664,2008
stillinger,S T IH1 L IH0 NG ER0,446,205,71,1887,2008
stillings,S T IH1 L IH0 NG Z,173,114,63,1740,2008
stillion,S T IH1 L Y AH0 N,226,138,75,1753,2008
stillman,S T IH1 L M AH0 N,1727,744,115,1838,2008
stillness,S T IH1 L N AH0 S,1367259,601793,290,1575,2008
stills,S T IH1 L Z,296699,131062,310,1649,2008
stillson,S T IH1 L S AH0 N,336,249,84,1889,2008
stillwater,S T IH1 L W AO2 T ER0,5328,1898,137,1818,2008
stillwell,S T IH1 L W EH2 L,270,147,50,1897,2008
stils,S T IH1 L Z,349,304,125,1711,2008
stilson,S T IH1 L S AH0 N,211,144,67,1859,2008
stilt,S T IH1 L T,74762,46845,334,1631,2008
stilted,S T IH1 L T IH0 D,259542,190090,244,1564,2008
stilts,S T IH1 L T S,209401,133924,282,1620,2008
stilwell,S T IH1 L W EH2 L,294,166,60,1866,2008
stimpson,S T IH1 M P S AH0 N,97,64,41,1880,2008
stimpy,S T IH1 M P IY0,586,63,16,1992,2007
stimson,S T IH1 M S AH0 N,695,399,87,1824,2008
stimulant,S T IH1 M Y AH0 L AH0 N T,816994,298019,264,1675,2008
stimulants,S T IH1 M Y AH0 L AH0 N T S,712232,239191,250,1582,2008
stimulate,S T IH1 M Y AH0 L EY2 T,4535479,1424117,316,1515,2008
stimulated,S T IH1 M Y AH0 L EY2 T AH0 D,5076991,1436482,329,1515,2008
stimulates,S T IH1 M Y AH0 L EY2 T S,1529539,549570,291,1582,2008
stimulating,S T IH1 M Y AH0 L EY2 T IH0 NG,3918588,1319594,305,1515,2008
stimulation,S T IH2 M Y AH0 L EY1 SH AH0 N,7025156,756518,264,1515,2008
stimulative,S T IH1 M Y AH0 L EY2 T IH0 V,58094,31656,235,1733,2008
stimulator,S T IH1 M Y AH0 L EY2 T ER0,164583,55613,210,1770,2008
stimulators,S T IH1 M Y AH0 L EY2 T ER0 Z,71562,33514,199,1769,2008
stimuli,S T IH1 M Y AH0 L AY2,5606352,586461,261,1607,2008
stimulus,S T IH1 M Y AH0 L AH0 S,8262771,1170610,292,1515,2008
stine,S T AY1 N,2306,1970,253,1644,2008
stiner,S T AY1 N ER0,61,54,38,1860,2008
stines,S T AY1 N Z,248,223,135,1631,2008
sting,S T IH1 NG,1286593,673171,370,1515,2008
stinger,S T IH1 NG ER0,51440,26852,205,1684,2008
stingers,S T IH1 NG ER0 Z,22416,14784,258,1722,2008
stingier,S T IH1 N JH IY0 ER0,2866,2707,143,1768,2008
stinginess,S T IH1 N JH IY0 N IH0 S,59518,48307,238,1685,2008
stinging,S T IH1 NG IH0 NG,661472,395387,335,1579,2008
stings,S T IH1 NG Z,358447,200870,343,1563,2008
stingy,S T IH1 N JH IY0,210290,158114,295,1658,2008
stink,S T IH1 NG K,420107,248824,342,1631,2008
stinkbug,S T IH1 NG K B AH0 G,3689,1847,90,1892,2008
stinkbugs,S T IH1 NG K B AH0 G Z,2900,1669,101,1900,2008
stinkers,S T IH1 NG K ER0 Z,8520,6766,123,1803,2008
stinking,S T IH1 NG K IH0 NG,455717,277046,359,1520,2008
stinks,S T IH1 NG K S,157974,122189,313,1643,2008
stinky,S T IH1 NG K IY0,39959,28867,112,1715,2008
stinson,S T IH1 N S AH0 N,167,128,57,1874,2008
stint,S T IH1 N T,482854,323561,354,1572,2008
stints,S T IH1 N T S,72051,55919,290,1656,2008
stipe,S T AY1 P,69139,8587,266,1581,2008
stipend,S T AY1 P AH0 N D,477779,210740,321,1525,2008
stipends,S T AY1 P AH0 N D Z,227149,103689,301,1607,2008
stipes,S T AY1 P S,44245,8808,245,1675,2008
stipp,S T IH1 P,109,94,64,1718,2008
stipulate,S T IH1 P Y AH0 L EY2 T,449429,257809,312,1515,2008
stipulated,S T IH1 P Y AH0 L EY2 T IH0 D,2065414,748871,341,1515,2008
stipulates,S T IH1 P Y AH0 L EY2 T S,401956,215424,281,1515,2008
stipulating,S T IH1 P Y AH0 L EY2 T IH0 NG,261672,190786,297,1515,2008
stipulation,S T IH2 P Y AH0 L EY1 SH AH0 N,997728,383688,322,1524,2008
stipulations,S T IH2 P Y AH0 L EY1 SH AH0 N Z,705109,279378,291,1524,2008
stir,S T ER1,4050163,1415078,386,1520,2008
stires,S T AY1 R Z,136,133,81,1748,2008
stirling,S T ER1 L IH0 NG,1654,1054,182,1593,2008
stirn,S T ER1 N,346,269,91,1806,2008
stirred,S T ER1 D,3783684,1389467,381,1507,2008
stirring,S T ER1 IH0 NG,3663244,1273153,378,1524,2008
stirrings,S T ER1 IH0 NG Z,224721,174483,279,1607,2008
stirrup,S T ER1 AH0 P,356472,158269,286,1520,2008
stirrups,S T ER1 AH0 P S,316564,138423,268,1664,2008
stirs,S T ER1 Z,510549,361965,346,1590,2008
stitch,S T IH1 CH,1249545,259309,316,1507,2008
stitched,S T IH1 CH T,482738,254352,300,1619,2008
stitches,S T IH1 CH IH0 Z,902466,245924,281,1524,2008
stitching,S T IH1 CH IH0 NG,476044,169571,267,1628,2008
stites,S T AY1 T S,459,429,162,1764,2008
stith,S T IH1 TH,555,427,157,1631,2008
stitt,S T IH1 T,1692,1429,223,1668,2008
stiver,S T AY1 V ER0,20612,14016,328,1644,2008
stivers,S T AY1 V ER0 Z,22602,5432,269,1655,2008
stjohn,S EY1 N T JH AA1 N,54,52,30,1883,2008
stober,S T OW1 B ER0,67,53,33,1882,2008
stobie,S T AA1 B IY0,112,61,37,1840,2007
stochastic,S T OW0 K AE1 S T IH0 K,1181676,130384,119,1804,2008
stock,S T AA1 K,34827101,2643871,385,1515,2008
stockard,S T AA1 K ER0 D,107,65,38,1901,2008
stockbridge,S T AA1 K B R IH0 JH,225,166,81,1809,2008
stockbroker,S T AA1 K B R OW2 K ER0,184632,102385,209,1759,2008
stockbrokerage,S T AA1 K B R OW2 K ER0 IH0 JH,4481,2223,88,1896,2008
stockbrokerages,S T AA1 K B R OW2 K ER0 IH0 JH IH0 Z,273,208,36,1891,2008
stockbrokers,S T AA1 K B R OW2 K ER0 Z,105699,62500,200,1722,2008
stockbroking,S T AA1 K B R OW2 K IH0 NG,16273,8415,155,1829,2008
stockdale,S T AA1 K D EY2 L,172,156,83,1786,2008
stocke,S T AA1 K,13093,7082,260,1572,2008
stocked,S T AA1 K T,969991,528807,334,1515,2008
stocker,S T AA1 K ER0,12523,4664,141,1831,2008
stockham,S T AA1 K HH AH0 M,84,42,26,1911,2008
stockhausen,S T AA1 K HH AW2 Z AH0 N,176,95,40,1941,2008
stockholder,S T AA1 K HH OW2 L D ER0,802872,138714,230,1600,2008
stockholders,S T AA1 K HH OW2 L D ER0 Z,2511193,273137,247,1600,2008
stockholding,S T AA1 K HH OW2 L D IH0 NG,33639,14677,162,1797,2008
stockholdings,S T AA1 K HH OW2 L D IH0 NG Z,25389,10898,114,1835,2008
stockholm,S T AA1 K HH OW2 L M,1307,541,91,1838,2008
stocking,S T AA1 K IH0 NG,938547,417273,315,1515,2008
stockinger,S T AA1 K IH0 NG ER0,2218,1331,164,1808,2008
stockings,S T AA1 K IH0 NG Z,1419169,585046,308,1563,2008
stockley,S T AA1 K L IY0,53,48,35,1900,2008
stockman,S T AA1 K M AH0 N,58746,22417,179,1807,2008
stockmarket,S T AA1 K M AA2 R K IH0 T,25331,14476,146,1794,2008
stockpile,S T AA1 K P AY2 L,208992,95420,118,1854,2008
stockpiled,S T AA1 K P AY2 L D,79185,56615,96,1777,2008
stockpiles,S T AA1 K P AY2 L Z,130396,63688,108,1777,2008
stockpiling,S T AA1 K P AY2 L IH0 NG,121603,69274,98,1515,2008
stockroom,S T AA1 K R UW2 M,53359,23953,119,1868,2008
stocks,S T AA1 K S,6174206,994288,360,1515,2008
stockstill,S T AA1 K S T IH2 L,6522,6000,191,1719,2008
stockton,S T AA1 K T AH0 N,338,258,92,1835,2008
stockwell,S T AA1 K W EH2 L,226,169,68,1820,2008
stocky,S T AA1 K IY0,332157,207992,219,1755,2008
stockyard,S T AA1 K Y AA2 R D,35407,20381,170,1802,2008
stockyards,S T AA1 K Y AA2 R D Z,104016,48900,166,1820,2008
stoddard,S T AA1 D ER0 D,1002,595,112,1807,2008
stodgy,S T AA1 JH IY0,80872,66863,151,1746,2008
stodola,S T OW0 D OW1 L AH0,98,71,32,1926,2008
stoff,S T AO1 F,5307,2316,160,1709,2008
stoffel,S T AA1 F AH0 L,113,76,42,1891,2008
stoffer,S T AO1 F ER0,1697,487,83,1892,2008
stoffers,S T AO1 F ER0 Z,82,62,31,1934,2007
stoga,S T OW1 G AH0,1036,485,115,1824,2008
stogdill,S T AA1 G D IH0 L,92,60,30,1952,2007
stohl,S T OW1 L,115,74,35,1805,2008
stohr,S T AO1 R,134,107,46,1763,2007
stoia,S T OW1 Y AH0,137,121,71,1761,2008
stoic,S T OW1 IH0 K,283726,194447,280,1587,2008
stoically,S T OW1 IH0 K L IY0,113837,97197,217,1705,2008
stoicism,S T OW1 AH0 S IH2 Z AH0 M,185326,132007,257,1635,2008
stoics,S T OW1 IH0 K S,25830,19164,265,1650,2008
stoke,S T OW1 K,79730,63579,246,1668,2008
stoked,S T OW1 K T,98964,79875,164,1728,2008
stokely,S T OW1 K L IY0,196,124,40,1801,2008
stoker,S T OW1 K ER0,127043,43222,209,1575,2008
stokes,S T OW1 K S,21496,16740,188,1783,2008
stoking,S T OW1 K IH0 NG,68683,52811,190,1760,2008
stokke,S T AA1 K,328,245,84,1785,2008
stol,S T OW1 L,10153,4969,226,1673,2008
stolar,S T OW1 L ER0,173,118,51,1867,2008
stolberg,S T OW1 L B ER0 G,190,47,32,1675,2008
stole,S T OW1 L,2263386,968939,368,1520,2008
stolen,S T OW1 L AH0 N,4091257,1336159,357,1520,2008
stoler,S T OW1 L ER0,248,195,83,1787,2008
stolid,S T AA1 L AH0 D,297124,214304,222,1631,2008
stoll,S T OW1 L,1193,875,138,1723,2008
stolle,S T AA1 L,202,169,75,1779,2008
stollen,S T AA1 L AH0 N,7546,4727,312,1592,2008
stoller,S T OW1 L ER0,320,215,59,1789,2008
