word,pronunication,tf,df,years,year_first,year_recent
s,EH1 S,243654329,4480695,422,1505,2008
"s's",EH1 S IH0 Z,98,93,54,1731,2008
s.,EH1 S,8928155,991874,388,1505,2008
sa,S AA1,3137711,515958,379,1505,2008
saab,S AA1 B,3638,994,74,1706,2008
saad,S AA1 D,1737,1175,188,1682,2008
saal,S AA1 L,3640,2197,194,1733,2008
saam,S AA1 M,4007,1789,190,1631,2008
saar,S AA1 R,3939,1326,153,1734,2008
saari,S AA1 R IY0,780,520,88,1744,2008
saarinen,S AA1 R IH0 N AH0 N,329,235,51,1947,2006
saatchi,S AA1 CH IY0,93,54,20,1976,2008
saavedra,S AA0 V EY1 D R AH0,161,106,48,1809,2008
saba,S AA1 B AH0,10235,4729,205,1680,2008
sabah,S AA1 B AH0,2038,984,116,1798,2008
sabala,S AA0 B AA1 L AH0,371,249,62,1867,2008
saban,S EY1 B AH0 N,722,475,98,1753,2008
sabas,S AA1 B AH0 Z,347,196,72,1777,2008
sabat,S AA1 B AA0 T,2239,1066,143,1754,2008
sabatini,S AE2 B AH0 T IY1 N IY0,91,62,30,1796,2008
sabatino,S AA0 B AA0 T IY1 N OW0,125,116,41,1949,2007
sabato,S AA0 B AA1 T OW0,3586,1892,144,1795,2008
sabb,S AE1 B,691,330,94,1763,2008
sabbagh,S AE1 B AH0 G,63,55,29,1842,2008
sabbath,S AE1 B AH0 TH,455971,116216,313,1607,2008
sabbaths,S AE1 B AH0 TH S,45499,23845,291,1677,2008
sabbatical,S AH0 B AE1 T IH0 K AH0 L,233924,133614,272,1684,2008
sabbaticals,S AH0 B AE1 T IH0 K AH0 L Z,26951,17457,89,1865,2008
sabel,S AA0 B EH1 L,1327,1038,156,1757,2008
sabella,S AH0 B EH1 L AH0,1380,844,184,1746,2008
sabena,S AH0 B IY1 N AH0,81,70,37,1930,2008
saber,S EY1 B ER0,285539,112184,282,1524,2008
sabers,S EY1 B ER0 Z,70342,39279,190,1563,2008
sabey,S EY1 B IY0,308,146,65,1823,2008
sabia,S AA1 B IY0 AH0,14249,6559,211,1700,2008
sabin,S EY1 B IH0 N,2569,1111,152,1706,2008
sabina,S AH0 B IY1 N AH0,8845,3875,209,1759,2008
sabine,S AH0 B IY1 N,2031,1367,191,1682,2008
sabino,S AA0 B IY1 N OW0,1506,657,114,1778,2008
sabins,S EY1 B IH0 N Z,3790,532,82,1809,2008
sabir,S EY1 B ER0,1201,717,106,1671,2008
sable,S EY1 B AH0 L,463318,214019,324,1574,2008
sables,S EY1 B AH0 L Z,70411,36635,297,1584,2008
sabo,S AA1 B OW0,3291,2162,136,1774,2008
sabol,S AA0 B AO1 L,47,46,27,1800,2008
sabotage,S AE1 B AH0 T AA2 ZH,990363,363186,137,1515,2008
sabotaged,S AE1 B AH0 T AA2 ZH D,143264,107722,108,1515,2008
sabotaging,S AE1 B AH0 T AA2 ZH IH0 NG,107923,80972,98,1831,2008
saboteur,S AE2 B AH0 T ER1,45505,27005,103,1859,2008
saboteurs,S AE2 B AH0 T ER1 Z,117174,61844,104,1838,2008
sabra,S AA1 B R AH0,16570,5281,126,1751,2008
sabre,S EY1 B ER0,308282,138065,281,1563,2008
sabres,S EY1 B ER0 Z,144129,75059,272,1575,2008
sabrina,S AH0 B R IY1 N AH0,616,294,63,1819,2008
sabry,S AA1 B R IY0,264,57,24,1807,2008
sabta,S AE1 B T AH0,130,100,44,1820,2007
sac,S AE1 K,2101856,325364,344,1629,2008
sacca,S AE1 K AH0,3636,1631,159,1673,2008
saccharin,S AE1 K ER0 AH0 N,117104,28288,167,1785,2008
saccharine,S AE1 K ER0 AY2 N,168633,83556,258,1682,2008
sacco,S AE1 K OW0,8726,4916,238,1700,2008
saccone,S AA0 K OW1 N IY0,85,59,34,1831,2007
saccule,S AE1 K Y UW2 L,54718,10678,176,1785,2008
sacha,S AE1 CH AH0,2893,1077,147,1702,2008
sacher,S AE1 K ER0,1175,688,101,1624,2008
sachet,S AE0 SH EY1,37754,20932,190,1723,2008
sachi,S AE1 CH IY0,1485,592,116,1718,2008
sachin,S AE1 CH AH0 N,79,60,25,1884,2008
sachs,S AE1 K S,5320,3386,173,1717,2008
sachse,S AE1 CH S,86,68,37,1829,2008
sack,S AE1 K,2036816,790507,360,1563,2008
sacked,S AE1 K T,643051,329254,333,1520,2008
sackett,S AE1 K IH0 T,251,148,67,1815,2008
sacking,S AE1 K IH0 NG,268431,180373,328,1515,2008
sackman,S AE1 K M AH0 N,342,130,56,1851,2008
sacks,S AE1 K S,980089,440079,314,1584,2008
sackville,S AE1 K V IH2 L,396,267,89,1796,2008
saco,S EY1 K OW0,10713,5651,199,1658,2008
sacra,S AE1 K R AH0,176749,74208,337,1581,2008
sacrament,S AE1 K R AH0 M AH0 N T,1508677,330305,338,1520,2008
sacramental,S AE1 K R AH0 M AH0 N T AH0 L,735595,203702,315,1520,2008
sacramento,S AE2 K R AH0 M EH1 N T OW0,26516,10247,266,1679,2008
sacraments,S AE1 K R AH0 M AH0 N T S,1181483,248794,327,1520,2008
sacred,S EY1 K R AH0 D,14164344,1896588,404,1505,2008
sacredness,S EY1 K R IH0 D N IH0 S,409259,235653,289,1582,2008
sacrifice,S AE1 K R AH0 F AY2 S,12283519,2142097,396,1515,2008
sacrificed,S AE1 K R AH0 F AY2 S T,2991392,1288429,370,1515,2008
sacrifices,S AE1 K R AH0 F AY2 S IH0 Z,3957846,1164536,371,1507,2008
sacrificial,S AE2 K R AH0 F IH1 SH AH0 L,1309854,393123,261,1590,2008
sacrificing,S AE1 K R AH0 F AY2 S IH0 NG,1393208,856074,354,1515,2008
sacrilege,S AE1 K R AH0 L AH0 JH,412092,252049,318,1563,2008
sacrilegious,S AE2 K R AH0 L EH1 JH IH0 S,262178,177821,347,1563,2008
sacrosanct,S AE1 K R OW0 S AE0 NG K T,226228,176261,214,1582,2008
sacs,S AE1 K S,482978,123796,258,1677,2008
sad,S AE1 D,9477847,2086596,394,1515,2008
sada,S AA1 D AH0,16430,6704,191,1729,2008
sadaka,S AH0 D AA1 K AH0,1630,704,91,1845,2008
sadao,S AH0 D AW1,216,78,34,1935,2008
sadat,S AA0 D AA1 T,1380,610,71,1843,2008
saddam,S AA1 D AH0 M,884,431,50,1923,2008
sadden,S AE1 D AH0 N,60645,53404,309,1630,2008
saddened,S AE1 D AH0 N D,457997,329287,254,1713,2008
saddening,S AE1 D AH0 N IH0 NG,69997,60838,242,1637,2008
saddens,S AE1 D AH0 N Z,48513,43491,261,1677,2008
sadder,S AE1 D ER0,247582,197136,308,1581,2008
saddest,S AE1 D AH0 S T,316476,248470,330,1587,2008
saddle,S AE1 D AH0 L,3528057,793102,337,1572,2008
saddlebag,S AE1 D AH0 L B AE2 G,46185,23447,169,1806,2008
saddlebags,S AE1 D AH0 L B AE2 G Z,98406,44678,210,1590,2008
saddled,S AE1 D AH0 L D,553247,353785,294,1632,2008
saddler,S AE1 D AH0 L ER0,63789,39709,235,1572,2008
saddles,S AE1 D AH0 L Z,543497,241246,304,1590,2008
saddling,S AE1 D AH0 L IH0 NG,73118,57966,245,1656,2008
sadeh,S AA1 D EH2,1050,604,96,1727,2008
sadek,S AE1 D IH0 K,86,65,39,1821,2008
sader,S EY1 D ER0,999,893,176,1702,2008
sadie,S AE1 D IY0,1114,463,81,1796,2008
sadira,S AA0 D IH1 R AH0,62,47,24,1658,2008
sadism,S EY1 D IH0 Z AH0 M,265348,111750,130,1798,2008
sadist,S EY1 D AH0 S T,86983,53135,120,1789,2008
sadistic,S AH0 D IH1 S T IH0 K,488082,211999,138,1581,2008
sadler,S AE1 D L ER0,3100,2425,239,1740,2008
sadlier,S AE1 D L IY0 ER0,215,184,82,1817,2008
sadly,S AE1 D L IY0,2568273,1153130,367,1505,2008
sadness,S AE1 D N AH0 S,2687697,999624,345,1579,2008
sado,S EY1 D OW0,55756,27297,154,1673,2008
saeed,S AA0 IY1 D,203,125,61,1815,2008
saemaul,S EY1 M AO0 L,343,142,31,1974,2008
saenger,S EH1 N JH ER0,116,82,39,1924,2008
saenz,S IY1 N Z,130,89,37,1918,2008
saez,S IY1 Z,158,114,41,1799,2008
safari,S AH0 F AA1 R IY0,227370,80539,182,1655,2008
safaris,S AH0 F AA1 R IY0 Z,48197,20471,161,1687,2008
safe,S EY1 F,19955222,3151529,406,1505,2008
safeguard,S EY1 F G AA2 R D,2159469,939369,339,1515,2008
safeguarded,S EY1 F G AA2 R D IH0 D,415496,266745,180,1515,2008
safeguarding,S EY1 F G AA2 R D IH0 NG,637379,346744,174,1515,2008
safeguards,S EY1 F G AA2 R D Z,1457415,525134,272,1515,2008
safehouse,S EY1 F HH AW2 S,9919,3158,49,1890,2008
safekeeping,S EY1 F K IY1 P IH0 NG,187789,128904,208,1637,2008
safely,S EY1 F L IY0,6698699,2204339,400,1507,2008
safer,S EY1 F ER0,2310188,1174021,369,1507,2008
safes,S EY1 F S,116612,63701,276,1592,2008
safest,S EY1 F AH0 S T,868545,584316,367,1575,2008
safeties,S EY1 F T IY0 Z,21374,12051,268,1619,2008
safety,S EY1 F T IY0,20971940,2718036,396,1507,2008
safeway,S EY1 F W EY2,266,189,43,1885,2008
saffer,S AE1 F ER0,343,270,123,1693,2008
saffir,S AH0 F IY1 R,72,46,28,1873,2008
saffle,S AE1 F AH0 L,47,42,35,1681,2008
safflower,S AE1 F L AW2 ER0,92149,28281,213,1728,2008
safford,S AE1 F ER0 D,132,96,52,1795,2008
saffran,S AE1 F R AH0 N,483,349,100,1754,2008
saffron,S AE1 F R AH0 N,406756,181654,293,1507,2008
safier,S AH0 F IH1 R,50,44,28,1726,2008
safing,S EY1 F IH0 NG,2803,1136,96,1752,2008
safir,S AE1 F ER0,771,424,86,1793,2008
safire,S AH0 F AY1 R,195,138,43,1843,2008
safley,S AE1 F L IY0,73,60,35,1797,2007
safra,S AE1 F R AH0,1814,939,122,1778,2008
safran,S AE1 F R AH0 N,2044,1307,145,1777,2008
sag,S AE1 G,341524,176196,306,1582,2008
saga,S AA1 G AH0,776573,288524,261,1587,2008
sagan,S EY1 G AH0 N,2468,1238,162,1768,2008
sagar,S AA0 G AA1 R,5089,2991,197,1713,2008
sagas,S AA1 G AH0 Z,250773,90710,234,1701,2008
sage,S EY1 JH,2090791,694731,372,1572,2008
sagebrush,S EY1 JH B R AH2 SH,193061,54817,149,1840,2008
sagen,S AE1 G AH0 N,131169,34956,205,1520,2008
sager,S EY1 G ER0,6059,4226,220,1751,2008
sagers,S EY1 G ER0 Z,283,97,54,1783,2008
sages,S EY1 JH IH0 Z,1110706,338265,342,1524,2008
sagged,S AE1 G D,265642,165753,182,1750,2008
sagging,S AE1 G IH0 NG,440653,278369,204,1620,2008
saginaw,S AE1 G IH0 N AO2,129,103,53,1839,2008
sagittal,S AE1 JH AH0 T AH0 L,568624,61754,250,1657,2008
sago,S EY1 G OW0,202252,51083,267,1656,2008
sags,S AE1 G Z,74272,50135,209,1581,2008
saguaro,S AH0 G W AO1 R OW0,43188,13019,110,1869,2008
saguenay,S AE1 G AH0 N EY0,109,55,30,1866,2008
saha,S AA1 HH AH0,16501,6516,195,1658,2008
sahagun,S AE1 HH AH0 G AH0 N,123,61,33,1841,2008
sahara,S AH0 HH EH1 R AH0,2072,1332,118,1779,2008
saharan,S AE1 HH ER0 AH0 N,4977,3161,62,1845,2008
sahl,S AA1 L,2107,1505,167,1775,2008
sahli,S AA1 L IY0,62,51,34,1817,2007
sahm,S AE1 M,1743,913,105,1733,2008
sahr,S AE1 R,1746,1092,106,1807,2008
sai,S AY1,92570,44542,327,1507,2008
saia,S AA1 Y AH0,6478,5212,253,1650,2008
said,S EH1 D,375989973,4076560,419,1505,2008
saidan,S EY1 D AH0 N,142,97,45,1825,2008
saif,S AA2 IY1 F,2731,1747,217,1714,2008
saigon,S AY2 G AA1 N,3956,512,79,1754,2008
saiki,S EY1 K IY0,585,269,57,1804,2008
sail,S EY1 L,5927167,1138569,377,1507,2008
sailboat,S EY1 L B OW2 T,203051,94649,177,1590,2008
sailboats,S EY1 L B OW2 T S,113242,63072,169,1811,2008
sailed,S EY1 L D,4965400,1004117,374,1507,2008
sailer,S EY1 L ER0,39619,23718,296,1598,2008
sailfish,S EY1 L F IH2 SH,29014,9959,114,1817,2008
sailing,S EY1 L IH0 NG,3923999,1069936,367,1507,2008
sailor,S EY1 L ER0,2256193,699080,314,1524,2008
"sailor's",S EY1 L ER0 Z,189,169,73,1843,2008
sailors,S EY1 L ER0 Z,3486955,868436,321,1507,2008
"sailors'",S EY1 L ER0 Z,46,46,23,1875,2008
sails,S EY1 L Z,2241175,684642,353,1507,2008
sain,S EY1 N,28422,20366,330,1643,2008
saine,S EY1 N,15564,11631,264,1524,2008
sainsbury,S EY1 N S B EH0 R IY0,231,156,52,1853,2007
saint,S EY1 N T,3892140,933779,357,1505,2008
"saint's",S EY1 N T S,1333,1095,177,1520,2008
sainted,S EY1 N T IH0 D,148309,100053,308,1592,2008
sainthood,S EY1 N T HH UH2 D,104488,63833,205,1590,2008
saintly,S EY1 N T L IY0,629281,325275,301,1524,2008
saints,S EY1 N T S,5016563,899475,350,1520,2008
"saints'",S EY1 N T S,739,676,158,1797,2008
sainz,S EY1 N Z,1097,565,126,1780,2008
saipan,S EY1 P AH0 N,125,97,39,1907,2008
sais,S EY1 Z,150650,64502,271,1592,2008
saison,S EY1 S AA0 N,37950,17948,246,1725,2008
saitama,S AA2 IH0 T AA1 M AH0,205,112,39,1933,2008
saito,S EY1 T OW2,892,462,76,1659,2008
saitta,S EY1 T AH0,68,44,30,1815,2008
saiz,S EY1 Z,1394,314,80,1809,2008
sajak,S AE1 JH AE0 K,2842,315,47,1889,2008
sak,S AE1 K,22588,12131,282,1603,2008
sakaguchi,S AA0 K AA0 G UW1 CH IY0,67,58,30,1952,2006
sakai,S AA0 K AA1 IY0,1456,788,86,1850,2008
sakal,S EY1 K AH0 L,1856,972,118,1832,2008
sakamoto,S AA0 K AA0 M OW1 T OW0,175,94,41,1949,2008
sakata,S AA0 K AA1 T AH0,798,509,78,1825,2008
sakau,S AA0 K AA1 UW0,2016,362,50,1909,2008
sake,S EY1 K,13404072,2662008,405,1505,2008
saker,S EY1 K ER0,8824,3977,210,1588,2008
sakes,S EY1 K S,346828,227909,328,1579,2008
sakharov,S AA1 K ER0 AA0 V,455,130,41,1951,2008
saki,S AA1 K IY0,24779,10913,228,1683,2008
sakigake,S AA2 K IY0 G AA1 K IY0,172,93,33,1905,2008
sakina,S AH0 K IY1 N AH0,635,343,57,1828,2008
sako,S AA1 K OW0,3154,2075,198,1747,2008
saks,S AE1 K S,1568,1238,188,1673,2008
saksa,S AE1 K S AH0,553,242,51,1858,2008
sakuma,S AA0 K UW1 M AH0,127,73,32,1888,2008
sakura,S AE0 K UH1 R AH0,6661,2725,129,1802,2008
sakurai,S AA0 K UH0 R AA1 IY0,150,111,54,1920,2007
sal,S AE1 L,373462,161282,361,1575,2008
sala,S AA1 L AH0,111025,35143,236,1740,2008
salaam,S AH0 L AA1 M,47147,25590,205,1664,2008
salable,S EY1 L AH0 B AH0 L,146529,87779,209,1670,2008
salables,S EY1 L AH0 B AH0 L Z,149,91,51,1851,2008
salacious,S AH0 L EY1 SH AH0 S,85393,64211,280,1693,2008
salad,S AE1 L AH0 D,2089139,472836,253,1563,2008
salada,S AH0 L AA1 D AH0,2977,1779,150,1811,2008
saladin,S AE1 L AH0 D IH0 N,729,306,104,1761,2008
salads,S AE1 L AH0 D Z,529027,161609,245,1728,2008
salah,S AE1 L AH0,15742,3920,151,1804,2008
salak,S AE1 L AH0 K,2373,777,96,1811,2008
salam,S AA0 L AA1 M,27607,10313,223,1772,2008
salama,S AA0 L AA1 M AH0,1836,1155,120,1803,2008
salamanca,S AE2 L AH0 M AE1 NG K AH0,381,270,103,1774,2008
salamander,S AE2 L AH0 M AE1 N D ER0,195225,65994,251,1678,2008
salamanders,S AE2 L AH0 M AE1 N D ER0 Z,170863,52376,231,1658,2008
salameh,S AA1 L AA0 M EH0,105,89,36,1865,2008
salami,S AH0 L AA1 M IY0,108758,57548,171,1747,2008
salamis,S AH0 L AA1 M IY0 Z,7327,5256,115,1753,2008
salamon,S AE1 L AH0 M AH0 N,245,155,59,1825,2008
salant,S AE1 L AH0 N T,302,147,59,1801,2008
salaried,S AE1 L ER0 IY0 D,666753,283871,231,1515,2008
salaries,S AE1 L ER0 IY0 Z,4343358,930083,305,1515,2008
salary,S AE1 L ER0 IY0,7418365,1325571,328,1515,2008
salarymen,S AE1 L ER0 IY0 M AH0 N,7258,2667,66,1809,2008
salas,S AA1 L AA0 Z,11177,5325,188,1762,2008
salata,S AA0 L AA1 T AH0,3460,1631,104,1767,2008
salay,S AE1 L EY0,308,177,63,1851,2008
salazar,S AE1 L AH0 Z AA0 R,541,288,73,1844,2008
salce,S EY1 L S,779,635,203,1706,2008
salcedo,S AA0 L CH EY1 D OW0,112,81,40,1824,2008
sale,S EY1 L,20581237,2139197,391,1515,2008
saleable,S EY1 L AH0 B AH0 L,181864,118387,305,1524,2008
saleem,S AE1 L IY0 M,624,64,28,1830,2008
saleh,S AA1 L EH0 HH,1084,593,94,1753,2008
salek,S AA1 L EH0 K,359,118,58,1768,2008
salem,S EY1 L AH0 M,18138,13824,327,1629,2008
salema,S AH0 L IY1 M AH0,407,171,60,1805,2008
salemme,S AE1 L IH0 M,65,63,41,1656,2008
salerno,S AH0 L EH1 R N OW0,259,177,58,1760,2008
sales,S EY1 L Z,23330629,1549954,331,1515,2008
salesman,S EY1 L Z M AH0 N,1742439,461264,243,1600,2008
salesmanship,S EY1 L Z M AH0 N SH IH2 P,207298,94032,133,1688,2008
salesmen,S EY1 L Z M IH0 N,1030032,273868,237,1600,2008
salespeople,S EY1 L Z P IY2 P AH0 L,597753,97965,129,1836,2008
salesperson,S EY1 L Z P ER2 S AH0 N,741123,111204,109,1813,2008
saleswoman,S EY1 L Z W UH2 M AH0 N,69447,39735,183,1771,2008
saleswomen,S EY1 L Z W IH2 M AH0 N,35997,19951,173,1804,2008
salgado,S AA0 L G AA1 D OW0,428,304,67,1823,2008
saliba,S AA0 L IY1 B AH0,78,60,30,1878,2008
salick,S AE1 L IH0 K,76,74,27,1766,2008
salient,S EY1 L IY0 AH0 N T,2097710,797657,278,1620,2008
salif,S AH0 L IY1 F,133,103,57,1806,2008
salim,S AE1 L IH0 M,2400,1193,138,1794,2008
salin,S AA0 L IY1 N,3259,1837,200,1715,2008
salina,S AH0 L IY1 N AH0,36839,9692,229,1707,2008
salinas,S AH0 L IY1 N AH0 S,11083,3952,203,1693,2008
saline,S AH0 L IY1 N,2230092,296020,318,1515,2008
saling,S EY1 L IH0 NG,3941,1536,116,1759,2008
salinger,S EY1 L IH0 NG ER0,217,159,51,1825,2008
salinity,S AH0 L IH1 N AH0 T IY0,1130086,101803,159,1766,2008
salis,S AA1 L IH0 S,16779,12788,270,1672,2008
salisbury,S AE1 L Z B ER0 IY0,1024,720,132,1761,2008
saliva,S AH0 L AY1 V AH0,1287850,310764,285,1658,2008
salivate,S AE1 L AH0 V EY2 T,45576,29121,255,1682,2008
salivated,S AE1 L AH0 V EY2 T AH0 D,19900,15113,265,1707,2008
salivating,S AE1 L AH0 V EY2 T IH0 NG,37528,30525,241,1682,2008
salk,S AO1 K,821,683,162,1710,2008
sall,S AO1 L,99237,11344,338,1593,2008
sallade,S AE1 L EY2 D,322,268,107,1730,2008
sallas,S AA1 L AA0 Z,86,71,43,1814,2008
salle,S EY1 L,89809,37261,253,1572,2008
sallee,S AE1 L IY0,308,212,90,1767,2008
salleh,S AA1 L EH0,81,56,32,1868,2008
saller,S AO1 L ER0,295,188,88,1778,2008
salles,S AA1 L EH0 S,17529,8104,207,1642,2008
salley,S AE1 L IY0,1349,836,167,1668,2008
sallie,S AE1 L IY0,716,542,157,1640,2008
sallies,S AE1 L IY0 Z,236114,155876,330,1563,2008
salling,S AO1 L IH0 NG,5374,1830,254,1593,2008
sallis,S AE1 L IH0 S,218,120,55,1749,2008
salls,S AO1 L Z,4808,1894,285,1642,2008
sally,S AE1 L IY0,364816,213864,348,1563,2008
salm,S AA1 M,3137,1876,217,1720,2008
salman,S AE1 M AH0 N,598,406,107,1815,2008
salmans,S AE1 M AH0 N Z,109,103,61,1807,2008
salmen,S AE0 L M EH1 N,345,207,61,1833,2008
salmi,S AA1 L M IY0,6291,3726,216,1631,2008
salmon,S AE1 M AH0 N,2907630,468887,280,1584,2008
salmond,S AE1 L M AH0 N D,2090,766,198,1749,2008
salmonella,S AE2 L M AH0 N EH1 L AH0,84168,29932,93,1854,2008
salmons,S AE1 M AH0 N Z,14789,8660,245,1618,2008
salo,S AA1 L OW0,7439,4940,225,1637,2008
saloma,S AA0 L OW1 M AH0,133,91,42,1845,2008
salome,S AH0 L OW1 M IY0,1282,414,97,1813,2008
salomon,S AE1 L AH0 M AH0 N,314,215,62,1844,2008
salomone,S AA0 L OW0 M OW1 N IY0,82,43,29,1911,2008
salon,S AH0 L AA1 N,986131,291851,245,1692,2008
salone,S AH0 L OW1 N,8240,2853,164,1725,2008
salons,S AH0 L AA1 N Z,367320,168747,223,1679,2008
saloon,S AH0 L UW1 N,1312741,343148,260,1563,2008
saloons,S AH0 L UW1 N Z,499686,188934,241,1739,2008
salow,S AE1 L OW0,87,62,36,1811,2008
salpetriere,S AE1 L P EH0 T R IY0 EH2 R,118,95,43,1763,2007
salsa,S AO1 L S AH0,228737,55506,255,1658,2008
salsbury,S AE1 L Z B ER0 IY0,59,42,26,1864,2006
salt,S AO1 L T,16517989,1888792,388,1515,2008
saltarelli,S AO0 L T AA0 R EH1 L IY0,348,206,69,1805,2008
saltbox,S AO1 L T B AA2 K S,11270,6114,147,1807,2008
salted,S AO1 L T AH0 D,719360,301776,335,1584,2008
salter,S AO1 L T ER0,9913,5659,244,1725,2008
salters,S AO1 L T ER0 Z,7877,4209,218,1584,2008
saltier,S AO1 L T IY0 ER0,24558,16128,238,1701,2008
salting,S AO1 L T IH0 NG,187532,89866,302,1629,2008
saltlike,S AO1 L T L AY2 K,2829,1699,118,1844,2008
saltmarsh,S AO1 L T M AA2 R SH,24780,6779,187,1748,2008
salton,S AO1 L T AH0 N,560,279,69,1811,2008
salts,S AO1 L T S,4630933,487351,318,1629,2008
saltwater,S AO2 L T W AA1 T ER0,225314,87904,250,1590,2008
salty,S AO1 L T IY0,574289,306795,237,1524,2008
saltz,S AE1 L T S,268,208,76,1824,2008
saltzman,S AO1 L T S M AH0 N,153,104,39,1953,2008
salus,S AE1 L IH0 S,41712,26074,308,1581,2008
salutary,S AE1 L Y AH0 T EH2 R IY0,1145081,555964,330,1515,2008
salutatorian,S AH0 L UW2 T AH0 T AO1 R IY0 AH0 N,7896,6007,138,1845,2008
salute,S AH0 L UW1 T,1512524,671598,381,1524,2008
saluted,S AH0 L UW1 T AH0 D,892093,419064,374,1524,2008
salutes,S AH0 L UW1 T S,257755,173399,332,1575,2008
saluting,S AH0 L UW1 T IH0 NG,268824,190429,332,1568,2008
salva,S AA1 L V AH0,42867,27198,314,1581,2008
salvador,S AE1 L V AH0 D AO2 R,2222,1182,113,1799,2008
salvadoran,S AE1 L V AH0 D AO2 R AH0 N,117,66,21,1980,2008
salvadore,S AA0 L V AA0 D AO1 R EY0,61,54,30,1824,2008
salvage,S AE1 L V AH0 JH,1339026,428092,294,1524,2008
salvageable,S AE1 L V IH0 JH AH0 B AH0 L,38578,30502,91,1864,2008
salvaged,S AE1 L V IH0 JH D,329731,221131,137,1600,2008
salvager,S AE1 L V IH0 JH ER0,2508,1660,98,1797,2008
salvagers,S AE1 L V IH0 JH ER0 Z,5111,3059,115,1802,2008
salvaggio,S AA0 L V AA1 JH IY0 OW0,68,53,31,1823,2007
salvaging,S AE1 L V IH0 JH IH0 NG,122089,94759,120,1600,2008
salvas,S AA1 L V AA0 Z,1682,1417,194,1767,2008
salvati,S AA0 L V AA1 T IY0,2049,1213,187,1683,2008
salvation,S AE0 L V EY1 SH AH0 N,8459958,1204852,383,1520,2008
salvato,S AA0 L V AA1 T OW0,1528,972,134,1795,2008
salvatore,S AE0 L V AH0 T AO1 R IY0,1589,1095,171,1718,2008
salvatori,S AA0 L V AA0 T AO1 R IY0,617,389,126,1721,2008
salve,S AA1 V,250245,163664,350,1579,2008
salves,S AA1 V Z,58557,41741,284,1587,2008
salvi,S AA1 L V IY0,5004,3642,229,1715,2008
salvia,S AE1 L V IY0 AH0,22989,11853,218,1704,2008
salvino,S AE0 L V IY1 N OW0,67,66,39,1840,2008
salvo,S AE1 L V OW0,210938,119626,327,1524,2008
salvos,S AE1 L V OW0 Z,74144,49695,284,1637,2008
salway,S AE1 L W EY0,74,49,28,1826,2008
salz,S AO1 L Z,1144,892,155,1803,2008
salzberg,S AO1 L Z B ER0 G,86,71,33,1938,2008
salzburg,S AO1 L Z B ER0 G,446,240,69,1821,2008
salzman,S AO1 L Z M AH0 N,224,183,54,1934,2008
salzmann,S AO1 L Z M AH0 N,65,52,27,1867,2007
sam,S AE1 M,158367,74010,332,1579,2008
sama,S AA1 M AH0,93880,26443,290,1681,2008
samaha,S AE1 M AH0 HH AH0,343,139,43,1897,2008
samano,S AA0 M AA1 N OW0,1266,570,93,1837,2008
samantha,S AH0 M AE1 N TH AH0,667,293,46,1884,2008
samar,S AE1 M AA0 R,2290,1178,121,1682,2008
samara,S AE1 M ER0 AH0,10273,4287,202,1638,2008
samaras,S AE1 M ER0 AH0 Z,6154,2232,162,1820,2008
samaria,S EY2 M ER0 IY1 AH0,1174,482,125,1753,2008
samarin,S AA0 M AA1 R IY0 N,232,62,33,1881,2007
samaritan,S AH0 M EH1 R IH0 T AH0 N,6264,2531,142,1753,2008
samaritans,S AH0 M EH1 R IH0 T AH0 N Z,1634,872,84,1753,2008
samarkand,S AE1 M AA0 R K AE2 N D,58,45,30,1854,2008
samba,S AA1 M B AH0,90336,21818,167,1638,2008
sambo,S AE1 M B OW0,7205,3751,180,1684,2008
sambre,S AE1 M B R AH0,284,211,79,1795,2008
sambuca,S AE2 M B Y UW1 K AH0,3811,1977,180,1779,2008
same,S EY1 M,308759753,4443479,423,1505,2008
sameer,S AA2 M IH1 R,60,47,18,1930,2008
samek,S AE1 M IH0 K,1150,464,83,1815,2008
samelson,S AE1 M IH0 L S AH0 N,63,61,13,1962,1987
sameness,S EY1 M N AH0 S,620698,305691,305,1581,2008
sames,S EY1 M Z,4944,3023,236,1684,2008
samet,S AE1 M IH0 T,1125,863,188,1689,2008
sami,S AE1 M IY0,12568,6730,261,1665,2008
samina,S AH0 M IH1 N AH0,208,162,74,1782,2008
samir,S AH0 M IH1 R,625,350,68,1750,2008
sammet,S AE1 M IH0 T,284,223,80,1841,2008
sammie,S AE1 M IY0,188,72,27,1855,2008
sammon,S AE1 M AH0 N,1000,574,133,1773,2008
sammons,S AE1 M AH0 N Z,270,216,90,1678,2008
sammy,S AE1 M IY0,2678,1027,113,1723,2008
samoa,S AH0 M OW1 AH0,1126,504,102,1817,2008
samoan,S AH0 M OW1 AH0 N,238,181,66,1851,2008
samons,S AA1 M OW0 N Z,81,74,44,1734,2008
samora,S AA0 M AO1 R AH0,103,74,43,1885,2008
samos,S EY1 M AA0 S,736,376,110,1678,2008
samp,S AE1 M P,22887,15532,299,1638,2008
sampan,S AE1 M P AE0 N,58573,18243,191,1779,2008
sampans,S AE1 M P AE0 N Z,47814,19314,202,1581,2008
samper,S AE1 M P ER0,84,69,39,1809,2008
sample,S AE1 M P AH0 L,28648548,1823874,322,1524,2008
sampled,S AE1 M P AH0 L D,1555055,414067,208,1630,2008
sampler,S AE1 M P L ER0,344098,83710,248,1645,2008
samplers,S AE1 M P L ER0 Z,141219,40814,225,1678,2008
samples,S AE1 M P AH0 L Z,14103893,1265496,293,1581,2008
sampling,S AE1 M P L IH0 NG,6718038,785174,199,1515,2008
samplings,S AE1 M P L IH0 NG Z,67213,42416,142,1760,2008
sampson,S AE1 M P S AH0 N,2080,1172,144,1725,2008
samra,S AE1 M R AH0,325,246,69,1845,2008
sams,S AE1 M Z,7968,5653,280,1673,2008
samsara,S AH0 M S AA1 R AH0,130508,20834,127,1857,2008
samson,S AE1 M S AH0 N,4640,2022,161,1807,2008
samsonite,S AE1 M S AH0 N AY2 T,246,174,48,1911,2008
samsung,S AE1 M S AH2 NG,74,55,15,1983,2008
samuel,S AE1 M Y UW0 L,16450,7938,208,1734,2008
samuels,S AE1 M Y UW0 AH0 L Z,662,271,64,1874,2008
samuelson,S AE1 M Y UW0 AH0 L S AH0 N,2028,326,57,1861,2008
samurai,S AE1 M UH0 R AY2,526145,61011,143,1814,2008
samurais,S AE1 M ER0 AY2 Z,4931,2468,115,1874,2008
san,S AE1 N,520228,122608,334,1541,2008
sana,S AA1 N AH0,61651,38504,288,1581,2008
sanaa,S AH0 N AA1,1058,574,92,1768,2008
sanada,S AA0 N AA1 D AH0,199,133,55,1854,2008
sanborn,S AE1 N B AO2 R N,298,194,73,1856,2008
sanches,S AA1 N CH EH0 S,79,56,34,1904,2008
sanchez,S AE1 N CH EH0 Z,1161,682,70,1906,2008
sancho,S AA1 N K OW0,2648,579,125,1698,2008
sancia,S AA1 N CH AH0,201,178,111,1631,2008
sanctification,S AE2 NG K T AH0 F AH0 K EY1 SH AH0 N,603991,153084,316,1579,2008
sanctify,S AE1 NG K T AH0 F AY0,326422,167479,334,1607,2008
sanctimonious,S AE2 NG K T AH0 M OW1 N IY0 AH0 S,120115,98443,269,1638,2008
sanctimony,S AE1 NG K T IH0 M OW2 N IY0,13507,11475,227,1676,2008
sanction,S AE1 NG K SH AH0 N,3798127,1059670,342,1515,2008
sanctioned,S AE1 NG K SH AH0 N D,2177736,874219,284,1520,2008
sanctioning,S AE1 NG K SH AH0 N IH0 NG,316456,192399,232,1572,2008
sanctions,S AE1 NG K SH AH0 N Z,3291815,660934,308,1515,2008
sanctity,S AE1 NG K T IH0 T IY0,1506004,635905,349,1524,2008
sanctuaries,S AE1 NG K CH UW0 EH2 R IY0 Z,484109,195432,277,1563,2008
sanctuary,S AE1 NG K CH UW0 EH2 R IY0,2718089,780636,344,1524,2008
sanctum,S AE1 NG K T AH0 M,291035,165295,300,1581,2008
sand,S AE1 N D,14682030,1872437,390,1563,2008
sanda,S AE1 N D AH0,3023,1721,198,1742,2008
sandage,S AE1 N D IH0 JH,60,52,29,1893,2005
sandal,S AE1 N D AH0 L,253648,122544,266,1590,2008
sandall,S AE1 N D AA0 L,189,153,79,1808,2008
sandalo,S AE2 N D AE1 L OW0,656,372,92,1720,2008
sandals,S AE1 N D AH0 L Z,776768,364655,286,1582,2008
sandbag,S AE1 N D B AE2 G,55772,31561,184,1783,2008
sandbagged,S AE1 N D B AE2 G D,26423,18846,125,1861,2008
sandbagger,S AE1 N D B AE2 G ER0,1049,694,89,1891,2008
sandbaggers,S AE1 N D B AE2 G ER0 Z,1091,659,94,1891,2008
sandbagging,S AE1 N D B AE2 G IH0 NG,9405,6835,115,1890,2008
sandbags,S AE1 N D B AE2 G Z,129853,63245,204,1713,2008
sandbar,S AE1 N D B AA2 R,85581,42596,190,1803,2008
sandberg,S AE1 N D B ER0 G,336,221,55,1822,2008
sandblast,S AE1 N D B L AE2 S T,9304,6040,138,1851,2008
sandblasted,S AE1 N D B L AE2 S T IH0 D,25172,15159,105,1854,2008
sandbox,S AE1 N D B AA2 K S,97878,46907,170,1805,2008
sandburg,S AE1 N D B ER0 G,639,325,74,1916,2008
sande,S AE1 N D,5438,2816,214,1568,2008
sanded,S AE1 N D IH0 D,158309,89415,276,1659,2008
sandel,S AE1 N D EH0 L,429,273,93,1684,2008
sandell,S AE1 N D EH0 L,138,81,40,1756,2008
sanden,S AE1 N D AH0 N,866,410,93,1724,2008
sander,S AE1 N D ER0,68364,16434,236,1656,2008
sanders,S AE1 N D ER0 Z,28827,11368,239,1588,2008
sanderson,S AE1 N D ER0 S AH0 N,304,204,76,1828,2008
sandford,S AE1 N D F ER0 D,643,347,96,1758,2008
sandhill,S AE1 N D HH IH2 L,49674,21565,206,1719,2008
sandhog,S AE1 N D HH AO2 G,1668,891,80,1910,2008
sandhogs,S AE1 N D HH AO2 G Z,2728,1045,89,1893,2008
sandhu,S AE1 N D HH UW0,114,89,36,1950,2008
sandi,S AE1 N D IY0,2225,1137,175,1737,2008
sandia,S AE1 N D IY0 AH0,1507,1182,130,1808,2008
sandie,S AE1 N D IY0,3788,1789,207,1581,2008
sandiford,S AE1 N D IH0 F ER0 D,71,52,28,1896,2008
sandin,S AE1 N D IH2 N,195,182,73,1814,2008
sanding,S AE1 N D IH0 NG,191642,51753,320,1642,2008
sandinista,S AE2 N D IH0 N IH1 S T AH0,3789,808,35,1953,2008
sandinistas,S AE2 N D IH0 N IY1 S T AH0 Z,701,198,35,1947,2008
sandino,S AE0 N D IY1 N OW0,115,75,33,1956,2007
sandler,S AE1 N D L ER0,391,224,51,1821,2008
sandling,S AE1 D L IH0 NG,57,40,29,1854,2008
sandman,S AE1 N D M AE2 N,7135,4943,159,1709,2008
sandness,S AE1 N D N AH0 S,59,49,23,1844,2006
sando,S AE1 N D OW0,1922,986,142,1694,2008
sandon,S AE1 N D AO2 N,161,131,59,1809,2007
