word,pronunication,tf,df,years,year_first,year_recent
segner,S EH1 G N ER0,780,119,49,1858,2007
sego,S IY1 G OW2,4845,2942,168,1721,2008
segovia,S EH0 G OW1 V IY0 AH0,225,168,76,1789,2008
segregate,S EH1 G R AH0 G EY2 T,319513,193166,230,1581,2008
segregated,S EH1 G R AH0 G EY2 T IH0 D,1540236,493913,228,1574,2008
segregating,S EH1 G R IH0 G EY2 T IH0 NG,179374,102675,187,1732,2008
segregation,S EH2 G R AH0 G EY1 SH AH0 N,3254460,535672,216,1515,2008
segregationist,S EH2 G R AH0 G EY1 SH AH0 N IH0 S T,99675,38483,88,1856,2008
segregationists,S EH2 G R AH0 G EY1 SH AH0 N IH0 S T S,58538,20180,102,1515,2008
segreto,S EH0 G R EH1 T OW0,16852,7196,198,1730,2008
segue,S EH1 G,46958,29408,227,1658,2008
seguin,S AH0 G IY1 N,249,178,69,1719,2008
segundo,S EH2 G UH1 N D OW2,79709,21254,227,1524,2008
segur,S EY0 G UH1 R,784,566,129,1799,2008
segura,S EY0 G UH1 R AH0,8354,5196,191,1751,2008
seguros,S EY2 G Y ER1 OW0 Z,10268,4317,175,1584,2008
seher,S EH1 HH ER0,768,415,115,1714,2008
sehr,S EH1 R,438743,56311,214,1707,2008
seib,S IY1 B,871,329,75,1786,2008
seibel,S AY1 B AH0 L,74,44,26,1949,2007
seiber,S AY1 B ER0,51,41,31,1843,2008
seibert,S AY1 B ER0 T,73,60,37,1895,2008
seibu,S AY1 B UW0,149,95,34,1931,2008
seid,S AY1 D,54065,14455,326,1581,2008
seide,S AY1 D,14669,4662,227,1700,2008
seidel,S AY1 D AH0 L,1735,1212,130,1753,2008
seiden,S AY1 D AH0 N,1737,994,184,1611,2008
seidenberg,S AY1 D AH0 N B ER0 G,63,51,27,1960,2008
seider,S AY1 D ER0,133,72,39,1799,2008
seidl,S AY1 D AH0 L,309,158,64,1860,2008
seidler,S AY1 D L ER0,74,60,32,1901,2008
seidman,S AY1 D M AH0 N,336,240,52,1950,2008
seier,S AY1 ER0,549,286,94,1814,2008
seif,S IY1 F,14722,9401,291,1658,2008
seife,S IY1 F,1678,473,169,1587,2008
seifer,S AY1 F ER0,56,42,26,1872,2008
seifert,S AY1 F ER0 T,271,172,54,1894,2008
seige,S IY1 JH,63226,43098,258,1645,2008
seiger,S AY1 G ER0,112,76,46,1884,2008
seigle,S IY1 G AH0 L,3123,1587,175,1778,2008
seigniorage,S IY2 G N IY1 ER0 IH0 JH,58235,9673,188,1739,2008
seiji,S EY1 JH IY0,15973,3903,100,1852,2008
seiki,S EY1 K IY0,4155,1899,74,1827,2008
seiko,S EY1 K OW0,774,447,54,1837,2008
seil,S AY1 L,6783,4269,270,1650,2008
seiler,S AY1 L ER0,402,307,91,1802,2008
seils,S AY1 L Z,585,414,151,1725,2008
seim,S AY1 M,2783,1473,192,1709,2008
sein,S AY1 N,1006151,151879,284,1606,2008
seine,S EY1 N IY0,801321,177858,302,1564,2008
seinfeld,S AY1 N F EH0 L D,111,76,17,1985,2008
seip,S IY1 P,1107,539,151,1713,2008
seis,S IY1 S,65362,21402,279,1524,2008
seiser,S AY1 S ER0,89,60,38,1725,2007
seismic,S AY1 Z M IH0 K,1399044,131148,159,1713,2008
seismological,S AY2 Z M AH0 L AO1 JH AH0 K AH0 L,41082,12578,136,1854,2008
seismologist,S AY2 Z M AA1 L AH0 JH AH0 S T,13145,6674,136,1742,2008
seismologists,S AY2 Z M AA1 L AH0 JH AH0 S T S,25174,9606,135,1862,2008
seismology,S AY2 Z M AA1 L AH0 JH IY0,62306,19281,140,1742,2008
seita,S EY1 T AH0,718,393,103,1731,2008
seiter,S AY1 T ER0,104,82,39,1822,2008
seith,S IY1 TH,9779,3968,257,1620,2008
seither,S AY1 DH ER0,4468,2965,145,1724,2008
seitz,S AY1 T S,492,363,69,1875,2008
seivert,S AY1 V ER0 T,162,64,27,1976,2008
seix,S IY1 K S,103,87,63,1794,2008
seixas,S IY1 K S AH0 S,82,48,31,1912,2008
seiyaku,S EY2 Y AA1 K UW2,157,104,39,1948,2008
seiyu,S IY1 Y UW0,96,49,23,1905,2008
seize,S IY1 Z,3708697,1321749,386,1507,2008
seized,S IY1 Z D,8835897,1772075,390,1507,2008
seizes,S IY1 Z IH0 Z,585397,367861,340,1563,2008
seizing,S IY1 Z IH0 NG,1464877,741633,363,1524,2008
seizure,S IY1 ZH ER0,2940809,661190,334,1515,2008
seizures,S IY1 ZH ER0 Z,2086826,263644,285,1524,2008
sejm,S EY1 M,4323,935,101,1702,2008
seki,S EY1 K IY0,7084,2901,147,1717,2008
seko,S EH1 K OW0,927,487,86,1826,2008
sekula,S IH0 K UW1 L AH0,92,57,29,1885,2008
sel,S EH1 L,164343,88585,351,1568,2008
sela,S EH1 L AH0,13384,5078,200,1695,2008
selander,S EH1 L AH0 N D ER0,107,51,30,1807,2008
selas,S EH1 L AH0 S,2912,910,148,1760,2008
selassie,S AH0 L AE1 S IY0,143,88,34,1938,2008
selbe,S EH1 L B,4571,2538,155,1750,2008
selby,S EH1 L B IY0,474,360,88,1812,2008
selda,S EH1 L D AH0,747,325,109,1779,2008
seldane,S EH1 L D EY2 N,90,73,22,1978,2008
selden,S EH1 L D AH0 N,1420,923,175,1720,2008
seldom,S EH1 L D AH0 M,11418557,2357103,385,1515,2008
seldon,S EH1 L D AH0 N,1984,1821,207,1702,2008
select,S AH0 L EH1 K T,13527642,2343482,377,1524,2008
selected,S AH0 L EH1 K T AH0 D,23855396,3102880,380,1505,2008
selecting,S AH0 L EH1 K T IH0 NG,5075184,1533860,326,1505,2008
selection,S AH0 L EH1 K SH AH0 N,21625914,2592074,310,1515,2008
selections,S AH0 L EH1 K SH AH0 N Z,1913166,678607,253,1575,2008
selective,S AH0 L EH1 K T IH0 V,5223005,1141893,215,1515,2008
selectively,S AH0 L EH1 K T IH0 V L IY0,1214813,499304,170,1600,2008
selectivity,S IH0 L EH2 K T IH1 V AH0 T IY0,1129384,249680,130,1515,2008
selects,S AH0 L EH1 K T S,1350469,627492,290,1581,2008
selena,S AH0 L IY1 N AH0,643,297,72,1849,2008
selene,S AH0 L IY1 N,3955,1918,168,1797,2008
selenite,S EH1 L IH0 N AY2 T,77733,18736,236,1749,2008
selenium,S AH0 L IY1 N IY0 AH0 M,674046,83438,199,1789,2008
seles,S EH1 L EH0 S,1821,1167,174,1631,2008
seley,S IY1 L IY0,169,163,86,1758,2008
self,S EH1 L F,93409838,3787740,410,1515,2008
"self's",S EH1 L F S,51,43,19,1703,2008
selfish,S EH1 L F IH0 SH,3672036,1241866,336,1607,2008
selfishness,S EH1 L F IH0 SH N AH0 S,1671838,673078,305,1607,2008
selfless,S EH1 L F L AH0 S,450780,262426,187,1719,2008
selflessness,S EH1 L F L AH0 S N IH0 S,174739,106870,154,1725,2008
selfridge,S EH1 L F R IH0 JH,80,61,35,1819,2007
selfs,S EH1 L F S,25964,12628,220,1671,2008
selia,S EH1 L IY0 AH0,180,119,59,1788,2008
selie,S EH1 L IY0,323,276,118,1746,2008
selies,S EH1 L IY0 Z,68,67,52,1806,2008
selig,S EH1 L IH0 G,9343,5882,184,1750,2008
seliger,S EH1 L IH0 G ER0,1380,1108,135,1805,2008
seligman,S EH1 L IH0 G M AH0 N,519,365,77,1886,2008
seligmann,S EH1 L IH0 G M AH0 N,122,77,37,1909,2008
selin,S EH1 L IH0 N,455,364,124,1761,2008
selina,S AH0 L IY1 N AH0,682,189,70,1803,2008
seljuk,S EH1 L JH AH0 K,118,68,40,1880,2008
selk,S EH1 L K,537,398,132,1707,2008
selke,S EH1 L K,201,131,75,1778,2008
selkirk,S EH1 L K ER0 K,94,67,41,1795,2008
sell,S EH1 L,17269941,2425440,404,1515,2008
sella,S EH1 L AH0,140371,28576,238,1719,2008
selland,S EH1 L AH0 N D,132,105,58,1800,2008
sellars,S EH1 L ER0 Z,767,571,136,1780,2008
selle,S EH1 L,15076,10250,257,1568,2008
selleck,S EH1 L IH0 K,52,43,25,1907,2007
sellen,S EH1 L AH0 N,865,641,164,1568,2008
seller,S EH1 L ER0,4872610,663545,340,1515,2008
"seller's",S EH1 L ER0 Z,91,85,44,1879,2008
sellers,S EH1 L ER0 Z,1929507,519656,322,1515,2008
sellier,S EH1 L Y ER0,376,282,98,1780,2008
sellin,S EH1 L IH0 N,22645,15632,195,1750,2008
selling,S EH1 L IH0 NG,12070120,1993505,380,1507,2008
sellings,S EH1 L IH0 NG Z,4163,3506,224,1629,2008
selloff,S EH1 L AO2 F,3595,2010,51,1952,2008
selloffs,S EH1 L AO2 F S,1397,724,45,1960,2008
sellon,S EH1 L AH0 N,159,121,63,1773,2008
sellout,S EH1 L AW2 T,56922,40130,220,1581,2008
sellouts,S EH1 L AW2 T S,10914,8432,107,1740,2008
sells,S EH1 L Z,2491616,769733,336,1520,2008
selma,S EH1 L M AH0,1025,404,94,1820,2008
selman,S EH1 L M AH0 N,336,262,85,1806,2008
selmer,S EH1 L M ER0,62,41,21,1858,2008
selner,S EH1 L N ER0,57,44,36,1880,2008
selph,S EH1 L F,87,63,31,1823,2008
seltz,S EH1 L T S,347,293,101,1831,2008
seltzer,S EH1 L T S ER0,43344,26204,202,1713,2008
selva,S EY1 L V AH0,40771,15461,213,1728,2008
selvage,S EH1 L V IH0 JH,57125,15712,227,1702,2008
selvaggio,S EH0 L V AA1 JH IY0 OW0,3570,1944,170,1775,2008
selves,S EH1 L V Z,1987925,742470,387,1515,2008
selvidge,S EH1 L V IH0 JH,213,177,89,1758,2008
selwyn,S EH1 L W IH0 N,477,287,101,1798,2008
selz,S EH1 L Z,437,309,90,1839,2008
selzer,S EH1 L Z ER0,496,326,103,1840,2008
sema,S IY1 M AH0,17367,7085,221,1732,2008
seman,S IY1 M AH0 N,4008,3010,135,1736,2008
semans,S IY1 M AH0 N Z,82,74,51,1781,2008
semantic,S IH0 M AE1 N T IH0 K,3982674,352910,140,1629,2008
semantics,S IH0 M AE1 N T IH0 K S,1684896,216521,123,1706,2008
sember,S EH1 M B ER0,166,137,69,1783,2008
semblance,S EH1 M B L AH0 N S,1196536,724456,346,1515,2008
semel,S EH1 M AH0 L,50869,26107,323,1581,2008
semele,S EH1 M AH0 L IY2,3139,868,144,1749,2008
semen,S IY1 M AH0 N,882451,166695,309,1568,2008
semenza,S EH0 M EH1 N Z AH0,1170,917,137,1584,2008
semester,S AH0 M EH1 S T ER0,1767946,350971,179,1766,2008
semesters,S AH0 M EH1 S T ER0 Z,201581,80313,167,1751,2008
semi,S EH1 M IY0,7395838,1928038,343,1507,2008
semiannual,S EH2 M IY0 AE1 N Y AH0 W AH0 L,176150,71667,207,1600,2008
semiannually,S EH2 M IY0 AE1 N UW0 AH0 L IY0,108770,38769,191,1600,2008
semiautomatic,S EH2 M IY0 AO2 T AH0 M AE1 T IH0 K,95502,46578,119,1829,2008
semicircular,S EH2 M IY0 S ER1 K Y AH0 L ER0,692149,228046,298,1507,2008
semiclad,S EH1 M IY0 K L AE2 D,652,629,58,1874,2008
semiclassical,S EH2 M IY0 K L AE1 S IH0 K AH0 L,54180,11792,129,1839,2008
semicon,S EH1 M IH0 K AA2 N,2126,1722,80,1815,2008
semiconductor,S EH2 M IY0 K AH0 N D AH1 K T ER0,1531012,112733,104,1839,2008
semiconductors,S EH2 M IY0 K AH0 N D AH1 K T ER0 Z,587978,79829,113,1839,2008
semicylindrical,S EH2 M IY0 S AH0 L IH1 N D R IH0 K AH0 L,9604,6635,213,1734,2008
semidry,S EH2 M IY0 D R AY1,7931,4075,115,1859,2008
semidrying,S EH2 M IY0 D R AY1 IH0 NG,2161,1079,106,1895,2008
semien,S EH1 M IY0 N,73,41,27,1940,2008
semifinal,S EH2 M IY0 F AY1 N AH0 L,22391,8816,112,1845,2008
semifinalist,S EH2 M IY0 F AY1 N AH0 L IH0 S T,3196,1945,72,1907,2008
semifinalists,S EH2 M IY0 F AY1 N AH0 L IH0 S T S,5109,2727,70,1918,2008
semifinals,S EH2 M IY0 F AY1 N AH0 L Z,28801,10536,111,1845,2008
semifinish,S EH2 M IY0 F IH1 N IH0 SH,620,334,76,1919,2008
semifinished,S EH2 M IY0 F IH1 N IH0 SH T,45544,22318,111,1807,2008
semigloss,S EH2 M IY0 G L AA1 S,10445,3940,92,1873,2008
semilegendary,S EH2 M IY0 L EH1 JH AH0 N D EH2 R IY0,5122,4244,109,1888,2008
seminal,S EH1 M AH0 N AH0 L,1235960,461983,330,1590,2008
seminar,S EH1 M AH0 N AA2 R,1625119,504404,237,1642,2008
seminara,S EH2 M IH0 N AA1 R AH0,1071,558,56,1751,2008
seminarian,S EH2 M AH0 N EH1 R IY0 AH0 N,45631,22488,148,1746,2008
seminarians,S EH2 M AH0 N EH1 R IY0 AH0 N Z,95912,29518,163,1801,2008
seminaries,S EH1 M AH0 N EH2 R IY0 Z,476427,177260,296,1563,2008
seminario,S EH2 M IH0 N EH1 R IY0 OW0,9709,5095,195,1524,2008
seminars,S EH1 M AH0 N AA2 R Z,1399078,485212,154,1688,2008
seminary,S EH1 M AH0 N EH2 R IY0,1220422,312893,325,1524,2008
seminole,S EH1 M IH0 N OW2 L,996,496,98,1825,2008
seminoles,S EH1 M IH0 N OW2 L Z,186,147,76,1812,2008
semiotic,S EH2 M IY0 AA1 T IH0 K,556675,83586,126,1708,2008
semiotics,S EH2 M IY0 AA1 T IH0 K S,287979,63370,106,1708,2008
semipermanent,S EH2 M IY0 P ER1 M AH0 N AH0 N T,59031,39752,125,1705,2008
semiprecious,S EH2 M IY0 P R EH1 SH AH0 S,44171,27202,124,1824,2008
semireligious,S EH2 M IY0 R IH0 L IH1 JH AH0 S,10307,8808,156,1821,2008
semis,S EH1 M AY0 Z,33019,17459,272,1688,2008
semisecrecy,S EH2 M IY0 S IY1 K R AH0 S IY0,575,535,82,1865,2008
semite,S EH1 M AY0 T,6825,4494,153,1810,2008
semitic,S AH0 M IH1 T IH0 K,49998,24391,144,1805,2008
semitism,S EH1 M IH0 T IH2 Z AH0 M,82648,33816,128,1789,2008
semitrailer,S EH2 M IY0 T R EY1 L ER0,18543,6619,93,1881,2008
semitropical,S EH2 M IY0 T R AA1 P IH0 K AH0 L,37450,27713,162,1847,2008
semler,S EH1 M L ER0,86,52,26,1865,2008
semmel,S EH1 M AH0 L,304,228,85,1805,2008
semmes,S EH1 M Z,219,153,73,1700,2008
semolina,S EH2 M AH0 L IY1 N AH0,44779,17236,189,1784,2008
semon,S EH1 M AH0 N,1089,548,142,1702,2008
semones,S EY0 M OW1 N EH0 S,63,46,26,1838,2008
semple,S EH1 M P AH0 L,2303,1571,190,1767,2008
semtex,S EH1 M T EH0 K S,768,477,26,1939,2008
sen,S EH1 N,895599,337156,370,1515,2008
sena,S EH1 N AH0,19124,11207,276,1658,2008
senate,S EH1 N AH0 T,2142994,310978,320,1563,2008
senator,S EH1 N AH0 T ER0,1930546,413835,306,1563,2008
senatore,S EH0 N AA0 T AO1 R IY0,2108,1246,166,1740,2008
senatorial,S EH2 N AH0 T AO1 R IY0 AH0 L,464317,126067,271,1720,2008
senators,S EH1 N AH0 T ER0 Z,1819665,378136,303,1563,2008
send,S EH1 N D,24434013,3013559,412,1507,2008
sendak,S EH1 N D AE0 K,221,84,38,1936,2008
sender,S EH1 N D ER0,1077904,214758,298,1568,2008
sendero,S EH0 N D EH1 R OW0,4332,2302,97,1814,2008
senders,S EH1 N D ER0 Z,120957,52910,264,1620,2008
sending,S EH1 N D IH0 NG,9131224,2292886,399,1515,2008
sendo,S EH1 N D OW0,22837,4732,215,1524,2008
sends,S EH1 N D Z,4122311,1446460,377,1524,2008
seneca,S EH1 N AH0 K AH0,2823,1694,205,1656,2008
senechal,S EH1 N IH0 K AH0 L,2399,1215,188,1746,2008
senegal,S EH2 N AH0 G AO1 L,7144,1904,163,1742,2008
senegalese,S EH2 N AH0 G AH0 L IY1 Z,367,237,44,1926,2008
senescence,S AH0 N EH1 S AH0 N S,293410,57005,194,1701,2008
senese,S EH1 N IY0 Z,8453,2381,125,1795,2008
seney,S EH1 N IY0,65,54,35,1782,2008
senf,S EH1 N F,1749,1347,211,1702,2008
senff,S EH1 N F,51,47,28,1806,2008
senft,S EH1 N F T,102,69,45,1727,2008
seng,S EH1 NG,25995,8164,236,1611,2008
senger,S EH1 NG ER0,13007,11472,291,1679,2008
sengers,S EH1 NG ER0 Z,10894,10104,277,1641,2008
senile,S IY1 N AY2 L,611202,230177,274,1640,2008
senility,S AH0 N IH1 L AH0 T IY0,203606,125398,232,1762,2008
senior,S IY1 N Y ER0,10048652,1698101,334,1515,2008
seniority,S IY0 N Y AO1 R IH0 T IY0,1150745,342037,306,1524,2008
seniornet,S IY1 N Y ER0 N EH2 T,53,44,15,1992,2008
seniors,S IY1 N Y ER0 Z,1082869,324754,281,1662,2008
senk,S EH1 NG K,558,422,117,1707,2008
senko,S EH1 NG K OW0,1200,685,91,1875,2008
senn,S EH1 N,1651,1211,195,1682,2008
senna,S EH1 N AH0,81031,32267,278,1638,2008
senne,S EH1 N,2117,1360,188,1644,2008
senner,S EH1 N ER0,353,157,73,1781,2008
sennet,S EH1 N AH0 T,3197,2097,187,1733,2008
sennett,S EH1 N IH0 T,327,184,73,1825,2006
senor,S IY2 N Y AO1 R,189353,37826,222,1524,2008
senora,S IY2 N Y AO1 R AH0,77754,19529,208,1763,2008
sens,S EH1 N Z,467682,122496,324,1515,2008
sensation,S EH0 N S EY1 SH AH0 N,7061475,1391053,332,1524,2008
sensational,S EH0 N S EY1 SH AH0 N AH0 L,1192006,552852,222,1572,2008
sensationalism,S EH0 N S EY1 SH AH0 N AH0 L IH2 Z AH0 M,198880,117840,175,1728,2008
sensationalist,S EH0 N S EY1 SH AH0 N AH0 L IH0 S T,66535,44258,169,1752,2008
sensationalistic,S EH0 N S EY2 SH AH0 N AH0 L IH1 S T IH0 K,25429,17574,149,1753,2008
sensationalize,S EH0 N S EY2 SH AH0 N AH0 L AY1 Z,12270,10927,104,1851,2008
sensationalized,S EH0 N S EY2 SH AH0 N AH0 L AY1 Z D,34425,27213,109,1850,2008
sensationalizes,S EH0 N S EY2 SH AH0 N AH0 L AY1 Z IH0 Z,1849,1750,76,1920,2008
sensationalizing,S EH0 N S EY2 SH AH0 N AH0 L AY1 Z IH0 NG,8697,7694,92,1873,2008
sensations,S EH0 N S EY1 SH AH0 N Z,3879472,778023,320,1505,2008
sense,S EH1 N S,96600416,3932232,409,1505,2008
sensed,S EH1 N S T,2328547,827941,307,1629,2008
senseless,S EH1 N S L AH0 S,1134614,660210,352,1563,2008
senses,S EH1 N S IH0 Z,8834361,1871562,382,1505,2008
sensibilities,S EH2 N S IH0 B IH1 L IH0 T IY0 Z,909956,482713,265,1643,2008
sensibility,S EH2 N S IH0 B IH1 L IH0 T IY0,2636599,656143,303,1592,2008
sensible,S EH1 N S AH0 B AH0 L,6490944,1702796,396,1505,2008
sensibly,S EH1 N S AH0 B L IY0,929085,524583,361,1524,2008
sensing,S EH1 N S IH0 NG,1788890,527647,260,1515,2008
sensitive,S EH1 N S AH0 T IH0 V,14736857,2567987,353,1515,2008
sensitively,S EH1 N S IH0 T IH0 V L IY0,263814,187764,215,1587,2008
sensitiveness,S EH1 N S AH0 T IH0 V N AH0 S,611058,265973,228,1572,2008
sensitivities,S EH2 N S IH0 T IH1 V IH0 T IY0 Z,518030,239764,147,1742,2008
sensitivity,S EH2 N S IH0 T IH1 V IH0 T IY0,8423707,1289284,213,1515,2008
sensitize,S EH1 N S AH0 T AY2 Z,126457,80809,157,1656,2008
sensitized,S EH1 N S AH0 T AY2 Z D,530458,167902,156,1802,2008
sensor,S EH1 N S ER0,2372720,168571,240,1631,2008
sensormatic,S EH2 N S ER0 M AE1 T IH0 K,135,70,27,1973,2008
sensors,S EH1 N S ER0 Z,1694899,194320,135,1777,2008
sensory,S EH1 N S ER0 IY0,5969594,535311,274,1505,2008
sensual,S EH1 N SH AH0 W AH0 L,1702963,603775,358,1507,2008
sensuality,S EH2 N SH UW2 AE1 L AH0 T IY2,708561,328436,344,1524,2008
sensuous,S EH1 N SH AH0 W AH0 S,1166635,376305,225,1505,2008
sent,S EH1 N T,60437024,3491352,420,1507,2008
sentence,S EH1 N T AH0 N S,20840291,2210453,402,1515,2008
sentenced,S EH1 N T AH0 N S T,2538572,732250,365,1515,2008
sentences,S EH1 N T AH0 N S AH0 Z,10535468,1483156,381,1505,2008
sentencing,S EH1 N T AH0 N S IH0 NG,964541,158530,284,1658,2008
senter,S EH1 N T ER0,2686,2193,225,1687,2008
senters,S EH1 N T ER0 Z,3066,2702,274,1676,2008
sentiment,S EH1 N T AH0 M AH0 N T,7421541,1563304,348,1515,2008
sentimental,S EH2 N T AH0 M EH1 N T AH0 L,2444436,882577,270,1587,2008
sentimentality,S EH2 N T AH0 M EH0 N T AE1 L IH0 T IY0,594512,315977,231,1574,2008
sentiments,S EH1 N T AH0 M AH0 N T S,6109064,1323459,359,1515,2008
sentinel,S EH1 N T AH0 N AH0 L,556413,249049,279,1575,2008
sentinels,S EH1 N T AH0 N AH0 L Z,375217,199923,286,1563,2008
sentra,S EH1 N T R AH0,681,214,60,1805,2008
sentries,S EH1 N T R IY0 Z,419368,180645,254,1575,2008
sentry,S EH1 N T R IY0,616823,240838,275,1575,2008
senty,S EH1 N T IY0,630,584,148,1682,2008
sentz,S EH1 N T S,49,43,24,1713,2007
seo,S IY1 OW0,61123,28682,263,1652,2008
seoul,S OW1 L,1466,483,77,1844,2008
seow,S IY1 OW0,323,219,96,1759,2008
sep,S EH1 P,68372,38985,287,1581,2008
separate,S EH1 P ER0 EY2 T,36980065,3723554,395,1507,2008
separated,S EH1 P ER0 EY2 T AH0 D,16118764,3046446,392,1507,2008
separately,S EH1 P ER0 AH0 T L IY0,7798184,2200479,360,1515,2008
separateness,S EH1 P ER0 AH0 T N AH0 S,377635,195524,197,1684,2008
separates,S EH1 P ER0 EY2 T S,2427599,1133235,353,1507,2008
separating,S EH1 P ER0 EY2 T IH0 NG,3459916,1538586,366,1507,2008
separation,S EH2 P ER0 EY1 SH AH0 N,14453718,2308554,378,1520,2008
separations,S EH2 P ER0 EY1 SH AH0 N Z,793947,280326,312,1590,2008
separatism,S EH1 P ER0 AH0 T IH2 Z AH0 M,323258,127606,197,1515,2008
separatist,S EH1 P ER0 AH0 T IH0 S T,463410,177006,243,1584,2008
separatists,S EH1 P ER0 AH0 T IH0 S T S,162012,72981,271,1607,2008
sepe,S IY1 P,9037,4627,288,1581,2008
sepeda,S EY0 P EY1 D AH0,619,232,40,1952,2008
sephardic,S AH0 F AA1 R D IH0 K,948,603,70,1913,2008
sephardim,S IH0 F AA1 R D IH0 M,318,195,61,1886,2008
sepia,S IY1 P IY0 AH0,165457,82791,239,1524,2008
sepik,S EH1 P IH0 K,91,68,32,1899,2007
sepp,S EH1 P,276,194,75,1783,2008
seppi,S EH1 P IY0,760,574,113,1731,2008
sepsis,S EH1 P S IH0 S,686629,67178,158,1730,2008
sept,S EH1 P T,200933,70133,329,1524,2008
septa,S EH1 P T AH0,398753,59300,259,1684,2008
september,S EH0 P T EH1 M B ER0,29744,10336,216,1515,2008
septer,S EH1 P T ER0,509,370,120,1769,2008
septic,S EH1 P T IH0 K,868852,142341,255,1682,2008
septima,S EH0 P T IY1 M AH0,7437,4615,263,1681,2008
septimus,S EH1 P T IH0 M IH0 S,2345,1612,219,1681,2008
septuagenarian,S EH0 P CH UW2 AH0 JH AH0 N EH1 R IY0 AH0 N,32551,28457,200,1643,2008
sepulveda,S EY0 P UW0 L V EY1 D AH0,90,68,40,1839,2008
sequa,S EH1 K W AH0,1176,808,191,1681,2008
sequel,S IY1 K W AH0 L,1283102,599060,358,1524,2008
sequels,S IY1 K W AH0 L Z,124551,65984,236,1651,2008
sequence,S IY1 K W AH0 N S,19187540,1929674,345,1541,2008
sequences,S IY1 K W AH0 N S AH0 Z,5848744,737950,323,1541,2008
sequencing,S IY1 K W AH0 N S IH0 NG,946571,200074,100,1777,2008
sequent,S IY1 K W AH0 N T,107733,52187,319,1631,2008
sequential,S AH0 K W EH1 N CH AH0 L,2391251,521409,217,1584,2008
sequentially,S AH0 K W EH1 N CH AH0 L IY0,636559,293588,176,1692,2008
sequester,S IH0 K W EH1 S T ER0,79192,51149,326,1563,2008
sequestered,S IH0 K W EH1 S T ER0 D,403552,239529,305,1563,2008
sequestering,S IH0 K W EH1 S T ER0 IH0 NG,60031,36658,247,1705,2008
sequesters,S IH0 K W EH1 S T ER0 Z,12144,9468,211,1706,2008
sequestration,S EH2 K W AH0 S T R EY1 SH AH0 N,377086,112659,294,1581,2008
sequin,S IY1 K W AH0 N,24465,14884,244,1507,2008
sequined,S IY1 K W AH0 N D,40876,30568,105,1809,2008
sequins,S IY1 K W AH0 N Z,122705,62467,253,1635,2008
sequitur,S EH1 K W IH0 T ER0,161843,83088,317,1581,2008
sequiturs,S EH1 K W IH0 T ER0 Z,23591,19694,169,1800,2008
sequoia,S IH0 K W OY1 AH0,46466,17942,163,1808,2008
sequoias,S IH0 K W OY1 AH0 Z,31718,12794,149,1806,2008
sequoyah,S AH0 K W OY1 AH0,105,51,28,1900,2008
sera,S IH1 R AH0,1259435,181719,328,1590,2008
serafin,S EH1 R AH0 F IH0 N,738,446,79,1818,2008
serafina,S ER0 AA0 F IY1 N AH0,371,73,38,1890,2008
serafini,S ER0 AA0 F IY1 N IY0,166,150,67,1837,2008
serafino,S ER0 AA0 F IY1 N OW0,190,122,58,1805,2008
seraphina,S ER0 AA0 F IY1 N AH0,223,133,63,1847,2008
seraphine,S ER0 AA0 F IY1 N IY0,1660,939,161,1829,2008
seratonin,S ER0 AA0 T OW1 N IH0 N,2640,1756,47,1955,2008
seraw,S ER0 AA1,50,43,27,1820,2008
serb,S ER1 B,957,565,135,1684,2008
serbia,S ER1 B IY0 AH0,494,210,53,1915,2008
serbian,S ER1 B IY0 AH0 N,622,222,60,1875,2008
serbs,S ER1 B Z,925,254,68,1783,2008
serbska,S ER1 B S K AH0,133,74,29,1953,2008
serco,S ER1 K OW0,106,74,49,1819,2008
serda,S EH1 R D AH0,89,65,42,1830,2008
sere,S IH1 R,109104,72867,326,1635,2008
serena,S AH0 R IY1 N AH0,21007,12100,271,1564,2008
serenade,S EH2 R AH0 N EY1 D,141390,87326,271,1590,2008
serenaded,S EH2 R AH0 N EY1 D IH0 D,52718,43988,245,1707,2008
serenading,S EH2 R AH0 N EY1 D IH0 NG,35398,29979,244,1710,2008
serendipitous,S EH2 R AH0 N D IH1 P IH0 T AH0 S,78907,59528,69,1897,2008
serendipity,S EH2 R AH0 N D IH1 P IH0 T IY0,89211,56867,98,1881,2008
serene,S ER0 IY1 N,1518531,740141,362,1507,2008
serenely,S ER0 IY1 N AH0 L IY0,306498,226070,294,1631,2008
serengeti,S EH2 R AH0 N G EH1 T IY0,119,107,33,1909,2008
serenity,S ER0 EH1 N AH0 T IY0,1043245,557157,340,1524,2008
sereno,S EH0 R EY1 N OW0,17060,10312,255,1684,2008
seres,S IY1 R Z,23712,10973,251,1658,2008
serf,S ER1 F,370907,149580,344,1572,2008
serfs,S ER1 F S,769890,231900,274,1660,2008
serge,S ER1 JH,159266,92898,275,1563,2008
sergeant,S AA1 R JH AH0 N T,2376199,491289,276,1563,2008
sergeants,S AA1 R JH AH0 N T S,396908,157289,254,1563,2008
sergei,S ER0 G EY1,591,319,64,1808,2008
sergent,S ER1 JH AH0 N T,7901,4550,201,1668,2008
sergey,S EH1 R JH IY0,215,99,39,1880,2008
sergi,S EH1 R JH IY0,258,156,59,1770,2008
sergio,S ER1 JH Y OW2,1253,299,59,1904,2008
sergius,S ER1 JH Y AH0 S,2894,206,94,1673,2008
seria,S IH1 R IY0 AH0,78890,24794,283,1584,2008
serial,S IH1 R IY2 AH0 L,3199018,650302,288,1600,2008
serialize,S IH1 R IY2 AH0 L AY2 Z,29675,11735,101,1750,2008
serialized,S IH1 R IY2 AH0 L AY2 Z D,166148,69207,157,1703,2008
serials,S IH1 R IY0 AH0 L Z,385334,79165,196,1515,2008
series,S IH1 R IY0 Z,51047171,3710885,389,1505,2008
"series'",S IH1 R IY0 Z,59,56,33,1874,2008
serino,S ER0 IY1 N OW0,134,119,74,1745,2008
serio,S IY1 R IY0 OW0,50419,35133,274,1581,2008
serious,S IH1 R IY0 AH0 S,37779945,3647855,402,1507,2008
seriously,S IH1 R IY0 AH0 S L IY0,13860091,2938953,394,1515,2008
seriousness,S IH1 R IY0 AH0 S N AH0 S,2206996,1056977,347,1515,2008
serle,S ER1 AH0 L,1501,1114,147,1792,2008
serling,S ER1 L IH0 NG,296,174,91,1659,2008
serlo,S EH1 R L OW0,5523,3513,168,1714,2008
sermon,S ER1 M AH0 N,4179942,826432,356,1520,2008
sermons,S ER1 M AH0 N Z,2761637,667865,339,1524,2008
serna,S EH1 R N AH0,344,261,92,1817,2008
serological,S EH0 R AH0 L AO1 JH IH0 K AH0 L,279934,45032,151,1834,2008
serologist,S EH0 R AA1 L AH0 JH IH0 S T,4194,2215,99,1829,2008
serology,S EH0 R AA1 L AH0 JH IY0,109615,30223,107,1820,2008
serono,S EH2 R AA1 N OW0,58,49,29,1849,2008
serotonin,S ER0 AH0 T OW1 N IH0 N,899922,79585,66,1909,2008
serpa,S EH1 R P AH0,374,207,76,1807,2008
serpe,S ER1 P,2068,1487,199,1659,2008
serpent,S ER1 P AH0 N T,2198877,600712,352,1507,2008
"serpent's",S ER1 P AH0 N T S,192,187,78,1744,2008
serpentine,S ER1 P AH0 N T AY2 N,527255,208565,313,1579,2008
serpents,S ER1 P AH0 N T S,723118,309254,331,1507,2008
serr,S EH1 R,2219,1558,248,1672,2008
serra,S EH1 R AH0,25348,9891,266,1631,2008
serrano,S ER0 AA1 N OW0,20392,5880,127,1755,2008
serrao,S EH1 R AW0,113,103,68,1793,2008
serrate,S EH1 R EY2 T,99133,19509,244,1707,2008
serrated,S EH1 R EY2 T IH0 D,322669,142992,267,1657,2008
serrato,S ER0 AA1 T OW0,2785,1617,215,1703,2008
serres,S EH1 R EH0 S,4607,3154,210,1745,2008
serum,S IH1 R AH0 M,7602829,273795,312,1581,2008
serv,S ER1 V,94062,55877,315,1648,2008
servais,S ER0 V EY1,336,294,92,1770,2008
servam,S ER1 V AH0 M,507,421,145,1722,2008
servan,S ER1 V AH0 N,1929,1566,223,1642,2008
servant,S ER1 V AH0 N T,10802127,1743613,398,1507,2008
servants,S ER1 V AH0 N T S,11799638,1803670,393,1507,2008
"servants'",S ER1 V AH0 N T S,1602,1208,187,1794,2008
serve,S ER1 V,32518026,3667847,406,1507,2008
served,S ER1 V D,29430667,3318432,401,1507,2008
server,S ER1 V ER0,7553896,201663,328,1581,2008
servers,S ER1 V ER0 Z,1993723,155281,301,1641,2008
serves,S ER1 V Z,10542620,2468491,382,1505,2008
service,S ER1 V AH0 S,82984129,3568993,402,1515,2008
serviceable,S ER1 V AH0 S AH0 B AH0 L,1109824,564165,370,1520,2008
serviced,S ER1 V IH0 S T,436011,232909,230,1600,2008
serviceman,S ER1 V AH0 S M AE2 N,95521,48314,99,1825,2008
servicemen,S ER1 V AH0 S M EH0 N,449563,168518,127,1515,2008
servicer,S ER1 V IH0 S ER0,29611,5411,195,1717,2008
services,S ER1 V AH0 S AH0 Z,57227964,2888148,387,1507,2008
"services'",S ER1 V IH0 S IH0 Z,137,127,43,1857,2008
servicing,S ER1 V IH0 S IH0 NG,894253,312953,115,1515,2008
servico,S ER1 V IH0 K OW2,5655,4040,202,1754,2008
servile,S ER1 V AH0 L,855111,410635,365,1563,2008
servin,S ER1 V IH0 N,5600,4488,176,1739,2008
serving,S ER1 V IH0 NG,11202397,2556015,383,1505,2008
servings,S ER1 V IH0 NG Z,673276,67998,216,1681,2008
servis,S ER1 V IH0 S,17958,11583,275,1662,2008
serviss,S ER1 V IH0 S,416,307,100,1786,2008
servitude,S ER1 V AH0 T UW2 D,1358665,516159,362,1563,2008
servo,S ER1 V OW0,359573,67987,292,1581,2008
sesame,S EH1 S AH0 M IY0,444823,131180,238,1702,2008
sese,S IY1 S IY0,60534,29219,312,1581,2008
sesit,S EH1 Z IH0 T,227,166,80,1701,2008
sesler,S EH1 S AH0 L ER0,68,41,27,1831,2008
sessa,S EH1 S AH0,560,410,112,1685,2008
session,S EH1 SH AH0 N,13894641,1671246,358,1515,2008
sessions,S EH1 SH AH0 N Z,6539095,1263814,342,1515,2008
set,S EH1 T,144406217,4323311,422,1505,2008
setback,S EH1 T B AE2 K,645171,371630,165,1693,2008
setbacks,S EH1 T B AE2 K S,546739,331981,146,1665,2008
seth,S EH1 TH,8684,4620,309,1647,2008
sether,S EH1 DH ER0,3724,2190,228,1734,2008
sethi,S EH1 TH IY0,815,266,65,1800,2008
