word,pronunication,tf,df,years,year_first,year_recent
skelter,S K EH1 L T ER0,111262,95406,249,1683,2008
skelton,S K EH1 L T AH0 N,3018,2415,149,1777,2008
skene,S K IY1 N,18969,5160,199,1758,2008
skeptic,S K EH1 P T IH0 K,281993,134025,216,1683,2008
skeptical,S K EH1 P T AH0 K AH0 L,1498599,677699,226,1607,2008
skeptically,S K EH1 P T IH0 K AH0 L IY0,112835,87503,178,1823,2008
skepticism,S K EH1 P T IH0 S IH2 Z AH0 M,1413385,548763,233,1607,2008
skeptics,S K EH1 P T IH0 K S,284539,163182,216,1624,2008
skerry,S K EH1 R IY0,9636,4057,188,1737,2008
sketch,S K EH1 CH,5664626,1504482,326,1505,2008
sketchbook,S K EH1 CH B UH2 K,107122,38701,194,1564,2008
sketchbooks,S K EH1 CH B UH2 K S,40352,18953,175,1786,2008
sketched,S K EH1 CH T,1525766,789496,299,1564,2008
sketches,S K EH1 CH AH0 Z,2799240,905279,299,1505,2008
sketching,S K EH1 CH IH0 NG,579302,311427,263,1505,2008
sketchy,S K EH1 CH IY0,400302,304975,215,1664,2008
skew,S K Y UW1,350494,117800,299,1668,2008
skewed,S K Y UW1 D,623845,299818,232,1683,2008
skewer,S K Y UW1 ER0,111050,56441,250,1706,2008
skewered,S K Y UW1 ER0 D,62725,49311,215,1744,2008
skewers,S K Y UW1 ER0 Z,117689,48367,237,1746,2008
skewing,S K Y UW1 IH0 NG,65464,40781,232,1664,2008
skews,S K Y UW1 Z,30483,22846,210,1657,2008
ski,S K IY1,1373478,294425,299,1600,2008
skid,S K IH1 D,305750,129233,328,1629,2008
skidded,S K IH1 D AH0 D,186574,121695,153,1706,2008
skidding,S K IH1 D IH0 NG,149628,84040,169,1713,2008
skidmore,S K IH1 D M AO0 R,269,190,57,1823,2008
skids,S K IH1 D Z,116120,66720,223,1637,2008
skied,S K IY1 D,60183,31510,191,1667,2008
skier,S K AY1 R,166918,51974,192,1697,2008
skiers,S K IY1 ER0 Z,247124,60672,153,1708,2008
skies,S K AY1 Z,2108490,872496,345,1574,2008
skiff,S K IH1 F,271819,101930,277,1624,2008
skiffs,S K IH1 F S,60901,38119,249,1507,2008
skiing,S K IY1 IH0 NG,837954,219492,165,1637,2008
skiles,S K AY1 L Z,236,201,65,1862,2008
skill,S K IH1 L,15508570,2642150,404,1507,2008
skilled,S K IH1 L D,6819308,1729561,372,1515,2008
skillen,S K IH1 L AH0 N,78,42,27,1751,2008
skillet,S K IH1 L AH0 T,607959,82339,242,1588,2008
skillful,S K IH1 L F AH0 L,1317409,633518,322,1507,2008
skillfully,S K IH1 L F AH0 L IY0,710919,438745,270,1507,2008
skillin,S K IH1 L IH0 N,236,206,83,1731,2008
skilling,S K IH1 L IH0 NG,37531,16404,199,1714,2008
skillings,S K IH1 L IH0 NG Z,4950,1307,194,1751,2008
skills,S K IH1 L Z,22602472,1779973,296,1515,2008
skim,S K IH1 M,661091,271400,300,1520,2008
skimmed,S K IH1 M D,446142,259490,272,1572,2008
skimmer,S K IH1 M ER0,71090,23230,229,1642,2008
skimmers,S K IH1 M ER0 Z,28034,13589,218,1748,2008
skimming,S K IH1 M IH0 NG,385622,236176,292,1702,2008
skimp,S K IH1 M P,42817,36794,149,1805,2008
skimpier,S K IH1 M P IY0 ER0,3615,3431,97,1810,2008
skimpiest,S K IH1 M P IY0 AH0 S T,3780,3643,102,1848,2008
skimping,S K IH1 M P IH0 NG,19619,17917,160,1778,2008
skimpy,S K IH1 M P IY0,134797,107369,165,1806,2008
skin,S K IH1 N,28587542,2315096,388,1507,2008
skinflint,S K IH1 N F L IH0 N T,20585,17633,185,1809,2008
skinhead,S K IH1 N HH EH2 D,43011,13621,62,1908,2008
skinheads,S K IH1 N HH EH2 D Z,56357,18395,47,1890,2008
skinks,S K IH1 NG K S,20130,6029,151,1830,2008
skinless,S K IH1 N L AH0 S,58982,19791,194,1809,2008
skinned,S K IH1 N D,1225762,569546,296,1590,2008
skinner,S K IH1 N ER0,32142,17566,240,1637,2008
skinnier,S K IH1 N IY0 ER0,15626,13329,107,1837,2008
skinniest,S K IH1 N IY0 AH0 S T,5190,4887,117,1856,2008
skinny,S K IH1 N IY0,724846,346811,269,1681,2008
skins,S K IH1 N Z,2854065,832378,375,1507,2008
skip,S K IH1 P,1368625,637675,338,1579,2008
skipjack,S K IH1 P JH AE2 K,41099,7731,180,1685,2008
skipjacks,S K IH1 P JH AE2 K S,3991,1836,164,1807,2008
skipp,S K IH1 P,271,244,78,1805,2008
skipped,S K IH1 P T,685207,433805,272,1581,2008
skipper,S K IH1 P ER0,651213,143434,256,1681,2008
skippers,S K IH1 P ER0 Z,127328,51639,242,1678,2008
skipping,S K IH1 P IH0 NG,601770,362104,317,1579,2008
skippy,S K IH1 P IY0,1902,1387,108,1817,2008
skips,S K IH1 P S,214661,131828,305,1598,2008
skipton,S K IH1 P T AH0 N,70,63,41,1790,2008
skirmish,S K ER1 M IH0 SH,654340,303171,348,1524,2008
skirmishes,S K ER1 M IH0 SH IH0 Z,468012,280192,321,1515,2008
skirmishing,S K ER1 M IH0 SH IH0 NG,235901,113010,313,1524,2008
skirt,S K ER1 T,2479968,766933,309,1588,2008
skirted,S K ER1 T IH0 D,409465,283896,283,1574,2008
skirting,S K ER1 T IH0 NG,302385,208468,249,1672,2008
skirts,S K ER1 T S,1643982,694715,339,1579,2008
skis,S K IY1 Z,393347,100528,264,1631,2008
skit,S K IH1 T,143260,75645,279,1652,2008
skits,S K IH1 T S,115462,66323,214,1524,2008
skittish,S K IH1 T IH0 SH,101633,83310,267,1656,2008
skittishness,S K IH1 T IH0 SH N AH0 S,9031,8467,188,1759,2008
skittle,S K IH1 T AH0 L,15380,11143,229,1645,2008
skittles,S K IH1 T AH0 L Z,38330,27424,231,1645,2008
skiver,S K AY1 V ER0,3763,1825,179,1631,2008
sklar,S K L AA1 R,186,145,46,1956,2008
skoal,S K OW1 L,1743,1184,146,1809,2008
skoda,S K OW1 D AH0,676,201,52,1868,2008
skoff,S K AO1 F,668,369,113,1801,2008
skog,S K AA1 G,3456,1273,116,1849,2008
skogen,S K AA1 G AH0 N,2621,907,97,1850,2008
skok,S K AA1 K,460,309,68,1854,2008
skokie,S K OW1 K IY0,91,75,37,1945,2008
skoler,S K OW1 L ER0,955,539,101,1830,2008
skolnick,S K OW1 L N IH0 K,149,95,31,1967,2008
skolnik,S K OW1 L N IH0 K,83,46,24,1965,2007
skoog,S K UW1 G,194,110,44,1952,2008
skop,S K AA1 P,4187,1872,154,1803,2008
skopje,S K AO1 P Y EH2,63,42,23,1964,2008
skora,S K AO1 R AH0,210,146,62,1814,2008
skov,S K AA1 V,941,587,117,1747,2008
skow,S K AW1,1280,723,153,1801,2008
skowhegan,S K OW1 HH IY2 G AH0 N,68,65,31,1864,2008
skulduggery,S K AH0 L D AH1 G ER0 IY0,20328,16995,110,1872,2008
skulk,S K AH1 L K,48753,42303,288,1645,2008
skull,S K AH1 L,4570441,905011,327,1563,2008
skulls,S K AH1 L Z,977637,346472,286,1575,2008
skunk,S K AH1 NG K,270538,121165,222,1755,2008
skunks,S K AH1 NG K S,109836,55229,191,1743,2008
skura,S K UH1 R AH0,171,121,53,1814,2008
skutt,S K AH1 T,458,187,78,1849,2008
sky,S K AY1,15950727,2111300,358,1507,2008
"sky's",S K AY1 Z,629,616,61,1927,2008
skybox,S K AY1 B AA2 K S,6051,2168,34,1941,2008
skyboxes,S K AY1 B AA2 K S IH0 Z,3340,1728,35,1900,2008
skycap,S K AY1 K AE2 P,3493,2113,49,1957,2008
skydive,S K AY1 D AY0 V,4131,2894,46,1952,2008
skydiving,S K AY1 D AY0 V IH0 NG,29399,17021,52,1913,2008
skydome,S K AY1 D OW2 M,1347,377,70,1883,2008
skyhawk,S K AY1 HH AO2 K,208,148,55,1926,2008
skyhawks,S K AY1 HH AO2 K S,63,45,21,1965,2007
skyhigh,S K AY1 HH AY2,6252,5945,155,1835,2008
skylark,S K AY1 L AA2 R K,52864,33035,221,1776,2008
skylarks,S K AY1 L AA2 R K S,16837,12210,192,1789,2008
skylight,S K AY1 L AY2 T,258919,116280,221,1667,2008
skylights,S K AY1 L AY2 T S,120460,60827,202,1766,2008
skyline,S K AY1 L AY2 N,392727,208302,178,1750,2008
skylines,S K AY1 L AY2 N Z,19113,14699,131,1845,2008
skylite,S K AY1 L AY2 T,78,64,39,1852,2008
skyrocket,S K AY1 R AA2 K AH0 T,48895,42194,201,1753,2008
skyrocketed,S K AY1 R AA2 K AH0 T IH0 D,115431,90789,108,1854,2008
skyrocketing,S K AY1 R AA2 K AH0 T IH0 NG,76805,62215,123,1854,2008
skyrockets,S K AY1 R AA2 K AH0 T S,18530,15474,203,1751,2008
skyscraper,S K AY1 S K R EY2 P ER0,263095,125610,137,1766,2008
skyscrapers,S K AY1 S K R EY2 P ER0 Z,301558,161352,167,1719,2008
skyward,S K AY1 W ER0 D,195979,134643,184,1758,2008
skywave,S K AY1 W EY2 V,4724,1167,76,1930,2008
skyway,S K AY1 W EY2,6299,3501,95,1730,2008
skywriter,S K AY1 R AY2 T ER0,1784,1299,73,1928,2008
skywriters,S K AY1 R AY2 T ER0 Z,650,533,71,1930,2008
skywriting,S K AY1 R AY2 T IH0 NG,7810,5669,87,1910,2008
slab,S L AE1 B,2196666,503257,260,1563,2008
slabs,S L AE1 B Z,1362141,394373,263,1563,2008
slaby,S L EY1 B IY0,184,137,51,1814,2008
slack,S L AE1 K,1399953,627047,322,1515,2008
slacked,S L AE1 K T,56384,41646,261,1676,2008
slacken,S L AE1 K AH0 N,192998,157284,333,1579,2008
slackened,S L AE1 K AH0 N D,330773,246656,305,1575,2008
slackening,S L AE1 K AH0 N IH0 NG,208702,162448,289,1507,2008
slackens,S L AE1 K AH0 N Z,55028,48217,293,1661,2008
slacker,S L AE1 K ER0,51610,37218,229,1678,2008
slackers,S L AE1 K ER0 Z,38678,28318,125,1821,2008
slackness,S L AE1 K N AH0 S,140395,101752,308,1582,2008
slacks,S L AE1 K S,429342,191457,241,1685,2008
slade,S L EY1 D,3149,1738,193,1761,2008
sladek,S L AE1 D IH0 K,136,61,30,1947,2008
sladky,S L AE1 D K IY0,75,51,27,1918,2006
slag,S L AE1 G,988286,136684,263,1590,2008
slager,S L EY1 G ER0,254,152,62,1779,2008
slagle,S L EY1 G AH0 L,76,47,30,1851,2008
slagter,S L AE1 G T ER0,113,98,45,1822,2008
slain,S L EY1 N,2817830,701836,377,1520,2008
slaine,S L EY1 N,48102,11852,270,1568,2008
slalom,S L AA1 L AH0 M,53383,16208,83,1843,2008
slam,S L AE1 M,468273,279445,256,1655,2008
slama,S L AA1 M AH0,297,189,60,1841,2008
slammed,S L AE1 M D,1312343,457925,212,1706,2008
slammer,S L AE1 M ER0,20852,15153,105,1816,2008
slamming,S L AE1 M IH0 NG,410141,255292,201,1664,2008
slams,S L AE1 M Z,119737,77149,191,1644,2008
slander,S L AE1 N D ER0,882604,396507,365,1520,2008
slandered,S L AE1 N D ER0 D,159839,119216,328,1603,2008
slanderer,S L AE1 N D ER0 ER0,60235,43632,292,1620,2008
slandering,S L AE1 N D ER0 IH0 NG,85505,67874,312,1620,2008
slanderous,S L AE1 N D ER0 AH0 S,182951,123996,337,1579,2008
slanders,S L AE1 N D ER0 Z,193891,122812,349,1579,2008
slane,S L EY1 N,3796,2246,217,1715,2008
slaney,S L EY1 N IY0,60,57,41,1817,2008
slang,S L AE1 NG,869558,352694,245,1657,2008
slanina,S L AA0 N IY1 N AH0,125,80,38,1916,2008
slant,S L AE1 N T,736984,387775,336,1631,2008
slanted,S L AE1 N T AH0 D,441850,276576,298,1590,2008
slanting,S L AE1 N T IH0 NG,520327,305789,312,1607,2008
slap,S L AE1 P,871309,503590,272,1671,2008
slapdash,S L AE1 P D AE2 SH,36726,32146,188,1780,2008
slape,S L EY1 P,2384,1608,186,1802,2008
slaphappy,S L AE1 P HH AE2 P IY0,2990,2699,72,1931,2008
slapped,S L AE1 P T,1091294,478950,232,1688,2008
slapping,S L AE1 P IH0 NG,491271,316767,241,1720,2008
slaps,S L AE1 P S,184717,131377,247,1590,2008
slapstick,S L AE1 P S T IH2 K,118870,62066,113,1820,2008
slash,S L AE1 SH,643129,296306,273,1581,2008
slashed,S L AE1 SH T,497593,309974,253,1563,2008
slasher,S L AE1 SH ER0,34876,14253,173,1804,2008
slashes,S L AE1 SH IH0 Z,147004,98332,249,1595,2008
slashing,S L AE1 SH IH0 NG,306540,213531,267,1590,2008
slat,S L AE1 T,98464,49335,301,1676,2008
slate,S L EY1 T,1887629,659170,355,1515,2008
slated,S L EY1 T IH0 D,269855,175932,319,1581,2008
slaten,S L EY1 T AH0 N,57,43,27,1839,2008
slater,S L EY1 T ER0,14267,9212,242,1644,2008
slaters,S L EY1 T ER0 Z,9734,6655,221,1739,2008
slates,S L EY1 T S,495234,170737,315,1581,2008
slather,S L AE1 DH ER0,10007,8464,129,1698,2008
slathered,S L AE1 DH ER0 D,27194,22759,132,1794,2008
slathering,S L AE1 DH ER0 IH0 NG,8021,7400,118,1808,2008
slathers,S L AE1 DH ER0 Z,2416,2061,127,1719,2008
slating,S L EY1 T IH0 NG,22828,13331,267,1655,2008
slats,S L AE1 T S,245028,127143,232,1686,2008
slatten,S L AE1 T AH0 N,192,119,66,1777,2008
slatter,S L AE1 T ER0,1303,739,179,1676,2008
slattery,S L AE1 T ER0 IY0,533,365,121,1679,2008
slaugh,S L AO1,4288,4076,248,1668,2008
slaughter,S L AO1 T ER0,2646597,905764,378,1563,2008
slaughtered,S L AO1 T ER0 D,1196513,565131,341,1563,2008
slaughterhouse,S L AO1 T ER0 HH AW2 S,153139,86550,231,1700,2008
slaughterhouses,S L AO1 T ER0 HH AW2 S IH0 Z,79308,44912,215,1767,2008
slaughtering,S L AO1 T ER0 IH0 NG,341058,204544,290,1593,2008
slaughterings,S L AO1 T ER0 IH0 NG Z,8053,4602,181,1800,2008
slaughters,S L AO1 T ER0 Z,79656,60908,332,1579,2008
slav,S L AA1 V,13175,9890,223,1733,2008
slava,S L AA1 V AH0,6568,2577,182,1748,2008
slave,S L EY1 V,13441735,1508749,366,1524,2008
slaven,S L EY1 V AH0 N,2054,1029,133,1807,2008
slavery,S L EY1 V ER0 IY0,11111163,1142530,370,1524,2008
slaves,S L EY1 V Z,13394085,1326793,372,1507,2008
slavic,S L AA1 V IH0 K,3543,2739,125,1801,2008
slavik,S L AA1 V IH0 K,116,86,36,1853,2008
slavin,S L AE1 V IH0 N,2444,2096,153,1825,2008
slavish,S L EY1 V IH0 SH,333632,238563,345,1524,2008
slavishly,S L AE1 V IH0 SH L IY0,142336,123550,288,1624,2008
slavs,S L AA1 V Z,1781,1460,153,1790,2008
slaw,S L AO1,46847,26203,249,1667,2008
slay,S L EY1,768834,351433,356,1524,2008
slayer,S L EY1 ER0,197402,105638,264,1579,2008
slaying,S L EY1 IH0 NG,442731,241398,324,1563,2008
slayings,S L EY1 IH0 NG Z,24486,15097,148,1825,2008
slaymaker,S L EY1 M EY2 K ER0,100,63,44,1797,2008
sleaze,S L IY1 Z,35665,21892,50,1918,2008
sleazy,S L IY1 Z IY0,111316,78873,174,1716,2008
slechta,S L EH1 CH T AH0,197,78,35,1834,2008
sled,S L EH1 D,532825,139140,321,1588,2008
sledd,S L EH1 D,271,108,47,1837,2008
sledding,S L EH1 D IH0 NG,61641,42340,194,1705,2008
sledge,S L EH1 JH,569689,170527,273,1563,2008
sledgehammer,S L EH1 JH HH AE2 M ER0,77774,58699,191,1794,2008
sleds,S L EH1 D Z,178156,76499,277,1675,2008
slee,S L IY1,6468,4863,235,1568,2008
sleek,S L IY1 K,658665,382790,306,1575,2008
sleeker,S L IY1 K ER0,17446,15411,218,1719,2008
sleekest,S L IY1 K AH0 S T,5128,4940,206,1745,2008
sleekly,S L IY1 K L IY0,17152,15508,186,1723,2008
sleeman,S L IY1 M AH0 N,99,81,43,1864,2008
sleep,S L IY1 P,23711525,2445161,383,1507,2008
sleeper,S L IY1 P ER0,455324,250315,256,1637,2008
sleepers,S L IY1 P ER0 Z,398583,192782,255,1685,2008
sleepily,S L IY1 P AH0 L IY0,173872,127965,210,1574,2008
sleepiness,S L IY1 P IY0 N AH0 S,207639,85092,269,1662,2008
sleeping,S L IY1 P IH0 NG,7201205,1847907,378,1507,2008
sleepless,S L IY1 P L AH0 S,579409,399451,287,1589,2008
sleeps,S L IY1 P S,1016811,590339,342,1581,2008
sleepwalk,S L IY1 P W AO2 K,8780,7268,75,1822,2008
sleepwalker,S L IY1 P W AO2 K ER0,39159,31299,186,1797,2008
sleepwalkers,S L IY1 P W AO2 K ER0 Z,14298,11335,157,1799,2008
sleepwalking,S L IY1 P W AO2 K IH0 NG,75770,41069,180,1783,2008
sleepwear,S L IY1 P W EH2 R,14007,7019,64,1893,2008
sleepy,S L IY1 P IY0,1240588,665075,330,1587,2008
sleet,S L IY1 T,292260,175171,282,1581,2008
sleeth,S L IY1 TH,1632,720,134,1724,2008
sleeve,S L IY1 V,2008330,716725,323,1563,2008
sleeved,S L IY1 V D,235662,151274,219,1715,2008
sleeveless,S L IY1 V L IH0 S,145674,95986,246,1590,2008
sleeves,S L IY1 V Z,1658028,713089,317,1563,2008
sleigh,S L EY1,389394,135307,227,1637,2008
sleight,S L AY1 T,190008,143908,312,1572,2008
slender,S L EH1 N D ER0,4336806,1206737,382,1507,2008
slept,S L EH1 P T,5315583,1398022,376,1563,2008
sletten,S L EH1 T AH0 N,76,53,38,1868,2008
sleuth,S L UW1 TH,77072,45532,215,1749,2008
sleuthing,S L UW1 TH IH0 NG,36541,27672,112,1829,2008
sleuths,S L UW1 TH S,33325,21244,125,1836,2008
sleven,S L IY1 V AH0 N,162,139,82,1811,2008
slew,S L UW1,871939,350183,360,1520,2008
slice,S L AY1 S,2269872,776238,342,1515,2008
sliced,S L AY1 S T,1483641,412318,308,1563,2008
slicer,S L AY1 S ER0,31033,14389,186,1770,2008
slices,S L AY1 S AH0 Z,2021915,505355,314,1563,2008
slicing,S L AY1 S IH0 NG,384341,218530,255,1587,2008
slick,S L IH1 K,673779,353408,299,1581,2008
slicked,S L IH1 K T,97663,74306,198,1626,2008
slicker,S L IH1 K ER0,89631,54935,211,1684,2008
slickers,S L IH1 K ER0 Z,30477,24281,136,1751,2008
slickest,S L IH1 K AH0 S T,12596,11693,161,1685,2008
slickly,S L IH1 K L IY0,14541,13210,124,1651,2008
slicks,S L IH1 K S,52344,26295,260,1653,2008
slid,S L IH1 D,2677470,688783,351,1505,2008
slide,S L AY1 D,5236930,1231074,346,1505,2008
slider,S L AY1 D ER0,397318,47933,256,1653,2008
slides,S L AY1 D Z,2436996,663502,322,1505,2008
sliding,S L AY1 D IH0 NG,2989778,967343,333,1515,2008
slife,S L AY1 F,1123,417,143,1709,2008
sligh,S L AY1,2032,1766,198,1701,2008
slight,S L AY1 T,14824295,2867943,386,1505,2008
slighted,S L AY1 T IH0 D,337789,257015,356,1582,2008
slightest,S L AY1 T AH0 S T,4841359,1595407,340,1507,2008
slighting,S L AY1 T IH0 NG,104237,89247,336,1607,2008
slightly,S L AY1 T L IY0,23995002,3231462,373,1505,2008
slights,S L AY1 T S,145890,119836,312,1603,2008
slim,S L IH1 M,1575347,771484,310,1581,2008
slime,S L AY1 M,596759,264274,318,1588,2008
slimmed,S L IH1 M D,22276,19339,136,1651,2008
slimmer,S L IH1 M ER0,87455,68859,243,1703,2008
slimmest,S L IH1 M AH0 S T,18724,17603,171,1777,2008
slimming,S L IH1 M IH0 NG,46781,27773,120,1681,2008
slimp,S L IH1 M P,108,76,36,1797,2006
slims,S L IH1 M Z,3144,2638,190,1679,2008
slimy,S L AY1 M IY0,439335,265725,325,1581,2008
sling,S L IH1 NG,678249,293343,305,1582,2008
slinger,S L IH1 NG ER0,19290,11512,214,1645,2008
slinging,S L IH1 NG IH0 NG,87760,73836,250,1587,2008
slings,S L IH1 NG Z,220492,129482,293,1579,2008
slingshot,S L IH1 NG SH AA2 T,56609,35482,121,1713,2008
slingshots,S L IH1 NG SH AA2 T S,16542,12823,112,1817,2008
slinker,S L IH1 NG K ER0,497,348,88,1843,2008
slinky,S L IH1 NG K IY0,38943,28938,119,1713,2008
slip,S L IH1 P,6673973,1808810,372,1524,2008
slippage,S L IH1 P IH0 JH,280352,131092,144,1705,2008
slipped,S L IH1 P T,5263338,1379816,324,1563,2008
slipper,S L IH1 P ER0,258156,140673,263,1588,2008
slippers,S L IH1 P ER0 Z,880317,438873,273,1579,2008
slippery,S L IH1 P ER0 IY0,1237757,700821,350,1520,2008
slipping,S L IH1 P IH0 NG,1812708,925685,321,1584,2008
slips,S L IH1 P S,1671082,799858,332,1584,2008
slipshod,S L IH1 P SH AA2 D,113492,95252,220,1564,2008
slit,S L IH1 T,1870261,522043,319,1563,2008
sliter,S L IY1 T ER0,109,93,48,1739,2008
slither,S L IH1 DH ER0,70483,58512,203,1644,2008
slithering,S L IH1 DH ER0 IH0 NG,94550,74704,156,1706,2008
slits,S L IH1 T S,616122,253239,261,1645,2008
slitting,S L IH1 T IH0 NG,94534,61838,277,1700,2008
sliva,S L IY1 V AH0,227,168,63,1824,2008
sliver,S L IH1 V ER0,238265,147771,272,1666,2008
slivers,S L IH1 V ER0 Z,142113,87851,218,1667,2008
slivovitz,S L IH1 V AH0 V IH0 T S,6382,3523,116,1820,2008
sloan,S L OW1 N,1358,902,130,1791,2008
sloane,S L OW1 N,2163,432,90,1763,2008
sloat,S L OW1 T,399,263,111,1696,2008
slob,S L AA1 B,75509,52312,184,1677,2008
slobber,S L AA1 B ER0,23675,20017,202,1738,2008
slobbering,S L AA1 B ER0 IH0 NG,43759,37405,207,1769,2008
sloboda,S L AH0 B OW1 D AH0,2453,1107,94,1824,2008
slobodan,S L OW1 B OW0 D AA2 N,116,66,29,1950,2008
slobs,S L AA1 B Z,21394,17427,145,1778,2008
slocum,S L OW1 K AH0 M,534,293,87,1866,2008
sloe,S L OW1,42365,30204,270,1572,2008
slog,S L AA1 G,48637,38689,186,1715,2008
slogan,S L OW1 G AH0 N,1610202,631063,221,1515,2008
slogans,S L OW1 G AH0 N Z,989591,415610,173,1688,2008
slogged,S L AA1 G D,39594,32610,143,1763,2008
slogging,S L AA1 G IH0 NG,56977,47638,165,1766,2008
sloma,S L OW1 M AH0,145,108,55,1830,2007
sloman,S L OW1 M AH0 N,277,88,36,1870,2008
slone,S L OW1 N,3097,2784,256,1587,2008
sloop,S L UW1 P,627052,137365,307,1524,2008
slop,S L AA1 P,195133,122437,324,1588,2008
slope,S L OW1 P,8787470,1278343,316,1507,2008
sloper,S L OW1 P ER0,5571,693,127,1765,2008
slopes,S L OW1 P S,4716933,947576,301,1507,2008
sloping,S L OW1 P IH0 NG,1723615,666648,318,1507,2008
sloppier,S L AA1 P IY0 ER0,6000,5638,125,1842,2008
sloppiest,S L AA1 P IY0 AH0 S T,3516,3421,124,1827,2008
sloppily,S L AA1 P AH0 L IY0,41822,37684,127,1809,2008
sloppiness,S L AA1 P IY0 N AH0 S,54624,46598,149,1818,2008
sloppy,S L AA1 P IY0,447375,305757,206,1768,2008
slorc,S L AO1 R K,142,66,32,1595,2008
slosh,S L AA1 SH,37558,28348,171,1795,2008
sloshing,S L AA1 SH IH0 NG,80735,59559,153,1730,2008
sloss,S L AO1 S,343,191,72,1793,2008
slot,S L AA1 T,1956671,468715,342,1581,2008
slota,S L OW1 T AH0,168,122,70,1760,2008
sloth,S L OW1 TH,419647,238818,349,1579,2008
slots,S L AA1 T S,1114453,287874,255,1676,2008
slott,S L AA1 T,1837,883,102,1685,2008
slotted,S L AA1 T IH0 D,319273,124204,206,1673,2008
slotting,S L AA1 T IH0 NG,43830,21104,185,1644,2008
slouch,S L AW1 CH,137158,103779,241,1694,2008
slouches,S L AW1 CH IH0 Z,15899,14649,180,1781,2008
slouching,S L AW1 CH IH0 NG,86956,72172,240,1700,2008
slough,S L AH1 F,346549,183819,286,1655,2008
sloughs,S L AH1 F S,138539,68663,267,1689,2008
slovak,S L OW1 V AE0 K,11572,1201,97,1853,2008
slovakia,S L OW2 V AA1 K IY0 AH0,8021,2681,91,1918,2008
slovaks,S L OW1 V AE0 K S,1303,303,73,1887,2008
slovene,S L OW2 V IY1 N,430,226,58,1830,2008
slovenes,S L OW2 V IY1 N Z,95,49,32,1920,2008
slovenia,S L OW2 V IY1 N IY0 AH0,691,222,33,1936,2008
slovenian,S L OW2 V IY1 N IY0 AH0 N,199,83,32,1910,2008
slovenliness,S L AH1 V AH0 N L IY0 N AH0 S,57650,49177,253,1701,2008
slovenly,S L AH1 V AH0 N L IY0,285701,210503,334,1574,2008
slover,S L OW1 V ER0,180,146,71,1857,2008
sloves,S L OW1 V Z,626,312,78,1826,2008
slovo,S L OW1 V OW0,17854,5951,138,1799,2008
slow,S L OW1,20793150,3318417,377,1515,2008
slowdown,S L OW1 D AW2 N,332230,136402,125,1515,2008
slowdowns,S L OW1 D AW2 N Z,43950,30318,91,1902,2008
slowed,S L OW1 D,1999389,910080,273,1515,2008
slower,S L OW1 ER0,3395071,1330758,340,1515,2008
slowest,S L OW1 AH0 S T,317183,226015,307,1587,2008
slowik,S L OW1 IH0 K,53,44,24,1853,2008
slowing,S L OW1 IH0 NG,1254758,617014,292,1515,2008
slowly,S L OW1 L IY0,23365866,3170686,382,1515,2008
slowness,S L OW1 N AH0 S,670398,437049,333,1515,2008
slowpoke,S L OW1 P OW2 K,5560,4852,92,1897,2008
slows,S L OW1 Z,654090,372900,271,1678,2008
sludge,S L AH1 JH,1392628,127297,235,1747,2008
sludgy,S L AH1 JH IY0,8679,7288,178,1771,2008
slug,S L AH1 G,430158,179172,259,1650,2008
sluga,S L UW1 G AH0,705,459,87,1823,2008
slugfest,S L AH1 G F EH2 S T,6126,5061,76,1917,2008
slugged,S L AH1 G D,58877,42608,144,1755,2008
slugger,S L AH1 G ER0,38506,16780,130,1815,2008
sluggers,S L AH1 G ER0 Z,14866,7760,130,1866,2008
slugging,S L AH1 G IH0 NG,74827,40195,176,1724,2008
sluggish,S L AH1 G IH0 SH,948727,556220,348,1507,2008
sluggishly,S L AH1 G IH0 SH L IY0,118398,97586,264,1658,2008
sluggishness,S L AH1 G IH0 SH N AH0 S,149515,113154,293,1590,2008
slugs,S L AH1 G Z,330623,139456,253,1678,2008
sluice,S L UW1 S,251038,97630,273,1590,2008
sluicing,S L UW1 S IH0 NG,50588,26212,202,1756,2008
sluiter,S L UW1 T ER0,103,46,30,1787,2007
sluka,S L UW1 K AH0,85,60,35,1895,2008
slum,S L AH1 M,1030195,322499,314,1631,2008
slumber,S L AH1 M B ER0,886451,488827,344,1524,2008
slumbering,S L AH1 M B ER0 IH0 NG,300650,217070,285,1581,2008
slump,S L AH1 M P,654845,292607,231,1653,2008
slumped,S L AH1 M P T,675055,328794,182,1762,2008
slumping,S L AH1 M P IH0 NG,116381,72941,166,1796,2008
slumps,S L AH1 M P S,116287,72966,211,1707,2008
slums,S L AH1 M Z,978044,373513,245,1686,2008
slung,S L AH1 NG,706178,399857,306,1630,2008
slur,S L ER1,229584,164627,313,1572,2008
slurp,S L ER1 P,29480,23307,228,1655,2008
slurred,S L ER1 D,240381,149732,250,1687,2008
slurring,S L ER1 IH0 NG,82139,62814,232,1683,2008
slurry,S L ER1 IY0,556596,82180,165,1684,2008
slurs,S L ER1 Z,133168,81626,245,1676,2008
slush,S L AH1 SH,226090,137746,220,1693,2008
slusher,S L AH1 SH ER0,2086,481,89,1899,2008
sluss,S L AH1 S,83,65,38,1683,2008
slusser,S L AH1 S ER0,74,52,22,1912,1999
slut,S L AH1 T,175546,96324,304,1588,2008
slutsky,S L AH1 T S K IY0,105,70,30,1941,2008
slutty,S L AH1 T IY2,9451,6867,62,1903,2008
sly,S L AY1,822172,482909,342,1582,2008
slye,S L AY1,1117,889,148,1667,2008
slyly,S L AY1 L IY0,256774,189687,280,1520,2008
slyness,S L AY1 N AH0 S,38815,33361,237,1582,2008
smack,S M AE1 K,498328,326489,286,1592,2008
smacked,S M AE1 K T,360930,246995,225,1741,2008
smacking,S M AE1 K IH0 NG,184471,141255,255,1678,2008
smacks,S M AE1 K S,216776,170604,267,1520,2008
smail,S M EY1 L,13687,8905,284,1638,2008
smale,S M EY1 L,19895,10162,241,1568,2008
small,S M AO1 L,165455401,4368565,422,1505,2008
smallcap,S M AO1 L K AE2 P,1380,716,27,1957,2008
smallen,S M AO1 L AH0 N,118,107,55,1823,2008
smaller,S M AO1 L ER0,28620881,3412864,393,1505,2008
smallest,S M AO1 L AH0 S T,5633085,1961560,371,1524,2008
smalley,S M AA1 L IY0,270,207,63,1759,2008
smalling,S M AO1 L IH0 NG,437,386,92,1667,2008
smallish,S M AO1 L IH0 SH,113193,82045,222,1584,2008
smallman,S M AO1 L M AH0 N,117,80,37,1902,2008
smallness,S M AO1 L N AH0 S,522916,350620,337,1515,2008
smallpox,S M AO1 L P AA2 K S,1172757,318020,292,1563,2008
smalls,S M AO1 L Z,17622,10330,282,1676,2008
smalltalk,S M AO1 L T AO2 K,2767,2332,175,1805,2008
smalltown,S M AO1 L T AW2 N,37242,31166,199,1698,2008
smallwood,S M AO1 L W UH2 D,662,370,84,1823,2008
smaltz,S M AE1 L T S,111,100,55,1835,2008
smarmy,S M AA1 R M IY0,18143,15295,103,1748,2008
smarr,S M AE1 R,137,110,47,1709,2008
smart,S M AA1 R T,4136669,1272164,370,1563,2008
smartaleck,S M AA1 R T EH0 L AH0 K,1401,1345,89,1914,2008
smartass,S M AA1 R T AE1 S,12080,9190,44,1964,2008
smartcard,S M AA1 R T K AA2 R D,9929,2209,24,1953,2008
smarted,S M AA1 R T AH0 D,65799,58353,332,1581,2008
smarten,S M AA1 R T AH0 N,12648,11549,179,1732,2008
smartened,S M AA1 R T AH0 N D,11348,10413,191,1793,2008
smartening,S M AA1 R T AH0 N IH0 NG,3989,3626,171,1790,2008
smarter,S M AA1 R T ER0,453061,291180,276,1668,2008
smartest,S M AA1 R T AH0 S T,211404,159405,273,1642,2008
smarties,S M AA1 R T IY0 Z,3150,2563,120,1879,2008
smarting,S M AA1 R T IH0 NG,239043,179889,306,1579,2008
smartish,S M AA1 R T IH0 SH,3516,3083,199,1738,2008
smartly,S M AA1 R T L IY0,366343,248590,334,1645,2008
smartmoney,S M AA1 R T M AH2 N IY0,231,206,78,1746,2008
smartness,S M AA1 R T N IH0 S,115938,87515,296,1659,2008
smarts,S M AA1 R T S,80039,60147,288,1592,2008
smartt,S M AA1 R T,95,80,38,1883,2008
smarty,S M AA1 R T IY0,13683,11350,137,1744,2008
smash,S M AE1 SH,757459,435549,221,1683,2008
smashed,S M AE1 SH T,1370685,646391,231,1524,2008
smasher,S M AE1 SH ER0,18967,14019,185,1631,2008
smashes,S M AE1 SH IH0 Z,85226,67711,184,1770,2008
smashing,S M AE1 SH IH0 NG,583348,376382,215,1582,2008
smatter,S M AE1 T ER0,4060,3519,247,1572,2008
smattering,S M AE1 T ER0 IH0 NG,220783,180494,315,1579,2008
smay,S M EY1,540,498,167,1675,2008
smead,S M IY1 D,118,87,42,1873,2008
smeal,S M IY1 L,50,48,30,1905,2007
smear,S M IH1 R,856099,297394,281,1607,2008
smeared,S M IH1 R D,681003,406328,293,1563,2008
smearing,S M IH1 R IH0 NG,193546,132539,266,1590,2008
smears,S M IH1 R Z,472674,134842,228,1683,2008
smedley,S M EH1 D L IY0,186,124,58,1855,2008
smee,S M IY1,979,662,206,1688,2008
smell,S M EH1 L,7261922,1596291,376,1505,2008
smelled,S M EH1 L D,1310130,478144,283,1605,2008
smelling,S M EH1 L IH0 NG,1225153,667042,346,1568,2008
smells,S M EH1 L Z,1405601,690214,345,1563,2008
smelly,S M EH1 L IY0,250950,178415,186,1717,2008
