word,pronunication,tf,df,years,year_first,year_recent
z,Z IY1,6166335,845164,391,1507,2008
"z's",Z IY1 Z,96,75,40,1824,2008
z.,Z IY1,540654,195258,364,1515,2008
zabala,Z AA0 B AA1 L AH0,95,64,30,1917,2008
zabawa,Z AA0 B AA1 W AH0,103,74,33,1911,2007
zabel,Z EY1 B AH0 L,239,197,74,1760,2008
zabriskie,Z AE1 B R IH0 S K IY0,55,50,33,1930,2008
zaccaria,Z AA0 K AA1 R IY0 AH0,53,44,28,1806,2008
zaccheus,Z AE1 K OY0 Z,64,44,25,1772,2006
zach,Z AE1 K,1838,656,107,1659,2008
zachar,Z AH0 K AA1 R,519,290,61,1822,2008
zachariah,Z AE2 K ER0 AY1 AH0,149,111,60,1728,2008
zacharias,Z AE2 K ER0 AY1 AH0 S,543,239,85,1702,2008
zachary,Z AE1 K ER0 IY0,624,339,87,1728,2008
zacher,Z AE1 K ER0,81,62,30,1946,2008
zack,Z AE1 K,1447,814,118,1743,2008
zacks,Z AE1 K S,240,136,50,1801,2008
zada,Z AA1 D AH0,3008,1249,165,1742,2008
zadar,Z EY1 D AA2 R,109,73,35,1897,2008
zadeh,Z AA1 D EH2,2611,982,121,1800,2008
zadok,Z AA1 D AH0 K,269,132,60,1825,2008
zadrozny,Z AH0 D R OW1 Z N IY0,102,92,26,1956,2007
zaftig,Z AE1 F T IH0 G,3733,3043,59,1929,2008
zag,Z AE1 G,200354,117031,254,1709,2008
zagar,Z AA0 G AA1 R,80,64,33,1846,2008
zagat,Z AE1 G AH0 T,81,60,27,1829,2008
zagel,Z EY1 G AH0 L,118,82,36,1860,2008
zager,Z EY1 G ER0,62,48,21,1933,2005
zagged,Z AE1 G D,18394,16598,194,1799,2008
zagreb,Z AA1 G R EH2 B,385,162,55,1917,2008
zags,Z AE1 G Z,32097,24183,224,1757,2008
zaher,Z EY1 ER0,804,453,88,1823,2008
zahir,Z AH0 HH IH1 R,6069,2387,109,1806,2008
zahler,Z AA1 L ER0,81,66,34,1856,2008
zahm,Z AE1 M,840,673,120,1750,2008
zahn,Z AE1 N,1238,918,135,1828,2008
zaibatsu,Z EY2 B AE1 T S UW2,91212,11355,71,1935,2008
zaid,Z EY1 D,2394,1152,163,1749,2008
zaino,Z EY1 N OW0,636,341,94,1793,2008
zaire,Z AY0 IH1 R,2366,1099,85,1746,2008
zaitech,Z EY1 T EH2 K,743,283,23,1986,2008
zaitsev,Z EY1 T S EH0 V,50,41,24,1951,2008
zajac,Z AY1 AH0 K,130,95,46,1889,2008
zak,Z AE1 K,4888,2304,165,1747,2008
zakharov,Z AE1 K ER0 AA0 V,51,43,26,1940,2008
zaki,Z AA1 K IY0,2834,1279,127,1831,2008
zale,Z EY1 L,1100,636,108,1811,2008
zaleski,Z AH0 L EH1 S K IY0,61,54,28,1917,2008
zalm,Z AA1 M,340,219,56,1810,2008
zalman,Z AA1 L M AH0 N,142,87,36,1951,2008
zaman,Z EY1 M AH0 N,18656,4863,132,1799,2008
zambia,Z AE1 M B IY0 AH0,708,218,43,1898,2008
zambian,Z AE1 M B IY0 AH0 N,322,103,35,1900,2008
zambo,Z AE1 M B OW0,5954,2868,161,1684,2008
zamboanga,Z AE0 M B OW1 NG G AH0,158,86,33,1902,2008
zamora,Z AH0 M AO1 R AH0,238,175,58,1762,2008
zamorano,Z AA0 M AO0 R AA1 N OW0,171,86,35,1831,2008
zampino,Z AA0 M P IY1 N OW0,66,56,34,1882,2008
zan,Z AE1 N,25429,12113,244,1632,2008
zanamivir,Z AE1 N AH0 M IH0 V ER0,4933,1201,14,1993,2008
zanca,Z AE1 NG K AH0,179,125,57,1794,2008
zand,Z AE1 N D,4294,2285,187,1675,2008
zander,Z AE1 N D ER0,4627,1898,190,1607,2008
zanders,Z AE1 N D ER0 Z,215,151,80,1787,2008
zandi,Z AA1 N D IY0,120,94,48,1811,2008
zandt,Z AE1 N T,96,77,51,1872,2008
zandy,Z AE1 N D IY0,43,41,25,1817,2008
zane,Z EY1 N,1512,957,124,1723,2008
zanella,Z AH0 N EH1 L AH0,121,77,40,1876,2008
zang,Z AE1 NG,10911,3203,150,1763,2008
zanger,Z AE1 NG ER0,178,126,51,1824,2007
zani,Z AA1 N IY0,1674,1063,186,1668,2008
zaniest,Z EY1 N IY0 AH0 S T,2152,2032,65,1942,2008
zank,Z AE1 NG K,405,330,98,1803,2008
zanni,Z AE1 N IY0,4733,1476,105,1785,2008
zanoni,Z AA0 N OW1 N IY0,165,93,46,1842,2008
zant,Z AE1 N T,924,820,172,1748,2008
zantac,Z AE1 N T AE0 K,68,52,19,1984,2008
zanu,Z AA0 N UW1,1374,331,63,1815,2008
zany,Z EY1 N IY0,73358,52540,229,1645,2008
zanzibar,Z AE1 N Z AH0 B AA2 R,589,164,71,1884,2008
zap,Z AE1 P,56126,36217,169,1688,2008
zapata,Z AA0 P AA1 T AH0,1052,510,81,1825,2008
zapatista,Z AA2 P AH0 T IY1 S T AH0,2250,590,53,1940,2008
zapatistas,Z AA2 P AH0 T IY1 S T AH0 Z,2403,565,56,1917,2008
zapf,Z AE1 P F,124,83,41,1806,2007
zapp,Z AE1 P,369,172,49,1891,2008
zappa,Z AE1 P AH0,1139,714,119,1740,2008
zapped,Z AE1 P T,37874,28369,54,1852,2008
zapping,Z AE1 P IH0 NG,23552,15398,51,1889,2008
zaps,Z AE1 P S,9477,7121,89,1783,2008
zara,Z AE1 R AH0,4313,2496,200,1695,2008
zaragoza,Z AA0 R AA0 G OW1 Z AH0,172,127,53,1808,2008
zarah,Z AE1 R AH0,2867,1142,102,1707,2008
zarate,Z AA1 R EY0 T,115,82,40,1824,2008
zarb,Z AA1 R B,1387,570,100,1821,2008
zarella,Z AH0 R EH1 L AH0,203,192,40,1900,2008
zaria,Z AA1 R IY0 AH0,785,328,64,1806,2008
zaro,Z AE1 R OW0,1324,1075,150,1747,2008
zarr,Z AE1 R,141,94,50,1813,2008
zarre,Z AA1 R,873,775,92,1793,2008
zarro,Z AA1 R OW0,1065,437,155,1746,2008
zary,Z AA1 R IY0,292,216,73,1739,2007
zasada,Z AA0 S AA1 D AH0,655,319,55,1932,2008
zaun,Z AO1 N,509,398,112,1795,2008
zavala,Z AA0 V AA1 L AH0,173,68,32,1883,2008
zavery,Z EY1 V ER0 IY0,81,54,29,1947,2008
zayas,Z EY1 AA0 Z,91,65,30,1861,2008
zayed,Z EY1 AH0 D,62,52,27,1949,2008
zbigniew,Z B IH1 G N UW0,240,155,46,1949,2008
ze,Z IY1,313772,81205,314,1515,2008
zea,Z IY1,28445,7662,303,1630,2008
zeal,Z IY1 L,5196569,1250120,385,1524,2008
zealand,Z IY1 L AH0 N D,2204,808,133,1792,2008
zealanders,Z IY1 L AH0 N D ER0 Z,108,92,39,1800,2008
zealot,Z EH1 L AH0 T,126269,96491,294,1524,2008
zealotry,Z EH1 L AH0 T R IY0,29453,22053,197,1659,2008
zealots,Z EH1 L AH0 T S,252052,158403,314,1563,2008
zealous,Z EH1 L AH0 S,1921831,744317,388,1524,2008
zealously,Z IY1 L AH0 S L IY0,475576,305678,360,1507,2008
zebra,Z IY1 B R AH0,322318,109805,234,1664,2008
zebras,Z IY1 B R AH0 Z,99547,45836,231,1722,2008
zebulon,Z IY1 B AH0 L AH0 N,106,79,45,1855,2008
zecca,Z EH1 K AH0,2331,1109,168,1769,2008
zech,Z EH1 K,812,617,136,1725,2008
zecher,Z EH1 K ER0,513,261,51,1800,2008
zeck,Z EH1 K,189,134,55,1849,2008
zed,Z EH1 D,52597,35667,320,1515,2008
zedekiah,Z EH2 D AH0 K AY1 AH0,54,46,38,1728,2008
zedong,Z EY2 D AO1 NG,993,114,27,1980,2008
zee,Z IY1,61741,26280,274,1568,2008
zeeb,Z IY1 B,107,96,55,1698,2008
zeek,Z IY1 K,368,235,92,1811,2008
zeeland,Z IY1 L AH0 N D,119,78,41,1832,2008
zeeman,Z IY1 M AH0 N,561,368,71,1813,2008
zeese,Z IY1 Z,270,192,59,1824,2008
zeff,Z EH1 F,506,354,71,1877,2008
zeh,Z EH1,6696,3250,146,1741,2008
zehnder,Z EH1 N D ER0,88,68,27,1954,2008
zehner,Z EH1 N ER0,121,81,37,1838,2008
zehntel,Z EH1 N T EH2 L,119,101,58,1882,2008
zehr,Z EH1 R,424,272,71,1813,2008
zehren,Z EH1 R AH0 N,413,358,85,1795,2008
zeichner,Z AY1 K N ER0,61,41,27,1819,2007
zeidler,Z AY1 D AH0 L ER0,71,46,28,1931,2007
zeiger,Z AY1 G ER0,246,204,78,1778,2008
zeigler,Z AY1 G AH0 L ER0,171,135,44,1853,2008
zeiner,Z AY1 N ER0,251,188,58,1821,2008
zeis,Z IY1 Z,207,170,71,1777,2008
zeiss,Z AY1 S,198,132,50,1900,2008
zeit,Z AY1 T,15676,9574,213,1728,2008
zeitgeist,T S AY1 T G AY2 S T,23406,12916,104,1890,2008
zeitlin,Z AY1 T L IH0 N,213,133,47,1927,2008
zeitung,Z AY1 T AH0 NG,3088,1806,171,1797,2008
zeke,Z IY1 K,544,191,56,1824,2008
zel,Z EH1 L,5053,3784,239,1687,2008
zelazny,Z IH0 L AA1 Z N IY0,70,49,30,1901,2007
zelda,Z EH1 L D AH0,434,203,49,1869,2008
zeldin,Z EH1 L D IH0 N,68,54,26,1916,2005
zele,Z IY1 L,16127,10443,266,1658,2008
zelem,Z EH1 L AH0 M,1011,319,79,1816,2008
zeleny,Z IH0 L IY1 N IY0,352,178,52,1903,2008
zelia,Z EH1 L IY0 AH0,101,83,48,1698,2008
zelie,Z EH1 L IY0,59,40,25,1805,2007
zelinsky,Z IH0 L IH1 N S K IY0,149,105,30,1957,2005
zell,Z EH1 L,2421,1517,191,1715,2008
zelle,Z EH1 L,1454,1059,168,1781,2008
zeller,Z EH1 L ER0,677,376,91,1811,2008
zellers,Z EH1 L ER0 Z,69,51,20,1809,2008
zellner,Z EH1 L N ER0,63,44,24,1964,2008
zelman,Z EH1 L M AH0 N,90,87,44,1834,2008
zelos,Z IY1 L OW0 Z,1983,1193,166,1780,2008
zelotes,Z EH1 L AH0 T S,906,579,137,1737,2008
zeman,Z IY1 M AH0 N,2574,1126,136,1789,2008
zemel,Z EH1 M AH0 L,2273,1008,78,1854,2008
zemin,Z IY1 M IH0 N,1287,629,158,1765,2008
zen,Z EH1 N,62307,33758,288,1651,2008
zena,Z IY1 N AH0,3712,1786,147,1611,2008
zenaida,Z IH0 N EY1 D AH0,496,235,97,1828,2008
zenas,Z IY1 N AH0 Z,135,108,67,1738,2008
zenda,Z EH1 N D AH0,300,203,75,1809,2008
zender,Z EH1 N D ER0,166,122,52,1847,2008
zeng,Z EH1 NG,1983,1051,89,1803,2008
zenger,Z IY1 N JH ER0,167,111,53,1839,2008
zenia,Z EY1 N IY0 AH0,368,241,80,1807,2008
zenith,Z IY1 N AH0 TH,912552,426197,289,1507,2008
zenk,Z EH1 NG K,420,51,28,1855,2008
zenker,Z EH1 NG K ER0,51,41,32,1910,2008
zenna,Z EH1 N AH0,215,172,64,1818,2008
zenner,Z EH1 N ER0,70,48,24,1912,2008
zeno,Z EY1 N OW0,2239,953,160,1631,2008
zenobia,Z AH0 N OW1 B IY0 AH0,641,345,112,1782,2008
zenon,Z IY1 N AH0 N,983,707,99,1830,2008
zens,Z EH1 N Z,22370,20196,303,1656,2008
zent,Z EH1 N T,1627,1175,170,1787,2008
zentner,Z EH1 N T N ER0,581,245,94,1835,2008
zenz,Z EH1 N Z,117,105,52,1901,2008
zeoli,Z IY0 AA1 L IY0,67,49,31,1742,2002
zepa,Z EH1 P AH0,67,53,29,1755,2008
zephyr,Z EH1 F ER0,67425,50909,261,1635,2008
zephyrs,Z EH1 F ER0 Z,48549,37937,271,1701,2008
zepp,Z EH1 P,338,110,48,1916,2008
zeppelin,Z EH1 P IH0 L IH0 N,20765,9884,100,1871,2008
zera,Z EH1 R AH0,3233,1744,197,1759,2008
zerbe,Z IH1 R B,46,43,26,1877,2008
zern,Z IH1 R N,377,321,109,1789,2008
zero,Z IH1 R OW0,16130266,1480179,249,1515,2008
zeroed,Z IH1 R OW0 D,86988,62208,100,1838,2008
zeroes,Z IH1 R OW0 Z,97683,48563,154,1590,2008
zeroing,Z IY1 R OW0 IH0 NG,49479,34753,81,1824,2008
zeros,Z IH1 R OW0 Z,652401,146120,202,1678,2008
zerr,Z IH1 R,244,208,78,1824,2008
zervos,Z IH1 R V OW0 Z,135,95,39,1947,2005
zest,Z EH1 S T,810290,441834,258,1574,2008
zestful,Z EH1 S T F AH0 L,31664,26273,168,1782,2008
zeta,Z EY1 T AH0,90215,19062,189,1762,2008
zettel,Z EH1 T AH0 L,263,176,71,1822,2008
zettle,Z EH1 T AH0 L,100,79,46,1827,2008
zeus,Z UW1 S,3486,1318,175,1697,2008
zev,Z EH1 V,376,285,82,1827,2008
zeva,Z EY1 V AH0,90,58,40,1864,2008
zhan,Z AA1 N,7711,3538,134,1768,2008
zhang,ZH AE1 NG,16367,4379,61,1820,2008
zhao,ZH AW1,7675,2299,48,1946,2008
zhejiang,ZH IY1 JH AA1 NG,374,96,25,1980,2008
zheng,Z EH1 NG,22022,5334,55,1854,2008
zhengzhou,ZH EH1 NG G ZH UW2,105,41,19,1980,2008
zhivago,ZH IH0 V AA1 G OW0,226,179,46,1955,2008
zhou,ZH UW1,11802,3819,58,1855,2008
zhu,ZH UW1,20589,5918,122,1812,2008
zhuhai,ZH UW1 HH AY1,106,45,19,1980,2007
zi,Z IY1,151377,69718,344,1621,2008
zia,Z IY1 AH0,7551,3716,218,1702,2008
ziad,Z IY1 AE0 D,76,72,45,1792,2008
zich,Z IH1 CH,53074,9107,182,1659,2008
zick,Z IH1 K,991,657,157,1721,2008
zieg,Z IY1 G,73,58,30,1897,2006
zieger,Z IY1 G ER0,99,72,38,1829,2008
ziegfeld,Z IH1 G F EH0 L D,142,96,48,1914,2008
ziegler,Z IY1 G L ER0,838,568,69,1825,2008
ziehl,Z IY1 L,55,48,33,1896,2007
ziel,Z IY1 L,2776,1683,156,1699,2008
zielinski,Z IY0 L IH1 N S K IY0,77,51,30,1930,2008
zier,Z IH1 R,2141,1572,224,1702,2008
ziff,Z IH1 F,636,333,92,1824,2008
zig,Z IH1 G,252981,148433,258,1637,2008
ziggurat,Z IH1 G ER0 AE2 T,45687,15885,140,1858,2008
ziggurats,Z IH1 G ER0 AE2 T S,15912,9113,126,1862,2008
zigler,Z AY1 G AH0 L ER0,215,98,32,1922,2008
zigzag,Z IH1 G Z AE0 G,514598,261937,247,1745,2008
zigzagged,Z IH1 G Z AE0 G D,69822,57845,198,1783,2008
zigzagging,Z IH1 G Z AE0 G IH0 NG,94544,71178,177,1664,2008
zigzags,Z IH1 G Z AE0 G Z,115456,73317,235,1755,2008
zika,Z IH1 K AH0,598,351,76,1828,2008
zike,Z AY1 K,182,116,50,1822,2008
zil,Z IH1 L,6738,4661,241,1701,2008
zilber,Z IH1 L B ER0,143,64,31,1839,2008
zilch,Z IH1 L CH,14814,12137,58,1807,2008
zile,Z AY1 L,2541,986,150,1712,2008
zill,Z IH1 L,1485,754,125,1801,2008
zilla,Z IH1 L AH0,15114,2864,142,1760,2008
zillah,Z IH1 L AH0,14135,1742,192,1789,2008
ziller,Z IH1 L ER0,117,96,42,1872,2007
zillion,Z IH1 L Y AH0 N,35808,26231,74,1761,2008
zillionaire,Z IH1 L Y AH0 N EH2 R,1508,1256,55,1949,2008
zillions,Z IH1 L Y AH0 N Z,14286,11181,66,1926,2008
zim,Z IH1 M,4436,2811,204,1702,2008
zima,Z IY1 M AH0,3816,1347,124,1806,2008
zimbabwe,Z IH0 M B AA1 B W EY0,1773,413,51,1896,2008
zimbalist,Z IH1 M B AH0 L IH0 S T,48,44,28,1913,2007
zimmer,Z IH1 M ER0,3571,2237,162,1761,2008
zimmerman,Z IH1 M ER0 M AH0 N,468,174,50,1801,2008
zimmermann,Z IH1 M ER0 M AH0 N,698,452,84,1827,2008
zimmers,Z IH1 M ER0 Z,176,135,44,1761,2008
zimny,Z IH1 M N IY0,147,93,40,1870,2008
zinc,Z IH1 NG K,4646864,462726,252,1645,2008
zinck,Z IH1 NG K,164,103,53,1762,2008
zinda,Z IH1 N D AH0,670,478,76,1817,2008
zinder,Z IH1 N D ER0,127,78,46,1826,2008
zine,Z AY1 N,62155,26383,248,1710,2008
zines,Z AY1 N Z,42715,15826,248,1676,2008
zinfandel,Z IH1 N F AH0 N D EH2 L,7099,3576,77,1888,2008
zing,Z IH1 NG,46817,36865,302,1515,2008
zinga,Z IH1 NG AH0,670,288,82,1838,2008
zingaro,Z IH0 NG G AA1 R OW0,498,320,79,1842,2008
zinger,Z IH1 NG ER0,10066,8304,120,1780,2008
zingg,Z IH1 NG G,68,51,29,1927,2007
zinia,Z IY1 N IY0 AH0,116,90,52,1824,2008
zink,Z IH1 NG K,8052,4261,228,1700,2008
zinke,Z IH1 NG K,228,132,65,1811,2008
zinn,Z IH1 N,713,618,135,1757,2008
zinner,Z IH1 N ER0,74,58,41,1804,2008
zinni,Z IH1 N IY0,116,51,33,1855,2008
zinnia,Z IH1 N IY0 AH0,16404,8141,162,1775,2008
zinnias,Z IH1 N IY0 AH0 Z,34201,19873,156,1771,2008
zins,Z IH1 N Z,1223,709,147,1747,2008
zion,Z AY1 AH0 N,3234,2181,190,1704,2008
zionism,Z AY1 AH0 N IH2 Z AH0 M,4500,1685,71,1910,2008
zionist,Z AY1 AH0 N IH0 S T,4997,1543,71,1909,2008
zionists,Z AY1 AH0 N IH0 S T S,1075,299,50,1918,2008
zions,Z AY1 AH0 N Z,127,111,50,1811,2008
zip,Z IH1 P,450211,196564,235,1676,2008
zipf,Z IH1 P F,547,299,46,1882,2008
zipfel,Z IH1 P F AH0 L,75,65,40,1864,2008
zipless,Z IH1 P L AH0 S,2268,1399,40,1926,2008
zipp,Z IH1 P,1043,563,108,1829,2008
zipped,Z IH1 P T,147892,98106,124,1870,2008
zipper,Z IH1 P ER0,264321,111272,108,1738,2008
zippered,Z IH1 P ER0 D,34636,25159,80,1900,2008
zippering,Z IH1 P ER0 IH0 NG,2457,1584,60,1941,2008
zippers,Z IH1 P ER0 Z,63519,38774,86,1870,2008
zipping,Z IH1 P IH0 NG,62961,50946,132,1800,2008
zippo,Z IH1 P OW0,2184,1588,59,1920,2008
zippy,Z IH1 P IY0,10686,8695,99,1843,2008
zips,Z IH1 P S,30118,22709,127,1803,2008
zirbel,Z ER1 B AH0 L,71,57,33,1767,2008
zircon,Z ER1 K AH0 N,185168,27344,210,1738,2008
zirconium,Z ER0 K OW1 N IY0 AH0 M,274344,44665,195,1810,2008
zirconiums,Z ER0 K OW1 N IY0 AH0 M Z,103,90,27,1951,2008
zircons,Z ER1 K AA0 N Z,40701,6988,181,1801,2008
zirk,Z ER1 K,81,66,38,1888,2006
zirkel,Z ER1 K AH0 L,147,76,45,1837,2007
zirkle,Z ER1 K AH0 L,76,40,21,1938,2006
zisa,Z AY1 S AH0,104,85,46,1764,2008
zisk,Z IH1 S K,89,55,33,1855,2008
ziska,Z IH1 S K AH0,177,80,46,1803,2008
zita,Z IY1 T AH0,919,544,100,1525,2008
zither,Z IH1 DH ER0,65211,28636,170,1698,2008
zithers,Z IH1 DH ER0 Z,13237,6908,141,1749,2008
zito,Z IY1 T OW0,665,433,86,1811,2008
ziv,Z IH1 V,3276,2562,215,1711,2008
ziwei,Z IY1 W EY0,382,203,27,1887,2008
ziyad,Z IY1 AE0 D,72,57,29,1901,2008
ziyang,ZH IY0 AE1 NG,841,67,24,1980,2008
zlata,Z L AA1 T AH2,518,327,59,1863,2008
zlin,Z L IH1 N,194,83,43,1764,2006
zloty,Z L AO1 T IY0,46014,9507,100,1842,2008
zlotys,Z L AO1 T IY0 Z,67999,8675,87,1897,2008
zobel,Z OW1 B AH0 L,296,141,56,1841,2008
zoch,Z AA1 K,649,388,89,1729,2008
zocor,Z OW1 K ER0,54,49,14,1994,2008
zodiac,Z OW1 D IY0 AE2 K,302880,93557,279,1507,2008
zoe,Z OW1 IY0,14692,5727,220,1507,2008
zoete,Z OW1 T IY0,452,311,74,1814,2008
zofran,Z OW1 F R AE2 N,73,47,16,1962,2008
zoh,Z OW1,2767,1539,110,1729,2008
zola,Z OW1 L AH0,1347,1013,130,1673,2008
zoll,Z AA1 L,1490,808,144,1805,2008
zoller,Z AA1 L ER0,101,76,41,1635,2008
zollinger,Z AA1 L IH0 NG ER0,76,46,25,1961,2008
zoloft,Z AA1 L AA0 F T,118,71,15,1980,2008
zoltan,Z OW1 L T AH0 N,194,164,52,1933,2008
zombie,Z AA1 M B IY0,133772,63254,89,1763,2008
zombies,Z AA1 M B IY0 Z,93708,42066,85,1838,2008
zon,Z AO1 N,21830,14971,272,1650,2008
zona,Z OW1 N AH0,309442,52729,235,1507,2008
zondervan,Z AA1 N D ER0 V AE0 N,71,59,22,1972,2008
zone,Z OW1 N,14428889,1493005,307,1507,2008
zoned,Z OW1 N D,208611,74092,230,1600,2008
zones,Z OW1 N Z,6024512,982324,281,1507,2008
zoning,Z OW1 N IH0 NG,1530077,185573,164,1600,2008
zoo,Z UW1,839572,324390,322,1589,2008
zook,Z UH1 K,573,345,107,1794,2008
zoological,Z UW2 L AA1 JH IH0 K AH0 L,339942,150356,225,1746,2008
zoologist,Z OW0 AA1 L AH0 JH AH0 S T,154206,84046,231,1746,2008
zoologists,Z OW0 AA1 L AH0 JH AH0 S T S,123612,60049,226,1705,2008
zoology,Z OW0 AA1 L AH0 JH IY0,421385,179701,244,1607,2008
zoom,Z UW1 M,491913,131685,262,1713,2008
zoomed,Z UW1 M D,146491,92810,99,1838,2008
zooming,Z UW1 M IH0 NG,136133,76448,104,1838,2008
zooms,Z UW1 M Z,62138,36371,114,1783,2008
zoos,Z UW1 Z,198770,76927,182,1667,2008
zopfi,Z OW1 P F IY0,160,120,62,1891,2008
zora,Z AO1 R AH0,1217,714,112,1766,2008
zorah,Z AO1 R AH0,57,46,28,1833,2007
zoran,Z AO1 R AH0 N,102,67,27,1860,2008
zorn,Z AO1 R N,1950,885,121,1803,2008
zornes,Z AO1 R N Z,131,54,26,1901,2007
zorro,Z AO1 R OW2,5258,1764,103,1809,2008
zorz,Z AO1 R Z,159,154,78,1824,2008
zosen,Z OW1 Z AH0 N,321,134,51,1811,2008
zoss,Z AO1 S,46,42,29,1849,2008
zoster,Z AA1 S T ER0,313546,36536,198,1783,2008
zounds,Z AW1 N D Z,6179,4601,232,1688,2008
zovirax,Z OW1 V IH0 R AE0 K S,56,47,20,1979,2008
zovut,Z OW1 V AH0 T,182,139,41,1956,2008
zsa,ZH AA1,600,391,104,1695,2008
zuba,Z UW1 B AH0,475,216,61,1837,2008
zube,Z UW1 B,326,134,46,1859,2007
zuber,Z UW1 B ER0,183,119,60,1763,2008
zubin,Z UW1 B IH0 N,215,121,41,1913,2007
zuccaro,Z UW0 K AA1 R OW0,292,208,86,1722,2008
zucchini,Z UW0 K IY1 N IY0,215196,40976,89,1910,2008
zucco,Z UW1 K OW0,103,86,45,1808,2008
zuch,Z AH1 CH,1017,687,157,1722,2008
zuck,Z AH1 K,267,149,64,1824,2008
zucker,Z AH1 K ER0,1156,763,116,1828,2008
zuckerman,Z AH1 K ER0 M AH0 N,549,295,59,1939,2008
zue,Z UW1,7451,2768,190,1670,2008
zufall,Z UW1 F AH0 L,140,111,52,1841,2008
zug,Z AH1 G,3588,1959,168,1799,2008
zuidema,Z UW0 IH0 D EH1 M AH0,56,46,26,1950,2006
zuk,Z AH1 K,924,538,103,1680,2008
zuker,Z UW1 K ER0,82,68,27,1812,2008
zukin,Z UW1 K IH0 N,557,244,65,1891,2008
zulfikar,Z AH2 L F IH0 K AA1 R,109,47,25,1841,2007
zulma,Z UH1 L M AH0,169,74,33,1944,2008
zulu,Z UW1 L UW2,3159,1718,125,1846,2008
zulus,Z UW1 L UW0 Z,443,262,74,1824,2008
zumel,Z UW2 M EH1 L,46,44,30,1738,2008
zungu,Z AH2 NG UW1,207,130,46,1881,2008
zuni,Z UW1 N IY2,1072,816,145,1805,2008
zuniga,Z UW0 N IY1 G AH0,240,88,48,1852,2007
zupan,Z UW1 P AH0 N,2422,720,107,1833,2008
zurcher,Z ER1 K ER0,179,137,42,1905,2007
zurek,Z UH1 R EH0 K,128,87,31,1874,2008
zuri,Z UH1 R IY0,1265,638,101,1824,2008
zurich,Z UH1 R IH0 K,1006,455,94,1814,2008
zurita,Z ER0 AY1 T AH0,43,40,22,1704,2002
zurn,Z ER1 N,2206,1870,150,1787,2008
zuver,Z UW1 V ER0,53,50,31,1829,2008
zuzana,Z UW2 Z AA1 N AH0,64,40,17,1967,2008
zuzu,Z UW1 Z UW2,463,343,79,1791,2008
zwart,Z W AO1 R T,2168,1155,118,1814,2008
zweifel,Z W AY1 F AH0 L,477,370,110,1798,2008
zweig,Z W AY1 G,887,713,94,1813,2008
zwick,Z W IH1 K,121,83,39,1894,2008
zwicker,Z W IH1 K ER0,129,58,28,1950,2007
zwicky,Z W IH1 K IY0,80,53,30,1928,2007
zwiebel,Z W IY1 B AH0 L,85,70,37,1847,2008
zwilling,Z W IH1 L IH0 NG,72,52,26,1881,2008
zydeco,Z AY1 D AH0 K OW2,16046,3520,39,1960,2008
zygmunt,Z IH1 G M AH0 N T,140,100,36,1933,2008
zygote,Z AY1 G OW0 T,272494,41855,127,1818,2008
zysk,Z AY1 S K,299,69,35,1932,2008